OFPT_PACKET_IN (xid=0x0): total_len=66 in_port=1 (via action) data_len=66 (unbuffered)
priority0:tunnel0:in_port0001:tci(0) mac00:00:00:00:00:38->00:00:00:00:00:27 type0800 proto6 tos0 ttl64 ip10.0.0.38->10.0.0.27 port60741->52328
00:00:00:00:00:38 > 00:00:00:00:00:27, ethertype IPv4 (0x0800), length 66: 10.0.0.38.60741 > 10.0.0.27.52328: Flags [.], ack 1304724537, win 1562, options [nop,nop,TS val 4643082 ecr 4643002], length 0
OFPT_PACKET_IN (xid=0x0): total_len=1514 in_port=4 (via action) data_len=1514 (unbuffered)
priority0:tunnel0:in_port0004:tci(0) mac00:00:00:00:00:13->00:00:00:00:00:20 type0800 proto6 tos0 ttl64 ip10.0.0.13->10.0.0.20 port55914->44789
00:00:00:00:00:13 > 00:00:00:00:00:20, ethertype IPv4 (0x0800), length 1514: 10.0.0.13.55914 > 10.0.0.20.44789: Flags [.], seq 3176846267:3176847715, ack 90392257, win 229, options [nop,nop,TS val 4643251 ecr 4643193], length 1448
OFPT_PACKET_IN (xid=0x0): total_len=67 in_port=10 (via action) data_len=67 (unbuffered)
priority0:tunnel0:in_port000a:tci(0) mac00:00:00:00:00:19->00:00:00:00:00:06 type0800 proto6 tos0 ttl64 ip10.0.0.19->10.0.0.6 port43130->47226
00:00:00:00:00:19 > 00:00:00:00:00:06, ethertype IPv4 (0x0800), length 67: 10.0.0.19.43130 > 10.0.0.6.47226: Flags [P.], seq 1586446621:1586446622, ack 1075414530, win 229, options [nop,nop,TS val 4643257 ecr 4642915], length 1
OFPT_PACKET_IN (xid=0x0): total_len=66 in_port=11 (via action) data_len=66 (unbuffered)
priority0:tunnel0:in_port000b:tci(0) mac00:00:00:00:00:20->00:00:00:00:00:13 type0800 proto6 tos0 ttl64 ip10.0.0.20->10.0.0.13 port44789->55914
00:00:00:00:00:20 > 00:00:00:00:00:13, ethertype IPv4 (0x0800), length 66: 10.0.0.20.44789 > 10.0.0.13.55914: Flags [.], ack 3176817307, win 1041, options [nop,nop,TS val 4643251 ecr 4643193], length 0
OFPT_PACKET_IN (xid=0x0): total_len=66 in_port=1 (via action) data_len=66 (unbuffered)
priority0:tunnel0:in_port0001:tci(0) mac00:00:00:00:00:38->00:00:00:00:00:27 type0800 proto6 tos0 ttl64 ip10.0.0.38->10.0.0.27 port60741->52328
00:00:00:00:00:38 > 00:00:00:00:00:27, ethertype IPv4 (0x0800), length 66: 10.0.0.38.60741 > 10.0.0.27.52328: Flags [.], ack 1304727433, win 1562, options [nop,nop,TS val 4643082 ecr 4643002], length 0
OFPT_PACKET_IN (xid=0x0): total_len=1514 in_port=4 (via action) data_len=1514 (unbuffered)
priority0:tunnel0:in_port0004:tci(0) mac00:00:00:00:00:13->00:00:00:00:00:20 type0800 proto6 tos0 ttl64 ip10.0.0.13->10.0.0.20 port55914->44789
00:00:00:00:00:13 > 00:00:00:00:00:20, ethertype IPv4 (0x0800), length 1514: 10.0.0.13.55914 > 10.0.0.20.44789: Flags [.], seq 3176847715:3176849163, ack 90392257, win 229, options [nop,nop,TS val 4643251 ecr 4643193], length 1448
OFPT_PACKET_IN (xid=0x0): total_len=66 in_port=11 (via action) data_len=66 (unbuffered)
priority0:tunnel0:in_port000b:tci(0) mac00:00:00:00:00:20->00:00:00:00:00:13 type0800 proto6 tos0 ttl64 ip10.0.0.20->10.0.0.13 port44789->55914
00:00:00:00:00:20 > 00:00:00:00:00:13, ethertype IPv4 (0x0800), length 66: 10.0.0.20.44789 > 10.0.0.13.55914: Flags [.], ack 3176820203, win 1041, options [nop,nop,TS val 4643252 ecr 4643193], length 0
OFPT_PACKET_IN (xid=0x0): total_len=1514 in_port=1 (via action) data_len=1514 (unbuffered)
priority0:tunnel0:in_port0001:tci(0) mac00:00:00:00:00:25->00:00:00:00:00:01 type0800 proto6 tos0 ttl64 ip10.0.0.25->10.0.0.1 port38875->57670
00:00:00:00:00:25 > 00:00:00:00:00:01, ethertype IPv4 (0x0800), length 1514: 10.0.0.25.38875 > 10.0.0.1.57670: Flags [.], seq 2491864034:2491865482, ack 2892286238, win 229, options [nop,nop,TS val 4643071 ecr 4642912], length 1448
OFPT_PACKET_IN (xid=0x0): total_len=1514 in_port=4 (via action) data_len=1514 (unbuffered)
priority0:tunnel0:in_port0004:tci(0) mac00:00:00:00:00:13->00:00:00:00:00:20 type0800 proto6 tos0 ttl64 ip10.0.0.13->10.0.0.20 port55914->44789
00:00:00:00:00:13 > 00:00:00:00:00:20, ethertype IPv4 (0x0800), length 1514: 10.0.0.13.55914 > 10.0.0.20.44789: Flags [.], seq 3176849163:3176850611, ack 90392257, win 229, options [nop,nop,TS val 4643251 ecr 4643193], length 1448
OFPT_PACKET_IN (xid=0x0): total_len=66 in_port=11 (via action) data_len=66 (unbuffered)
priority0:tunnel0:in_port000b:tci(0) mac00:00:00:00:00:20->00:00:00:00:00:13 type0800 proto6 tos0 ttl64 ip10.0.0.20->10.0.0.13 port44789->55914
00:00:00:00:00:20 > 00:00:00:00:00:13, ethertype IPv4 (0x0800), length 66: 10.0.0.20.44789 > 10.0.0.13.55914: Flags [.], ack 3176823099, win 1041, options [nop,nop,TS val 4643252 ecr 4643193], length 0
OFPT_PACKET_IN (xid=0x0): total_len=66 in_port=1 (via action) data_len=66 (unbuffered)
priority0:tunnel0:in_port0001:tci(0) mac00:00:00:00:00:01->00:00:00:00:00:25 type0800 proto6 tos0 ttl64 ip10.0.0.1->10.0.0.25 port57670->38875
00:00:00:00:00:01 > 00:00:00:00:00:25, ethertype IPv4 (0x0800), length 66: 10.0.0.1.57670 > 10.0.0.25.38875: Flags [.], ack 2491769914, win 3394, options [nop,nop,TS val 4643149 ecr 4642944], length 0
OFPT_PACKET_IN (xid=0x0): total_len=1514 in_port=4 (via action) data_len=1514 (unbuffered)
priority0:tunnel0:in_port0004:tci(0) mac00:00:00:00:00:13->00:00:00:00:00:20 type0800 proto6 tos0 ttl64 ip10.0.0.13->10.0.0.20 port55914->44789
00:00:00:00:00:13 > 00:00:00:00:00:20, ethertype IPv4 (0x0800), length 1514: 10.0.0.13.55914 > 10.0.0.20.44789: Flags [.], seq 3176850611:3176852059, ack 90392257, win 229, options [nop,nop,TS val 4643251 ecr 4643193], length 1448
OFPT_PACKET_IN (xid=0x0): total_len=66 in_port=11 (via action) data_len=66 (unbuffered)
priority0:tunnel0:in_port000b:tci(0) mac00:00:00:00:00:20->00:00:00:00:00:13 type0800 proto6 tos0 ttl64 ip10.0.0.20->10.0.0.13 port44789->55914
00:00:00:00:00:20 > 00:00:00:00:00:13, ethertype IPv4 (0x0800), length 66: 10.0.0.20.44789 > 10.0.0.13.55914: Flags [.], ack 3176825995, win 1041, options [nop,nop,TS val 4643252 ecr 4643193], length 0
OFPT_PACKET_IN (xid=0x0): total_len=66 in_port=1 (via action) data_len=66 (unbuffered)
priority0:tunnel0:in_port0001:tci(0) mac00:00:00:00:00:07->00:00:00:00:00:02 type0800 proto6 tos0 ttl64 ip10.0.0.7->10.0.0.2 port49636->12865
00:00:00:00:00:07 > 00:00:00:00:00:02, ethertype IPv4 (0x0800), length 66: 10.0.0.7.49636 > 10.0.0.2.12865: Flags [.], ack 2230717882, win 245, options [nop,nop,TS val 4643149 ecr 4643109], length 0
OFPT_PACKET_IN (xid=0x0): total_len=1514 in_port=4 (via action) data_len=1514 (unbuffered)
priority0:tunnel0:in_port0004:tci(0) mac00:00:00:00:00:13->00:00:00:00:00:20 type0800 proto6 tos0 ttl64 ip10.0.0.13->10.0.0.20 port55914->44789
00:00:00:00:00:13 > 00:00:00:00:00:20, ethertype IPv4 (0x0800), length 1514: 10.0.0.13.55914 > 10.0.0.20.44789: Flags [.], seq 3176852059:3176853507, ack 90392257, win 229, options [nop,nop,TS val 4643251 ecr 4643193], length 1448
OFPT_PACKET_IN (xid=0x0): total_len=66 in_port=11 (via action) data_len=66 (unbuffered)
priority0:tunnel0:in_port000b:tci(0) mac00:00:00:00:00:20->00:00:00:00:00:13 type0800 proto6 tos0 ttl64 ip10.0.0.20->10.0.0.13 port44789->55914
00:00:00:00:00:20 > 00:00:00:00:00:13, ethertype IPv4 (0x0800), length 66: 10.0.0.20.44789 > 10.0.0.13.55914: Flags [.], ack 3176828891, win 1041, options [nop,nop,TS val 4643252 ecr 4643193], length 0
OFPT_PACKET_IN (xid=0x0): total_len=66 in_port=1 (via action) data_len=66 (unbuffered)
priority0:tunnel0:in_port0001:tci(0) mac00:00:00:00:00:09->00:00:00:00:00:02 type0800 proto6 tos0 ttl64 ip10.0.0.9->10.0.0.2 port58506->12865
00:00:00:00:00:09 > 00:00:00:00:00:02, ethertype IPv4 (0x0800), length 66: 10.0.0.9.58506 > 10.0.0.2.12865: Flags [.], ack 3835931956, win 245, options [nop,nop,TS val 4643149 ecr 4643109], length 0
OFPT_PACKET_IN (xid=0x0): total_len=1514 in_port=4 (via action) data_len=1514 (unbuffered)
priority0:tunnel0:in_port0004:tci(0) mac00:00:00:00:00:13->00:00:00:00:00:20 type0800 proto6 tos0 ttl64 ip10.0.0.13->10.0.0.20 port55914->44789
00:00:00:00:00:13 > 00:00:00:00:00:20, ethertype IPv4 (0x0800), length 1514: 10.0.0.13.55914 > 10.0.0.20.44789: Flags [.], seq 3176853507:3176854955, ack 90392257, win 229, options [nop,nop,TS val 4643251 ecr 4643193], length 1448
OFPT_PACKET_IN (xid=0x0): total_len=42 in_port=11 (via action) data_len=42 (unbuffered)
priority0:tunnel0:in_port000b:tci(0) mac00:00:00:00:00:20->00:00:00:00:00:35 type0806 proto2 tos0 ttl0 ip10.0.0.20->10.0.0.35 arp_ha00:00:00:00:00:20->00:00:00:00:00:35
00:00:00:00:00:20 > 00:00:00:00:00:35, ethertype ARP (0x0806), length 42: Reply 10.0.0.20 is-at 00:00:00:00:00:20, length 28
OFPT_PACKET_IN (xid=0x0): total_len=66 in_port=1 (via action) data_len=66 (unbuffered)
priority0:tunnel0:in_port0001:tci(0) mac00:00:00:00:00:01->00:00:00:00:00:25 type0800 proto6 tos0 ttl64 ip10.0.0.1->10.0.0.25 port57670->38875
00:00:00:00:00:01 > 00:00:00:00:00:25, ethertype IPv4 (0x0800), length 66: 10.0.0.1.57670 > 10.0.0.25.38875: Flags [.], ack 2491772810, win 3394, options [nop,nop,TS val 4643150 ecr 4642944], length 0
OFPT_PACKET_IN (xid=0x0): total_len=1514 in_port=4 (via action) data_len=1514 (unbuffered)
priority0:tunnel0:in_port0004:tci(0) mac00:00:00:00:00:13->00:00:00:00:00:20 type0800 proto6 tos0 ttl64 ip10.0.0.13->10.0.0.20 port55914->44789
00:00:00:00:00:13 > 00:00:00:00:00:20, ethertype IPv4 (0x0800), length 1514: 10.0.0.13.55914 > 10.0.0.20.44789: Flags [.], seq 3176854955:3176856403, ack 90392257, win 229, options [nop,nop,TS val 4643252 ecr 4643193], length 1448
OFPT_PACKET_IN (xid=0x0): total_len=66 in_port=1 (via action) data_len=66 (unbuffered)
priority0:tunnel0:in_port0001:tci(0) mac00:00:00:00:00:02->00:00:00:00:00:06 type0800 proto6 tos0 ttl64 ip10.0.0.2->10.0.0.6 port12865->46597
00:00:00:00:00:02 > 00:00:00:00:00:06, ethertype IPv4 (0x0800), length 66: 10.0.0.2.12865 > 10.0.0.6.46597: Flags [F.], seq 3660749538, ack 2183793430, win 243, options [nop,nop,TS val 4643150 ecr 4643125], length 0
OFPT_PACKET_IN (xid=0x0): total_len=1514 in_port=4 (via action) data_len=1514 (unbuffered)
priority0:tunnel0:in_port0004:tci(0) mac00:00:00:00:00:13->00:00:00:00:00:20 type0800 proto6 tos0 ttl64 ip10.0.0.13->10.0.0.20 port55914->44789
00:00:00:00:00:13 > 00:00:00:00:00:20, ethertype IPv4 (0x0800), length 1514: 10.0.0.13.55914 > 10.0.0.20.44789: Flags [.], seq 3176856403:3176857851, ack 90392257, win 229, options [nop,nop,TS val 4643252 ecr 4643193], length 1448
OFPT_PACKET_IN (xid=0x0): total_len=1514 in_port=1 (via action) data_len=1514 (unbuffered)
priority0:tunnel0:in_port0001:tci(0) mac00:00:00:00:00:27->00:00:00:00:00:38 type0800 proto6 tos0 ttl64 ip10.0.0.27->10.0.0.38 port52328->60741
00:00:00:00:00:27 > 00:00:00:00:00:38, ethertype IPv4 (0x0800), length 1514: 10.0.0.27.52328 > 10.0.0.38.60741: Flags [.], seq 1304769425:1304770873, ack 2176693538, win 229, options [nop,nop,TS val 4643071 ecr 4642999], length 1448
OFPT_PACKET_IN (xid=0x0): total_len=1514 in_port=1 (via action) data_len=1514 (unbuffered)
priority0:tunnel0:in_port0001:tci(0) mac00:00:00:00:00:25->00:00:00:00:00:01 type0800 proto6 tos0 ttl64 ip10.0.0.25->10.0.0.1 port38875->57670
00:00:00:00:00:25 > 00:00:00:00:00:01, ethertype IPv4 (0x0800), length 1514: 10.0.0.25.38875 > 10.0.0.1.57670: Flags [.], seq 2491865482:2491866930, ack 2892286238, win 229, options [nop,nop,TS val 4643071 ecr 4642912], length 1448
OFPT_PACKET_IN (xid=0x0): total_len=1514 in_port=1 (via action) data_len=1514 (unbuffered)
priority0:tunnel0:in_port0001:tci(0) mac00:00:00:00:00:27->00:00:00:00:00:38 type0800 proto6 tos0 ttl64 ip10.0.0.27->10.0.0.38 port52328->60741
00:00:00:00:00:27 > 00:00:00:00:00:38, ethertype IPv4 (0x0800), length 1514: 10.0.0.27.52328 > 10.0.0.38.60741: Flags [.], seq 1304770873:1304772321, ack 2176693538, win 229, options [nop,nop,TS val 4643071 ecr 4642999], length 1448
OFPT_PACKET_IN (xid=0x0): total_len=1514 in_port=1 (via action) data_len=1514 (unbuffered)
priority0:tunnel0:in_port0001:tci(0) mac00:00:00:00:00:25->00:00:00:00:00:01 type0800 proto6 tos0 ttl64 ip10.0.0.25->10.0.0.1 port38875->57670
00:00:00:00:00:25 > 00:00:00:00:00:01, ethertype IPv4 (0x0800), length 1514: 10.0.0.25.38875 > 10.0.0.1.57670: Flags [.], seq 2491866930:2491868378, ack 2892286238, win 229, options [nop,nop,TS val 4643071 ecr 4642916], length 1448
OFPT_PACKET_IN (xid=0x0): total_len=1514 in_port=1 (via action) data_len=1514 (unbuffered)
priority0:tunnel0:in_port0001:tci(0) mac00:00:00:00:00:27->00:00:00:00:00:38 type0800 proto6 tos0 ttl64 ip10.0.0.27->10.0.0.38 port52328->60741
00:00:00:00:00:27 > 00:00:00:00:00:38, ethertype IPv4 (0x0800), length 1514: 10.0.0.27.52328 > 10.0.0.38.60741: Flags [.], seq 1304772321:1304773769, ack 2176693538, win 229, options [nop,nop,TS val 4643071 ecr 4642999], length 1448
OFPT_PACKET_IN (xid=0x0): total_len=1514 in_port=1 (via action) data_len=1514 (unbuffered)
priority0:tunnel0:in_port0001:tci(0) mac00:00:00:00:00:25->00:00:00:00:00:01 type0800 proto6 tos0 ttl64 ip10.0.0.25->10.0.0.1 port38875->57670
00:00:00:00:00:25 > 00:00:00:00:00:01, ethertype IPv4 (0x0800), length 1514: 10.0.0.25.38875 > 10.0.0.1.57670: Flags [.], seq 2491868378:2491869826, ack 2892286238, win 229, options [nop,nop,TS val 4643071 ecr 4642916], length 1448
OFPT_PACKET_IN (xid=0x0): total_len=1514 in_port=1 (via action) data_len=1514 (unbuffered)
priority0:tunnel0:in_port0001:tci(0) mac00:00:00:00:00:27->00:00:00:00:00:38 type0800 proto6 tos0 ttl64 ip10.0.0.27->10.0.0.38 port52328->60741
00:00:00:00:00:27 > 00:00:00:00:00:38, ethertype IPv4 (0x0800), length 1514: 10.0.0.27.52328 > 10.0.0.38.60741: Flags [.], seq 1304773769:1304775217, ack 2176693538, win 229, options [nop,nop,TS val 4643071 ecr 4642999], length 1448
OFPT_PACKET_IN (xid=0x0): total_len=1514 in_port=1 (via action) data_len=1514 (unbuffered)
priority0:tunnel0:in_port0001:tci(0) mac00:00:00:00:00:25->00:00:00:00:00:01 type0800 proto6 tos0 ttl64 ip10.0.0.25->10.0.0.1 port38875->57670
00:00:00:00:00:25 > 00:00:00:00:00:01, ethertype IPv4 (0x0800), length 1514: 10.0.0.25.38875 > 10.0.0.1.57670: Flags [.], seq 2491869826:2491871274, ack 2892286238, win 229, options [nop,nop,TS val 4643071 ecr 4642916], length 1448
OFPT_PACKET_IN (xid=0x0): total_len=1514 in_port=1 (via action) data_len=1514 (unbuffered)
priority0:tunnel0:in_port0001:tci(0) mac00:00:00:00:00:27->00:00:00:00:00:38 type0800 proto6 tos0 ttl64 ip10.0.0.27->10.0.0.38 port52328->60741
00:00:00:00:00:27 > 00:00:00:00:00:38, ethertype IPv4 (0x0800), length 1514: 10.0.0.27.52328 > 10.0.0.38.60741: Flags [.], seq 1304775217:1304776665, ack 2176693538, win 229, options [nop,nop,TS val 4643071 ecr 4642999], length 1448
OFPT_PACKET_IN (xid=0x0): total_len=1514 in_port=1 (via action) data_len=1514 (unbuffered)
priority0:tunnel0:in_port0001:tci(0) mac00:00:00:00:00:25->00:00:00:00:00:01 type0800 proto6 tos0 ttl64 ip10.0.0.25->10.0.0.1 port38875->57670
00:00:00:00:00:25 > 00:00:00:00:00:01, ethertype IPv4 (0x0800), length 1514: 10.0.0.25.38875 > 10.0.0.1.57670: Flags [.], seq 2491871274:2491872722, ack 2892286238, win 229, options [nop,nop,TS val 4643071 ecr 4642916], length 1448
OFPT_PACKET_IN (xid=0x0): total_len=1514 in_port=1 (via action) data_len=1514 (unbuffered)
priority0:tunnel0:in_port0001:tci(0) mac00:00:00:00:00:27->00:00:00:00:00:38 type0800 proto6 tos0 ttl64 ip10.0.0.27->10.0.0.38 port52328->60741
00:00:00:00:00:27 > 00:00:00:00:00:38, ethertype IPv4 (0x0800), length 1514: 10.0.0.27.52328 > 10.0.0.38.60741: Flags [.], seq 1304776665:1304778113, ack 2176693538, win 229, options [nop,nop,TS val 4643071 ecr 4642999], length 1448
OFPT_PACKET_IN (xid=0x0): total_len=66 in_port=1 (via action) data_len=66 (unbuffered)
priority0:tunnel0:in_port0001:tci(0) mac00:00:00:00:00:38->00:00:00:00:00:27 type0800 proto6 tos0 ttl64 ip10.0.0.38->10.0.0.27 port60741->52328
00:00:00:00:00:38 > 00:00:00:00:00:27, ethertype IPv4 (0x0800), length 66: 10.0.0.38.60741 > 10.0.0.27.52328: Flags [.], ack 1304728881, win 1584, options [nop,nop,TS val 4643098 ecr 4643002], length 0
OFPT_PACKET_IN (xid=0x0): total_len=66 in_port=1 (via action) data_len=66 (unbuffered)
priority0:tunnel0:in_port0001:tci(0) mac00:00:00:00:00:38->00:00:00:00:00:27 type0800 proto6 tos0 ttl64 ip10.0.0.38->10.0.0.27 port60741->52328
00:00:00:00:00:38 > 00:00:00:00:00:27, ethertype IPv4 (0x0800), length 66: 10.0.0.38.60741 > 10.0.0.27.52328: Flags [.], ack 1304730329, win 1607, options [nop,nop,TS val 4643098 ecr 4643002], length 0
OFPT_PACKET_IN (xid=0x0): total_len=66 in_port=1 (via action) data_len=66 (unbuffered)
priority0:tunnel0:in_port0001:tci(0) mac00:00:00:00:00:38->00:00:00:00:00:27 type0800 proto6 tos0 ttl64 ip10.0.0.38->10.0.0.27 port60741->52328
00:00:00:00:00:38 > 00:00:00:00:00:27, ethertype IPv4 (0x0800), length 66: 10.0.0.38.60741 > 10.0.0.27.52328: Flags [.], ack 1304731777, win 1629, options [nop,nop,TS val 4643098 ecr 4643002], length 0
OFPT_PACKET_IN (xid=0x0): total_len=66 in_port=1 (via action) data_len=66 (unbuffered)
priority0:tunnel0:in_port0001:tci(0) mac00:00:00:00:00:38->00:00:00:00:00:27 type0800 proto6 tos0 ttl64 ip10.0.0.38->10.0.0.27 port60741->52328
00:00:00:00:00:38 > 00:00:00:00:00:27, ethertype IPv4 (0x0800), length 66: 10.0.0.38.60741 > 10.0.0.27.52328: Flags [.], ack 1304733225, win 1652, options [nop,nop,TS val 4643098 ecr 4643002], length 0
OFPT_PACKET_IN (xid=0x0): total_len=66 in_port=1 (via action) data_len=66 (unbuffered)
priority0:tunnel0:in_port0001:tci(0) mac00:00:00:00:00:38->00:00:00:00:00:27 type0800 proto6 tos0 ttl64 ip10.0.0.38->10.0.0.27 port60741->52328
00:00:00:00:00:38 > 00:00:00:00:00:27, ethertype IPv4 (0x0800), length 66: 10.0.0.38.60741 > 10.0.0.27.52328: Flags [.], ack 1304734673, win 1675, options [nop,nop,TS val 4643098 ecr 4643002], length 0
OFPT_PACKET_IN (xid=0x0): total_len=66 in_port=1 (via action) data_len=66 (unbuffered)
priority0:tunnel0:in_port0001:tci(0) mac00:00:00:00:00:38->00:00:00:00:00:27 type0800 proto6 tos0 ttl64 ip10.0.0.38->10.0.0.27 port60741->52328
00:00:00:00:00:38 > 00:00:00:00:00:27, ethertype IPv4 (0x0800), length 66: 10.0.0.38.60741 > 10.0.0.27.52328: Flags [.], ack 1304736121, win 1697, options [nop,nop,TS val 4643098 ecr 4643002], length 0
OFPT_PACKET_IN (xid=0x0): total_len=66 in_port=1 (via action) data_len=66 (unbuffered)
priority0:tunnel0:in_port0001:tci(0) mac00:00:00:00:00:38->00:00:00:00:00:27 type0800 proto6 tos0 ttl64 ip10.0.0.38->10.0.0.27 port60741->52328
00:00:00:00:00:38 > 00:00:00:00:00:27, ethertype IPv4 (0x0800), length 66: 10.0.0.38.60741 > 10.0.0.27.52328: Flags [.], ack 1304737569, win 1720, options [nop,nop,TS val 4643098 ecr 4643002], length 0
OFPT_PACKET_IN (xid=0x0): total_len=66 in_port=1 (via action) data_len=66 (unbuffered)
priority0:tunnel0:in_port0001:tci(0) mac00:00:00:00:00:22->00:00:00:00:00:17 type0800 proto6 tos0 ttl64 ip10.0.0.22->10.0.0.17 port12865->35251
00:00:00:00:00:22 > 00:00:00:00:00:17, ethertype IPv4 (0x0800), length 66: 10.0.0.22.12865 > 10.0.0.17.35251: Flags [F.], seq 1761039825, ack 1568001444, win 243, options [nop,nop,TS val 4643085 ecr 4642918], length 0
OFPT_PACKET_IN (xid=0x0): total_len=1514 in_port=1 (via action) data_len=1514 (unbuffered)
priority0:tunnel0:in_port0001:tci(0) mac00:00:00:00:00:25->00:00:00:00:00:01 type0800 proto6 tos0 ttl64 ip10.0.0.25->10.0.0.1 port38875->57670
00:00:00:00:00:25 > 00:00:00:00:00:01, ethertype IPv4 (0x0800), length 1514: 10.0.0.25.38875 > 10.0.0.1.57670: Flags [.], seq 2491872722:2491874170, ack 2892286238, win 229, options [nop,nop,TS val 4643085 ecr 4642916], length 1448
OFPT_PACKET_IN (xid=0x0): total_len=1514 in_port=1 (via action) data_len=1514 (unbuffered)
priority0:tunnel0:in_port0001:tci(0) mac00:00:00:00:00:27->00:00:00:00:00:38 type0800 proto6 tos0 ttl64 ip10.0.0.27->10.0.0.38 port52328->60741
00:00:00:00:00:27 > 00:00:00:00:00:38, ethertype IPv4 (0x0800), length 1514: 10.0.0.27.52328 > 10.0.0.38.60741: Flags [.], seq 1304778113:1304779561, ack 2176693538, win 229, options [nop,nop,TS val 4643085 ecr 4643009], length 1448
OFPT_PACKET_IN (xid=0x0): total_len=1514 in_port=1 (via action) data_len=1514 (unbuffered)
priority0:tunnel0:in_port0001:tci(0) mac00:00:00:00:00:25->00:00:00:00:00:01 type0800 proto6 tos0 ttl64 ip10.0.0.25->10.0.0.1 port38875->57670
00:00:00:00:00:25 > 00:00:00:00:00:01, ethertype IPv4 (0x0800), length 1514: 10.0.0.25.38875 > 10.0.0.1.57670: Flags [.], seq 2491874170:2491875618, ack 2892286238, win 229, options [nop,nop,TS val 4643085 ecr 4642916], length 1448
OFPT_PACKET_IN (xid=0x0): total_len=1514 in_port=1 (via action) data_len=1514 (unbuffered)
priority0:tunnel0:in_port0001:tci(0) mac00:00:00:00:00:27->00:00:00:00:00:38 type0800 proto6 tos0 ttl64 ip10.0.0.27->10.0.0.38 port52328->60741
00:00:00:00:00:27 > 00:00:00:00:00:38, ethertype IPv4 (0x0800), length 1514: 10.0.0.27.52328 > 10.0.0.38.60741: Flags [.], seq 1304779561:1304781009, ack 2176693538, win 229, options [nop,nop,TS val 4643085 ecr 4643009], length 1448
OFPT_PACKET_IN (xid=0x0): total_len=1514 in_port=1 (via action) data_len=1514 (unbuffered)
priority0:tunnel0:in_port0001:tci(0) mac00:00:00:00:00:25->00:00:00:00:00:01 type0800 proto6 tos0 ttl64 ip10.0.0.25->10.0.0.1 port38875->57670
00:00:00:00:00:25 > 00:00:00:00:00:01, ethertype IPv4 (0x0800), length 1514: 10.0.0.25.38875 > 10.0.0.1.57670: Flags [.], seq 2491875618:2491877066, ack 2892286238, win 229, options [nop,nop,TS val 4643085 ecr 4642916], length 1448
OFPT_PACKET_IN (xid=0x0): total_len=170 in_port=1 (via action) data_len=170 (unbuffered)
priority0:tunnel0:in_port0001:tci(0) mac00:00:00:00:00:09->00:00:00:00:00:02 type0800 proto17 tos0 ttl64 ip10.0.0.9->10.0.0.2 port47277->59772
00:00:00:00:00:09 > 00:00:00:00:00:02, ethertype IPv4 (0x0800), length 170: 10.0.0.9.47277 > 10.0.0.2.59772: UDP, length 128
OFPT_PACKET_IN (xid=0x0): total_len=170 in_port=1 (via action) data_len=170 (unbuffered)
priority0:tunnel0:in_port0001:tci(0) mac00:00:00:00:00:07->00:00:00:00:00:02 type0800 proto17 tos0 ttl64 ip10.0.0.7->10.0.0.2 port35154->36438
00:00:00:00:00:07 > 00:00:00:00:00:02, ethertype IPv4 (0x0800), length 170: 10.0.0.7.35154 > 10.0.0.2.36438: UDP, length 128
OFPT_PACKET_OUT (xid=0x0): in_port=1 actions_len=8 actions=FLOOD data_len=1514
00:00:00:00:00:27 > 00:00:00:00:00:38, ethertype IPv4 (0x0800), length 1514: 10.0.0.27.52328 > 10.0.0.38.60741: Flags [.], seq 1304756393:1304757841, ack 2176693538, win 229, options [nop,nop,TS val 4643041 ecr 4642969], length 1448

OFPT_PACKET_OUT (xid=0x0): in_port=1 actions_len=8 actions=FLOOD data_len=1514
00:00:00:00:00:25 > 00:00:00:00:00:01, ethertype IPv4 (0x0800), length 1514: 10.0.0.25.38875 > 10.0.0.1.57670: Flags [.], seq 2491833626:2491835074, ack 2892286238, win 229, options [nop,nop,TS val 4643041 ecr 4642874], length 1448

OFPT_PACKET_OUT (xid=0x0): in_port=1 actions_len=8 actions=FLOOD data_len=70
00:00:00:00:00:02 > 00:00:00:00:00:30, ethertype IPv4 (0x0800), length 70: 10.0.0.2 > 10.0.0.30: ICMP 10.0.0.2 udp port 43931 unreachable, length 36

OFPT_PACKET_OUT (xid=0x0): in_port=1 actions_len=8 actions=FLOOD data_len=70
00:00:00:00:00:02 > 00:00:00:00:00:30, ethertype IPv4 (0x0800), length 70: 10.0.0.2 > 10.0.0.30: ICMP 10.0.0.2 udp port 43931 unreachable, length 36

OFPT_PACKET_OUT (xid=0x0): in_port=1 actions_len=8 actions=FLOOD data_len=70
00:00:00:00:00:02 > 00:00:00:00:00:30, ethertype IPv4 (0x0800), length 70: 10.0.0.2 > 10.0.0.30: ICMP 10.0.0.2 udp port 43931 unreachable, length 36

OFPT_PACKET_OUT (xid=0x0): in_port=1 actions_len=8 actions=FLOOD data_len=66
00:00:00:00:00:01 > 00:00:00:00:00:25, ethertype IPv4 (0x0800), length 66: 10.0.0.1.57670 > 10.0.0.25.38875: Flags [.], ack 2491746746, win 3394, options [nop,nop,TS val 4643126 ecr 4642931], length 0

OFPT_PACKET_OUT (xid=0x0): in_port=4 actions_len=8 actions=FLOOD data_len=1514
00:00:00:00:00:13 > 00:00:00:00:00:20, ethertype IPv4 (0x0800), length 1514: 10.0.0.13.55914 > 10.0.0.20.44789: Flags [.], seq 3176828891:3176830339, ack 90392257, win 229, options [nop,nop,TS val 4643207 ecr 4643165], length 1448

OFPT_PACKET_OUT (xid=0x0): in_port=10 actions_len=8 actions=FLOOD data_len=66
00:00:00:00:00:19 > 00:00:00:00:00:02, ethertype IPv4 (0x0800), length 66: 10.0.0.19.38904 > 10.0.0.2.55079: Flags [.], ack 3869916762, win 249, options [nop,nop,TS val 4643207 ecr 4643084], length 0

OFPT_PACKET_OUT (xid=0x0): in_port=11 actions_len=8 actions=FLOOD data_len=66
00:00:00:00:00:20 > 00:00:00:00:00:13, ethertype IPv4 (0x0800), length 66: 10.0.0.20.44789 > 10.0.0.13.55914: Flags [.], ack 3176789795, win 1041, options [nop,nop,TS val 4643207 ecr 4643165], length 0

OFPT_PACKET_OUT (xid=0x0): in_port=1 actions_len=8 actions=FLOOD data_len=42
00:00:00:00:00:06 > 00:00:00:00:00:02, ethertype IPv4 (0x0800), length 42: 10.0.0.6.37370 > 10.0.0.2.54833: UDP, length 0

OFPT_PACKET_OUT (xid=0x0): in_port=4 actions_len=8 actions=FLOOD data_len=1514
00:00:00:00:00:13 > 00:00:00:00:00:20, ethertype IPv4 (0x0800), length 1514: 10.0.0.13.55914 > 10.0.0.20.44789: Flags [.], seq 3176830339:3176831787, ack 90392257, win 229, options [nop,nop,TS val 4643207 ecr 4643165], length 1448

OFPT_PACKET_OUT (xid=0x0): in_port=10 actions_len=8 actions=FLOOD data_len=66
00:00:00:00:00:19 > 00:00:00:00:00:02, ethertype IPv4 (0x0800), length 66: 10.0.0.19.38904 > 10.0.0.2.55079: Flags [.], ack 3869918210, win 272, options [nop,nop,TS val 4643207 ecr 4643084], length 0

OFPT_PACKET_OUT (xid=0x0): in_port=11 actions_len=8 actions=FLOOD data_len=66
00:00:00:00:00:20 > 00:00:00:00:00:13, ethertype IPv4 (0x0800), length 66: 10.0.0.20.44789 > 10.0.0.13.55914: Flags [.], ack 3176791243, win 1041, options [nop,nop,TS val 4643217 ecr 4643165], length 0

OFPT_PACKET_OUT (xid=0x0): in_port=1 actions_len=8 actions=FLOOD data_len=66
00:00:00:00:00:01 > 00:00:00:00:00:25, ethertype IPv4 (0x0800), length 66: 10.0.0.1.57670 > 10.0.0.25.38875: Flags [.], ack 2491749642, win 3394, options [nop,nop,TS val 4643126 ecr 4642944], length 0

OFPT_PACKET_OUT (xid=0x0): in_port=4 actions_len=8 actions=FLOOD data_len=1514
00:00:00:00:00:13 > 00:00:00:00:00:20, ethertype IPv4 (0x0800), length 1514: 10.0.0.13.55914 > 10.0.0.20.44789: Flags [.], seq 3176831787:3176833235, ack 90392257, win 229, options [nop,nop,TS val 4643207 ecr 4643165], length 1448

OFPT_PACKET_OUT (xid=0x0): in_port=10 actions_len=8 actions=FLOOD data_len=66
00:00:00:00:00:19 > 00:00:00:00:00:02, ethertype IPv4 (0x0800), length 66: 10.0.0.19.38904 > 10.0.0.2.55079: Flags [.], ack 3869919658, win 295, options [nop,nop,TS val 4643207 ecr 4643084], length 0

OFPT_PACKET_OUT (xid=0x0): in_port=1 actions_len=8 actions=FLOOD data_len=42
00:00:00:00:00:06 > 00:00:00:00:00:02, ethertype IPv4 (0x0800), length 42: 10.0.0.6.37370 > 10.0.0.2.54833: UDP, length 0

OFPT_PACKET_OUT (xid=0x0): in_port=4 actions_len=8 actions=FLOOD data_len=1514
00:00:00:00:00:13 > 00:00:00:00:00:20, ethertype IPv4 (0x0800), length 1514: 10.0.0.13.55914 > 10.0.0.20.44789: Flags [.], seq 3176833235:3176834683, ack 90392257, win 229, options [nop,nop,TS val 4643207 ecr 4643165], length 1448

OFPT_PACKET_OUT (xid=0x0): in_port=10 actions_len=8 actions=FLOOD data_len=66
00:00:00:00:00:19 > 00:00:00:00:00:02, ethertype IPv4 (0x0800), length 66: 10.0.0.19.38904 > 10.0.0.2.55079: Flags [.], ack 3869921106, win 317, options [nop,nop,TS val 4643207 ecr 4643084], length 0

OFPT_PACKET_OUT (xid=0x0): in_port=1 actions_len=8 actions=FLOOD data_len=66
00:00:00:00:00:01 > 00:00:00:00:00:25, ethertype IPv4 (0x0800), length 66: 10.0.0.1.57670 > 10.0.0.25.38875: Flags [.], ack 2491752538, win 3394, options [nop,nop,TS val 4643126 ecr 4642944], length 0

OFPT_PACKET_OUT (xid=0x0): in_port=4 actions_len=8 actions=FLOOD data_len=1514
00:00:00:00:00:13 > 00:00:00:00:00:20, ethertype IPv4 (0x0800), length 1514: 10.0.0.13.55914 > 10.0.0.20.44789: Flags [.], seq 3176834683:3176836131, ack 90392257, win 229, options [nop,nop,TS val 4643207 ecr 4643165], length 1448

OFPT_PACKET_OUT (xid=0x0): in_port=10 actions_len=8 actions=FLOOD data_len=66
00:00:00:00:00:19 > 00:00:00:00:00:02, ethertype IPv4 (0x0800), length 66: 10.0.0.19.38904 > 10.0.0.2.55079: Flags [.], ack 3869922554, win 340, options [nop,nop,TS val 4643207 ecr 4643084], length 0

OFPT_PACKET_OUT (xid=0x0): in_port=1 actions_len=8 actions=FLOOD data_len=66
00:00:00:00:00:02 > 00:00:00:00:00:28, ethertype IPv4 (0x0800), length 66: 10.0.0.2.12865 > 10.0.0.28.48410: Flags [F.], seq 2689624444, ack 2811470703, win 243, options [nop,nop,TS val 4643125 ecr 4642931], length 0

OFPT_PACKET_OUT (xid=0x0): in_port=4 actions_len=8 actions=FLOOD data_len=1514
00:00:00:00:00:13 > 00:00:00:00:00:20, ethertype IPv4 (0x0800), length 1514: 10.0.0.13.55914 > 10.0.0.20.44789: Flags [.], seq 3176836131:3176837579, ack 90392257, win 229, options [nop,nop,TS val 4643207 ecr 4643165], length 1448

OFPT_PACKET_OUT (xid=0x0): in_port=10 actions_len=8 actions=FLOOD data_len=66
00:00:00:00:00:19 > 00:00:00:00:00:02, ethertype IPv4 (0x0800), length 66: 10.0.0.19.38904 > 10.0.0.2.55079: Flags [.], ack 3869924002, win 355, options [nop,nop,TS val 4643208 ecr 4643084], length 0

OFPT_PACKET_OUT (xid=0x0): in_port=1 actions_len=8 actions=FLOOD data_len=42
00:00:00:00:00:06 > 00:00:00:00:00:02, ethertype IPv4 (0x0800), length 42: 10.0.0.6.37370 > 10.0.0.2.54833: UDP, length 0

OFPT_PACKET_OUT (xid=0x0): in_port=4 actions_len=8 actions=FLOOD data_len=1514
00:00:00:00:00:13 > 00:00:00:00:00:20, ethertype IPv4 (0x0800), length 1514: 10.0.0.13.55914 > 10.0.0.20.44789: Flags [.], seq 3176837579:3176839027, ack 90392257, win 229, options [nop,nop,TS val 4643207 ecr 4643165], length 1448

OFPT_PACKET_OUT (xid=0x0): in_port=10 actions_len=8 actions=FLOOD data_len=66
00:00:00:00:00:19 > 00:00:00:00:00:02, ethertype IPv4 (0x0800), length 66: 10.0.0.19.38904 > 10.0.0.2.55079: Flags [.], ack 3869925450, win 355, options [nop,nop,TS val 4643208 ecr 4643084], length 0

OFPT_PACKET_OUT (xid=0x0): in_port=1 actions_len=8 actions=FLOOD data_len=66
00:00:00:00:00:02 > 00:00:00:00:00:37, ethertype IPv4 (0x0800), length 66: 10.0.0.2.12865 > 10.0.0.37.55816: Flags [.], ack 3891954388, win 235, options [nop,nop,TS val 4643126 ecr 4642955], length 0

OFPT_PACKET_OUT (xid=0x0): in_port=4 actions_len=8 actions=FLOOD data_len=1514
00:00:00:00:00:13 > 00:00:00:00:00:20, ethertype IPv4 (0x0800), length 1514: 10.0.0.13.55914 > 10.0.0.20.44789: Flags [.], seq 3176839027:3176840475, ack 90392257, win 229, options [nop,nop,TS val 4643207 ecr 4643165], length 1448

OFPT_PACKET_OUT (xid=0x0): in_port=10 actions_len=8 actions=FLOOD data_len=66
00:00:00:00:00:19 > 00:00:00:00:00:02, ethertype IPv4 (0x0800), length 66: 10.0.0.19.38904 > 10.0.0.2.55079: Flags [.], ack 3869926898, win 355, options [nop,nop,TS val 4643208 ecr 4643084], length 0

OFPT_PACKET_OUT (xid=0x0): in_port=1 actions_len=8 actions=FLOOD data_len=66
00:00:00:00:00:06 > 00:00:00:00:00:02, ethertype IPv4 (0x0800), length 66: 10.0.0.6.46597 > 10.0.0.2.12865: Flags [F.], seq 2183793429, ack 3660749538, win 254, options [nop,nop,TS val 4643125 ecr 4643084], length 0

OFPT_PACKET_OUT (xid=0x0): in_port=4 actions_len=8 actions=FLOOD data_len=1514
00:00:00:00:00:13 > 00:00:00:00:00:20, ethertype IPv4 (0x0800), length 1514: 10.0.0.13.55914 > 10.0.0.20.44789: Flags [.], seq 3176840475:3176841923, ack 90392257, win 229, options [nop,nop,TS val 4643208 ecr 4643175], length 1448

OFPT_PACKET_OUT (xid=0x0): in_port=10 actions_len=8 actions=FLOOD data_len=66
00:00:00:00:00:19 > 00:00:00:00:00:02, ethertype IPv4 (0x0800), length 66: 10.0.0.19.38904 > 10.0.0.2.55079: Flags [.], ack 3869928346, win 355, options [nop,nop,TS val 4643208 ecr 4643084], length 0

OFPT_PACKET_OUT (xid=0x0): in_port=1 actions_len=8 actions=FLOOD data_len=322
00:00:00:00:00:02 > 00:00:00:00:00:37, ethertype IPv4 (0x0800), length 322: 10.0.0.2.12865 > 10.0.0.37.55816: Flags [P.], seq 2773666779:2773667035, ack 3891954388, win 235, options [nop,nop,TS val 4643126 ecr 4642955], length 256

OFPT_PACKET_OUT (xid=0x0): in_port=4 actions_len=8 actions=FLOOD data_len=1514
00:00:00:00:00:13 > 00:00:00:00:00:20, ethertype IPv4 (0x0800), length 1514: 10.0.0.13.55914 > 10.0.0.20.44789: Flags [P.], seq 3176841923:3176843371, ack 90392257, win 229, options [nop,nop,TS val 4643208 ecr 4643175], length 1448

OFPT_PACKET_OUT (xid=0x0): in_port=10 actions_len=8 actions=FLOOD data_len=66
00:00:00:00:00:19 > 00:00:00:00:00:02, ethertype IPv4 (0x0800), length 66: 10.0.0.19.38904 > 10.0.0.2.55079: Flags [.], ack 3869929794, win 355, options [nop,nop,TS val 4643208 ecr 4643084], length 0

OFPT_PACKET_OUT (xid=0x0): in_port=1 actions_len=8 actions=FLOOD data_len=67
00:00:00:00:00:06 > 00:00:00:00:00:19, ethertype IPv4 (0x0800), length 67: 10.0.0.6.47226 > 10.0.0.19.43130: Flags [P.], seq 1075414530:1075414531, ack 1586446622, win 227, options [nop,nop,TS val 4643125 ecr 4643017], length 1

OFPT_PACKET_OUT (xid=0x0): in_port=1 actions_len=8 actions=FLOOD data_len=1514
00:00:00:00:00:25 > 00:00:00:00:00:01, ethertype IPv4 (0x0800), length 1514: 10.0.0.25.38875 > 10.0.0.1.57670: Flags [.], seq 2491835074:2491836522, ack 2892286238, win 229, options [nop,nop,TS val 4643041 ecr 4642874], length 1448

OFPT_PACKET_OUT (xid=0x0): in_port=1 actions_len=8 actions=FLOOD data_len=1514
00:00:00:00:00:25 > 00:00:00:00:00:01, ethertype IPv4 (0x0800), length 1514: 10.0.0.25.38875 > 10.0.0.1.57670: Flags [.], seq 2491836522:2491837970, ack 2892286238, win 229, options [nop,nop,TS val 4643041 ecr 4642874], length 1448

OFPT_PACKET_OUT (xid=0x0): in_port=1 actions_len=8 actions=FLOOD data_len=1514
00:00:00:00:00:25 > 00:00:00:00:00:01, ethertype IPv4 (0x0800), length 1514: 10.0.0.25.38875 > 10.0.0.1.57670: Flags [.], seq 2491837970:2491839418, ack 2892286238, win 229, options [nop,nop,TS val 4643041 ecr 4642874], length 1448

OFPT_PACKET_OUT (xid=0x0): in_port=1 actions_len=8 actions=FLOOD data_len=1514
00:00:00:00:00:25 > 00:00:00:00:00:01, ethertype IPv4 (0x0800), length 1514: 10.0.0.25.38875 > 10.0.0.1.57670: Flags [.], seq 2491839418:2491840866, ack 2892286238, win 229, options [nop,nop,TS val 4643041 ecr 4642874], length 1448

OFPT_PACKET_OUT (xid=0x0): in_port=1 actions_len=8 actions=FLOOD data_len=1514
00:00:00:00:00:25 > 00:00:00:00:00:01, ethertype IPv4 (0x0800), length 1514: 10.0.0.25.38875 > 10.0.0.1.57670: Flags [.], seq 2491840866:2491842314, ack 2892286238, win 229, options [nop,nop,TS val 4643041 ecr 4642874], length 1448

OFPT_PACKET_OUT (xid=0x0): in_port=1 actions_len=8 actions=FLOOD data_len=1514
00:00:00:00:00:25 > 00:00:00:00:00:01, ethertype IPv4 (0x0800), length 1514: 10.0.0.25.38875 > 10.0.0.1.57670: Flags [.], seq 2491842314:2491843762, ack 2892286238, win 229, options [nop,nop,TS val 4643041 ecr 4642874], length 1448

OFPT_PACKET_OUT (xid=0x0): in_port=1 actions_len=8 actions=FLOOD data_len=1514
00:00:00:00:00:25 > 00:00:00:00:00:01, ethertype IPv4 (0x0800), length 1514: 10.0.0.25.38875 > 10.0.0.1.57670: Flags [.], seq 2491843762:2491845210, ack 2892286238, win 229, options [nop,nop,TS val 4643041 ecr 4642874], length 1448

OFPT_PACKET_OUT (xid=0x0): in_port=1 actions_len=8 actions=FLOOD data_len=1514
00:00:00:00:00:25 > 00:00:00:00:00:01, ethertype IPv4 (0x0800), length 1514: 10.0.0.25.38875 > 10.0.0.1.57670: Flags [.], seq 2491845210:2491846658, ack 2892286238, win 229, options [nop,nop,TS val 4643041 ecr 4642874], length 1448

OFPT_PACKET_OUT (xid=0x0): in_port=1 actions_len=8 actions=FLOOD data_len=1514
00:00:00:00:00:25 > 00:00:00:00:00:01, ethertype IPv4 (0x0800), length 1514: 10.0.0.25.38875 > 10.0.0.1.57670: Flags [.], seq 2491846658:2491848106, ack 2892286238, win 229, options [nop,nop,TS val 4643041 ecr 4642874], length 1448

OFPT_PACKET_OUT (xid=0x0): in_port=1 actions_len=8 actions=FLOOD data_len=1514
00:00:00:00:00:25 > 00:00:00:00:00:01, ethertype IPv4 (0x0800), length 1514: 10.0.0.25.38875 > 10.0.0.1.57670: Flags [.], seq 2491848106:2491849554, ack 2892286238, win 229, options [nop,nop,TS val 4643041 ecr 4642874], length 1448

