OFPT_PACKET_IN (xid=0x0): total_len=1514 in_port=1 (via action) data_len=1514 (unbuffered)
priority0:tunnel0:in_port0001:tci(0) mac00:00:00:00:00:13->00:00:00:00:00:20 type0800 proto6 tos0 ttl64 ip10.0.0.13->10.0.0.20 port55914->44789
00:00:00:00:00:13 > 00:00:00:00:00:20, ethertype IPv4 (0x0800), length 1514: 10.0.0.13.55914 > 10.0.0.20.44789: Flags [P.], seq 3176728979:3176730427, ack 90392257, win 229, options [nop,nop,TS val 4643100 ecr 4643058], length 1448
OFPT_PACKET_IN (xid=0x0): total_len=42 in_port=3 (via action) data_len=42 (unbuffered)
priority0:tunnel0:in_port0003:tci(0) mac00:00:00:00:00:23->00:00:00:00:00:02 type0800 proto17 tos0 ttl64 ip10.0.0.23->10.0.0.2 port54205->42977
00:00:00:00:00:23 > 00:00:00:00:00:02, ethertype IPv4 (0x0800), length 42: 10.0.0.23.54205 > 10.0.0.2.42977: UDP, length 0
OFPT_PACKET_IN (xid=0x0): total_len=66 in_port=1 (via action) data_len=66 (unbuffered)
priority0:tunnel0:in_port0001:tci(0) mac00:00:00:00:00:01->00:00:00:00:00:25 type0800 proto6 tos0 ttl64 ip10.0.0.1->10.0.0.25 port57670->38875
00:00:00:00:00:01 > 00:00:00:00:00:25, ethertype IPv4 (0x0800), length 66: 10.0.0.1.57670 > 10.0.0.25.38875: Flags [.], ack 2491736610, win 3394, options [nop,nop,TS val 4643108 ecr 4642917], length 0
OFPT_PACKET_IN (xid=0x0): total_len=1514 in_port=3 (via action) data_len=1514 (unbuffered)
priority0:tunnel0:in_port0003:tci(0) mac00:00:00:00:00:25->00:00:00:00:00:01 type0800 proto6 tos0 ttl64 ip10.0.0.25->10.0.0.1 port38875->57670
00:00:00:00:00:25 > 00:00:00:00:00:01, ethertype IPv4 (0x0800), length 1514: 10.0.0.25.38875 > 10.0.0.1.57670: Flags [.], seq 2491979874:2491981322, ack 2892286238, win 229, options [nop,nop,TS val 4643207 ecr 4643037], length 1448
OFPT_PACKET_IN (xid=0x0): total_len=1514 in_port=1 (via action) data_len=1514 (unbuffered)
priority0:tunnel0:in_port0001:tci(0) mac00:00:00:00:00:13->00:00:00:00:00:20 type0800 proto6 tos0 ttl64 ip10.0.0.13->10.0.0.20 port55914->44789
00:00:00:00:00:13 > 00:00:00:00:00:20, ethertype IPv4 (0x0800), length 1514: 10.0.0.13.55914 > 10.0.0.20.44789: Flags [.], seq 3176730427:3176731875, ack 90392257, win 229, options [nop,nop,TS val 4643101 ecr 4643068], length 1448
OFPT_PACKET_IN (xid=0x0): total_len=1514 in_port=3 (via action) data_len=1514 (unbuffered)
priority0:tunnel0:in_port0003:tci(0) mac00:00:00:00:00:27->00:00:00:00:00:38 type0800 proto6 tos0 ttl64 ip10.0.0.27->10.0.0.38 port52328->60741
00:00:00:00:00:27 > 00:00:00:00:00:38, ethertype IPv4 (0x0800), length 1514: 10.0.0.27.52328 > 10.0.0.38.60741: Flags [.], seq 1304899745:1304901193, ack 2176693538, win 229, options [nop,nop,TS val 4643207 ecr 4643118], length 1448
OFPT_PACKET_IN (xid=0x0): total_len=322 in_port=1 (via action) data_len=322 (unbuffered)
priority0:tunnel0:in_port0001:tci(0) mac00:00:00:00:00:02->00:00:00:00:00:07 type0800 proto6 tos0 ttl64 ip10.0.0.2->10.0.0.7 port12865->49636
00:00:00:00:00:02 > 00:00:00:00:00:07, ethertype IPv4 (0x0800), length 322: 10.0.0.2.12865 > 10.0.0.7.49636: Flags [P.], seq 2230717626:2230717882, ack 930790610, win 243, options [nop,nop,TS val 4643109 ecr 4643084], length 256
OFPT_PACKET_IN (xid=0x0): total_len=42 in_port=3 (via action) data_len=42 (unbuffered)
priority0:tunnel0:in_port0003:tci(0) mac00:00:00:00:00:23->00:00:00:00:00:02 type0800 proto17 tos0 ttl64 ip10.0.0.23->10.0.0.2 port54205->42977
00:00:00:00:00:23 > 00:00:00:00:00:02, ethertype IPv4 (0x0800), length 42: 10.0.0.23.54205 > 10.0.0.2.42977: UDP, length 0
OFPT_PACKET_IN (xid=0x0): total_len=1514 in_port=1 (via action) data_len=1514 (unbuffered)
priority0:tunnel0:in_port0001:tci(0) mac00:00:00:00:00:13->00:00:00:00:00:20 type0800 proto6 tos0 ttl64 ip10.0.0.13->10.0.0.20 port55914->44789
00:00:00:00:00:13 > 00:00:00:00:00:20, ethertype IPv4 (0x0800), length 1514: 10.0.0.13.55914 > 10.0.0.20.44789: Flags [.], seq 3176731875:3176733323, ack 90392257, win 229, options [nop,nop,TS val 4643101 ecr 4643068], length 1448
OFPT_PACKET_IN (xid=0x0): total_len=1514 in_port=3 (via action) data_len=1514 (unbuffered)
priority0:tunnel0:in_port0003:tci(0) mac00:00:00:00:00:25->00:00:00:00:00:01 type0800 proto6 tos0 ttl64 ip10.0.0.25->10.0.0.1 port38875->57670
00:00:00:00:00:25 > 00:00:00:00:00:01, ethertype IPv4 (0x0800), length 1514: 10.0.0.25.38875 > 10.0.0.1.57670: Flags [.], seq 2491981322:2491982770, ack 2892286238, win 229, options [nop,nop,TS val 4643207 ecr 4643037], length 1448
OFPT_PACKET_IN (xid=0x0): total_len=66 in_port=1 (via action) data_len=66 (unbuffered)
priority0:tunnel0:in_port0001:tci(0) mac00:00:00:00:00:03->00:00:00:00:00:02 type0800 proto6 tos0 ttl64 ip10.0.0.3->10.0.0.2 port45561->12865
00:00:00:00:00:03 > 00:00:00:00:00:02, ethertype IPv4 (0x0800), length 66: 10.0.0.3.45561 > 10.0.0.2.12865: Flags [.], ack 840010630, win 229, options [nop,nop,TS val 4643108 ecr 4643070], length 0
OFPT_PACKET_IN (xid=0x0): total_len=1514 in_port=3 (via action) data_len=1514 (unbuffered)
priority0:tunnel0:in_port0003:tci(0) mac00:00:00:00:00:27->00:00:00:00:00:38 type0800 proto6 tos0 ttl64 ip10.0.0.27->10.0.0.38 port52328->60741
00:00:00:00:00:27 > 00:00:00:00:00:38, ethertype IPv4 (0x0800), length 1514: 10.0.0.27.52328 > 10.0.0.38.60741: Flags [.], seq 1304901193:1304902641, ack 2176693538, win 229, options [nop,nop,TS val 4643207 ecr 4643118], length 1448
OFPT_PACKET_IN (xid=0x0): total_len=1514 in_port=1 (via action) data_len=1514 (unbuffered)
priority0:tunnel0:in_port0001:tci(0) mac00:00:00:00:00:13->00:00:00:00:00:20 type0800 proto6 tos0 ttl64 ip10.0.0.13->10.0.0.20 port55914->44789
00:00:00:00:00:13 > 00:00:00:00:00:20, ethertype IPv4 (0x0800), length 1514: 10.0.0.13.55914 > 10.0.0.20.44789: Flags [.], seq 3176733323:3176734771, ack 90392257, win 229, options [nop,nop,TS val 4643101 ecr 4643071], length 1448
OFPT_PACKET_IN (xid=0x0): total_len=42 in_port=3 (via action) data_len=42 (unbuffered)
priority0:tunnel0:in_port0003:tci(0) mac00:00:00:00:00:23->00:00:00:00:00:02 type0800 proto17 tos0 ttl64 ip10.0.0.23->10.0.0.2 port54205->42977
00:00:00:00:00:23 > 00:00:00:00:00:02, ethertype IPv4 (0x0800), length 42: 10.0.0.23.54205 > 10.0.0.2.42977: UDP, length 0
OFPT_PACKET_IN (xid=0x0): total_len=66 in_port=1 (via action) data_len=66 (unbuffered)
priority0:tunnel0:in_port0001:tci(0) mac00:00:00:00:00:06->00:00:00:00:00:02 type0800 proto6 tos0 ttl64 ip10.0.0.6->10.0.0.2 port46597->12865
00:00:00:00:00:06 > 00:00:00:00:00:02, ethertype IPv4 (0x0800), length 66: 10.0.0.6.46597 > 10.0.0.2.12865: Flags [.], ack 3660749538, win 254, options [nop,nop,TS val 4643109 ecr 4643084], length 0
OFPT_PACKET_IN (xid=0x0): total_len=1514 in_port=3 (via action) data_len=1514 (unbuffered)
priority0:tunnel0:in_port0003:tci(0) mac00:00:00:00:00:25->00:00:00:00:00:01 type0800 proto6 tos0 ttl64 ip10.0.0.25->10.0.0.1 port38875->57670
00:00:00:00:00:25 > 00:00:00:00:00:01, ethertype IPv4 (0x0800), length 1514: 10.0.0.25.38875 > 10.0.0.1.57670: Flags [.], seq 2491982770:2491984218, ack 2892286238, win 229, options [nop,nop,TS val 4643207 ecr 4643039], length 1448
OFPT_PACKET_IN (xid=0x0): total_len=1514 in_port=1 (via action) data_len=1514 (unbuffered)
priority0:tunnel0:in_port0001:tci(0) mac00:00:00:00:00:13->00:00:00:00:00:20 type0800 proto6 tos0 ttl64 ip10.0.0.13->10.0.0.20 port55914->44789
00:00:00:00:00:13 > 00:00:00:00:00:20, ethertype IPv4 (0x0800), length 1514: 10.0.0.13.55914 > 10.0.0.20.44789: Flags [.], seq 3176734771:3176736219, ack 90392257, win 229, options [nop,nop,TS val 4643101 ecr 4643071], length 1448
OFPT_PACKET_IN (xid=0x0): total_len=1514 in_port=3 (via action) data_len=1514 (unbuffered)
priority0:tunnel0:in_port0003:tci(0) mac00:00:00:00:00:27->00:00:00:00:00:38 type0800 proto6 tos0 ttl64 ip10.0.0.27->10.0.0.38 port52328->60741
00:00:00:00:00:27 > 00:00:00:00:00:38, ethertype IPv4 (0x0800), length 1514: 10.0.0.27.52328 > 10.0.0.38.60741: Flags [.], seq 1304902641:1304904089, ack 2176693538, win 229, options [nop,nop,TS val 4643207 ecr 4643124], length 1448
OFPT_PACKET_IN (xid=0x0): total_len=66 in_port=1 (via action) data_len=66 (unbuffered)
priority0:tunnel0:in_port0001:tci(0) mac00:00:00:00:00:01->00:00:00:00:00:25 type0800 proto6 tos0 ttl64 ip10.0.0.1->10.0.0.25 port57670->38875
00:00:00:00:00:01 > 00:00:00:00:00:25, ethertype IPv4 (0x0800), length 66: 10.0.0.1.57670 > 10.0.0.25.38875: Flags [.], ack 2491739506, win 3394, options [nop,nop,TS val 4643109 ecr 4642917], length 0
OFPT_PACKET_IN (xid=0x0): total_len=66 in_port=3 (via action) data_len=66 (unbuffered)
priority0:tunnel0:in_port0003:tci(0) mac00:00:00:00:00:23->00:00:00:00:00:02 type0800 proto6 tos0 ttl64 ip10.0.0.23->10.0.0.2 port32899->12865
00:00:00:00:00:23 > 00:00:00:00:00:02, ethertype IPv4 (0x0800), length 66: 10.0.0.23.32899 > 10.0.0.2.12865: Flags [F.], seq 450561272, ack 1401585641, win 254, options [nop,nop,TS val 4643207 ecr 4643000], length 0
OFPT_PACKET_IN (xid=0x0): total_len=1514 in_port=1 (via action) data_len=1514 (unbuffered)
priority0:tunnel0:in_port0001:tci(0) mac00:00:00:00:00:13->00:00:00:00:00:20 type0800 proto6 tos0 ttl64 ip10.0.0.13->10.0.0.20 port55914->44789
00:00:00:00:00:13 > 00:00:00:00:00:20, ethertype IPv4 (0x0800), length 1514: 10.0.0.13.55914 > 10.0.0.20.44789: Flags [.], seq 3176736219:3176737667, ack 90392257, win 229, options [nop,nop,TS val 4643101 ecr 4643071], length 1448
OFPT_PACKET_IN (xid=0x0): total_len=1514 in_port=3 (via action) data_len=1514 (unbuffered)
priority0:tunnel0:in_port0003:tci(0) mac00:00:00:00:00:25->00:00:00:00:00:01 type0800 proto6 tos0 ttl64 ip10.0.0.25->10.0.0.1 port38875->57670
00:00:00:00:00:25 > 00:00:00:00:00:01, ethertype IPv4 (0x0800), length 1514: 10.0.0.25.38875 > 10.0.0.1.57670: Flags [.], seq 2491984218:2491985666, ack 2892286238, win 229, options [nop,nop,TS val 4643207 ecr 4643039], length 1448
OFPT_PACKET_IN (xid=0x0): total_len=322 in_port=1 (via action) data_len=322 (unbuffered)
priority0:tunnel0:in_port0001:tci(0) mac00:00:00:00:00:02->00:00:00:00:00:09 type0800 proto6 tos0 ttl64 ip10.0.0.2->10.0.0.9 port12865->58506
00:00:00:00:00:02 > 00:00:00:00:00:09, ethertype IPv4 (0x0800), length 322: 10.0.0.2.12865 > 10.0.0.9.58506: Flags [P.], seq 3835931700:3835931956, ack 3787851637, win 243, options [nop,nop,TS val 4643109 ecr 4643084], length 256
OFPT_PACKET_IN (xid=0x0): total_len=1514 in_port=3 (via action) data_len=1514 (unbuffered)
priority0:tunnel0:in_port0003:tci(0) mac00:00:00:00:00:27->00:00:00:00:00:38 type0800 proto6 tos0 ttl64 ip10.0.0.27->10.0.0.38 port52328->60741
00:00:00:00:00:27 > 00:00:00:00:00:38, ethertype IPv4 (0x0800), length 1514: 10.0.0.27.52328 > 10.0.0.38.60741: Flags [P.], seq 1304904089:1304905537, ack 2176693538, win 229, options [nop,nop,TS val 4643207 ecr 4643124], length 1448
OFPT_PACKET_IN (xid=0x0): total_len=1514 in_port=1 (via action) data_len=1514 (unbuffered)
priority0:tunnel0:in_port0001:tci(0) mac00:00:00:00:00:13->00:00:00:00:00:20 type0800 proto6 tos0 ttl64 ip10.0.0.13->10.0.0.20 port55914->44789
00:00:00:00:00:13 > 00:00:00:00:00:20, ethertype IPv4 (0x0800), length 1514: 10.0.0.13.55914 > 10.0.0.20.44789: Flags [.], seq 3176737667:3176739115, ack 90392257, win 229, options [nop,nop,TS val 4643101 ecr 4643071], length 1448
OFPT_PACKET_IN (xid=0x0): total_len=1514 in_port=3 (via action) data_len=1514 (unbuffered)
priority0:tunnel0:in_port0003:tci(0) mac00:00:00:00:00:25->00:00:00:00:00:01 type0800 proto6 tos0 ttl64 ip10.0.0.25->10.0.0.1 port38875->57670
00:00:00:00:00:25 > 00:00:00:00:00:01, ethertype IPv4 (0x0800), length 1514: 10.0.0.25.38875 > 10.0.0.1.57670: Flags [.], seq 2491985666:2491987114, ack 2892286238, win 229, options [nop,nop,TS val 4643207 ecr 4643039], length 1448
OFPT_PACKET_IN (xid=0x0): total_len=322 in_port=1 (via action) data_len=322 (unbuffered)
priority0:tunnel0:in_port0001:tci(0) mac00:00:00:00:00:03->00:00:00:00:00:02 type0800 proto6 tos0 ttl64 ip10.0.0.3->10.0.0.2 port45561->12865
00:00:00:00:00:03 > 00:00:00:00:00:02, ethertype IPv4 (0x0800), length 322: 10.0.0.3.45561 > 10.0.0.2.12865: Flags [P.], seq 592493222:592493478, ack 840010630, win 229, options [nop,nop,TS val 4643108 ecr 4643070], length 256
OFPT_PACKET_IN (xid=0x0): total_len=1514 in_port=3 (via action) data_len=1514 (unbuffered)
priority0:tunnel0:in_port0003:tci(0) mac00:00:00:00:00:27->00:00:00:00:00:38 type0800 proto6 tos0 ttl64 ip10.0.0.27->10.0.0.38 port52328->60741
00:00:00:00:00:27 > 00:00:00:00:00:38, ethertype IPv4 (0x0800), length 1514: 10.0.0.27.52328 > 10.0.0.38.60741: Flags [.], seq 1304905537:1304906985, ack 2176693538, win 229, options [nop,nop,TS val 4643207 ecr 4643124], length 1448
OFPT_PACKET_IN (xid=0x0): total_len=1514 in_port=1 (via action) data_len=1514 (unbuffered)
priority0:tunnel0:in_port0001:tci(0) mac00:00:00:00:00:13->00:00:00:00:00:20 type0800 proto6 tos0 ttl64 ip10.0.0.13->10.0.0.20 port55914->44789
00:00:00:00:00:13 > 00:00:00:00:00:20, ethertype IPv4 (0x0800), length 1514: 10.0.0.13.55914 > 10.0.0.20.44789: Flags [.], seq 3176739115:3176740563, ack 90392257, win 229, options [nop,nop,TS val 4643110 ecr 4643071], length 1448
OFPT_PACKET_IN (xid=0x0): total_len=1514 in_port=3 (via action) data_len=1514 (unbuffered)
priority0:tunnel0:in_port0003:tci(0) mac00:00:00:00:00:25->00:00:00:00:00:01 type0800 proto6 tos0 ttl64 ip10.0.0.25->10.0.0.1 port38875->57670
00:00:00:00:00:25 > 00:00:00:00:00:01, ethertype IPv4 (0x0800), length 1514: 10.0.0.25.38875 > 10.0.0.1.57670: Flags [.], seq 2491987114:2491988562, ack 2892286238, win 229, options [nop,nop,TS val 4643207 ecr 4643039], length 1448
OFPT_PACKET_IN (xid=0x0): total_len=66 in_port=1 (via action) data_len=66 (unbuffered)
priority0:tunnel0:in_port0001:tci(0) mac00:00:00:00:00:01->00:00:00:00:00:25 type0800 proto6 tos0 ttl64 ip10.0.0.1->10.0.0.25 port57670->38875
00:00:00:00:00:01 > 00:00:00:00:00:25, ethertype IPv4 (0x0800), length 66: 10.0.0.1.57670 > 10.0.0.25.38875: Flags [.], ack 2491742402, win 3394, options [nop,nop,TS val 4643109 ecr 4642917], length 0
OFPT_PACKET_IN (xid=0x0): total_len=1514 in_port=3 (via action) data_len=1514 (unbuffered)
priority0:tunnel0:in_port0003:tci(0) mac00:00:00:00:00:27->00:00:00:00:00:38 type0800 proto6 tos0 ttl64 ip10.0.0.27->10.0.0.38 port52328->60741
00:00:00:00:00:27 > 00:00:00:00:00:38, ethertype IPv4 (0x0800), length 1514: 10.0.0.27.52328 > 10.0.0.38.60741: Flags [.], seq 1304906985:1304908433, ack 2176693538, win 229, options [nop,nop,TS val 4643207 ecr 4643124], length 1448
OFPT_PACKET_IN (xid=0x0): total_len=1514 in_port=1 (via action) data_len=1514 (unbuffered)
priority0:tunnel0:in_port0001:tci(0) mac00:00:00:00:00:14->00:00:00:00:00:34 type0800 proto6 tos0 ttl64 ip10.0.0.14->10.0.0.34 port52352->45692
00:00:00:00:00:14 > 00:00:00:00:00:34, ethertype IPv4 (0x0800), length 1514: 10.0.0.14.52352 > 10.0.0.34.45692: Flags [.], seq 2934479472:2934480920, ack 1382721224, win 229, options [nop,nop,TS val 4643110 ecr 4642928], length 1448
OFPT_PACKET_IN (xid=0x0): total_len=1514 in_port=3 (via action) data_len=1514 (unbuffered)
priority0:tunnel0:in_port0003:tci(0) mac00:00:00:00:00:25->00:00:00:00:00:01 type0800 proto6 tos0 ttl64 ip10.0.0.25->10.0.0.1 port38875->57670
00:00:00:00:00:25 > 00:00:00:00:00:01, ethertype IPv4 (0x0800), length 1514: 10.0.0.25.38875 > 10.0.0.1.57670: Flags [.], seq 2491988562:2491990010, ack 2892286238, win 229, options [nop,nop,TS val 4643207 ecr 4643039], length 1448
OFPT_PACKET_IN (xid=0x0): total_len=66 in_port=1 (via action) data_len=66 (unbuffered)
priority0:tunnel0:in_port0001:tci(0) mac00:00:00:00:00:01->00:00:00:00:00:25 type0800 proto6 tos0 ttl64 ip10.0.0.1->10.0.0.25 port57670->38875
00:00:00:00:00:01 > 00:00:00:00:00:25, ethertype IPv4 (0x0800), length 66: 10.0.0.1.57670 > 10.0.0.25.38875: Flags [.], ack 2491743850, win 3394, options [nop,nop,TS val 4643119 ecr 4642931], length 0
OFPT_PACKET_IN (xid=0x0): total_len=1514 in_port=3 (via action) data_len=1514 (unbuffered)
priority0:tunnel0:in_port0003:tci(0) mac00:00:00:00:00:27->00:00:00:00:00:38 type0800 proto6 tos0 ttl64 ip10.0.0.27->10.0.0.38 port52328->60741
00:00:00:00:00:27 > 00:00:00:00:00:38, ethertype IPv4 (0x0800), length 1514: 10.0.0.27.52328 > 10.0.0.38.60741: Flags [.], seq 1304908433:1304909881, ack 2176693538, win 229, options [nop,nop,TS val 4643207 ecr 4643124], length 1448
OFPT_PACKET_IN (xid=0x0): total_len=66 in_port=1 (via action) data_len=66 (unbuffered)
priority0:tunnel0:in_port0001:tci(0) mac00:00:00:00:00:20->00:00:00:00:00:13 type0800 proto6 tos0 ttl64 ip10.0.0.20->10.0.0.13 port44789->55914
00:00:00:00:00:20 > 00:00:00:00:00:13, ethertype IPv4 (0x0800), length 66: 10.0.0.20.44789 > 10.0.0.13.55914: Flags [.], ack 3176710155, win 973, options [nop,nop,TS val 4643110 ecr 4643071], length 0
OFPT_PACKET_IN (xid=0x0): total_len=1514 in_port=3 (via action) data_len=1514 (unbuffered)
priority0:tunnel0:in_port0003:tci(0) mac00:00:00:00:00:25->00:00:00:00:00:01 type0800 proto6 tos0 ttl64 ip10.0.0.25->10.0.0.1 port38875->57670
00:00:00:00:00:25 > 00:00:00:00:00:01, ethertype IPv4 (0x0800), length 1514: 10.0.0.25.38875 > 10.0.0.1.57670: Flags [.], seq 2491990010:2491991458, ack 2892286238, win 229, options [nop,nop,TS val 4643207 ecr 4643039], length 1448
OFPT_PACKET_IN (xid=0x0): total_len=1514 in_port=1 (via action) data_len=1514 (unbuffered)
priority0:tunnel0:in_port0001:tci(0) mac00:00:00:00:00:13->00:00:00:00:00:20 type0800 proto6 tos0 ttl64 ip10.0.0.13->10.0.0.20 port55914->44789
00:00:00:00:00:13 > 00:00:00:00:00:20, ethertype IPv4 (0x0800), length 1514: 10.0.0.13.55914 > 10.0.0.20.44789: Flags [.], seq 3176740563:3176742011, ack 90392257, win 229, options [nop,nop,TS val 4643110 ecr 4643071], length 1448
OFPT_PACKET_IN (xid=0x0): total_len=1514 in_port=3 (via action) data_len=1514 (unbuffered)
priority0:tunnel0:in_port0003:tci(0) mac00:00:00:00:00:27->00:00:00:00:00:38 type0800 proto6 tos0 ttl64 ip10.0.0.27->10.0.0.38 port52328->60741
00:00:00:00:00:27 > 00:00:00:00:00:38, ethertype IPv4 (0x0800), length 1514: 10.0.0.27.52328 > 10.0.0.38.60741: Flags [.], seq 1304909881:1304911329, ack 2176693538, win 229, options [nop,nop,TS val 4643207 ecr 4643124], length 1448
OFPT_PACKET_IN (xid=0x0): total_len=1514 in_port=1 (via action) data_len=1514 (unbuffered)
priority0:tunnel0:in_port0001:tci(0) mac00:00:00:00:00:14->00:00:00:00:00:34 type0800 proto6 tos0 ttl64 ip10.0.0.14->10.0.0.34 port52352->45692
00:00:00:00:00:14 > 00:00:00:00:00:34, ethertype IPv4 (0x0800), length 1514: 10.0.0.14.52352 > 10.0.0.34.45692: Flags [.], seq 2934480920:2934482368, ack 1382721224, win 229, options [nop,nop,TS val 4643110 ecr 4642928], length 1448
OFPT_PACKET_IN (xid=0x0): total_len=1514 in_port=3 (via action) data_len=1514 (unbuffered)
priority0:tunnel0:in_port0003:tci(0) mac00:00:00:00:00:27->00:00:00:00:00:38 type0800 proto6 tos0 ttl64 ip10.0.0.27->10.0.0.38 port52328->60741
00:00:00:00:00:27 > 00:00:00:00:00:38, ethertype IPv4 (0x0800), length 1514: 10.0.0.27.52328 > 10.0.0.38.60741: Flags [.], seq 1304911329:1304912777, ack 2176693538, win 229, options [nop,nop,TS val 4643207 ecr 4643124], length 1448
OFPT_PACKET_IN (xid=0x0): total_len=66 in_port=1 (via action) data_len=66 (unbuffered)
priority0:tunnel0:in_port0001:tci(0) mac00:00:00:00:00:20->00:00:00:00:00:13 type0800 proto6 tos0 ttl64 ip10.0.0.20->10.0.0.13 port44789->55914
00:00:00:00:00:20 > 00:00:00:00:00:13, ethertype IPv4 (0x0800), length 66: 10.0.0.20.44789 > 10.0.0.13.55914: Flags [.], ack 3176711603, win 996, options [nop,nop,TS val 4643111 ecr 4643085], length 0
OFPT_PACKET_IN (xid=0x0): total_len=1514 in_port=3 (via action) data_len=1514 (unbuffered)
priority0:tunnel0:in_port0003:tci(0) mac00:00:00:00:00:27->00:00:00:00:00:38 type0800 proto6 tos0 ttl64 ip10.0.0.27->10.0.0.38 port52328->60741
00:00:00:00:00:27 > 00:00:00:00:00:38, ethertype IPv4 (0x0800), length 1514: 10.0.0.27.52328 > 10.0.0.38.60741: Flags [.], seq 1304912777:1304914225, ack 2176693538, win 229, options [nop,nop,TS val 4643207 ecr 4643124], length 1448
OFPT_PACKET_IN (xid=0x0): total_len=1514 in_port=1 (via action) data_len=1514 (unbuffered)
priority0:tunnel0:in_port0001:tci(0) mac00:00:00:00:00:13->00:00:00:00:00:20 type0800 proto6 tos0 ttl64 ip10.0.0.13->10.0.0.20 port55914->44789
00:00:00:00:00:13 > 00:00:00:00:00:20, ethertype IPv4 (0x0800), length 1514: 10.0.0.13.55914 > 10.0.0.20.44789: Flags [.], seq 3176742011:3176743459, ack 90392257, win 229, options [nop,nop,TS val 4643110 ecr 4643071], length 1448
OFPT_PACKET_IN (xid=0x0): total_len=1514 in_port=1 (via action) data_len=1514 (unbuffered)
priority0:tunnel0:in_port0001:tci(0) mac00:00:00:00:00:14->00:00:00:00:00:34 type0800 proto6 tos0 ttl64 ip10.0.0.14->10.0.0.34 port52352->45692
00:00:00:00:00:14 > 00:00:00:00:00:34, ethertype IPv4 (0x0800), length 1514: 10.0.0.14.52352 > 10.0.0.34.45692: Flags [.], seq 2934482368:2934483816, ack 1382721224, win 229, options [nop,nop,TS val 4643110 ecr 4642928], length 1448
OFPT_PACKET_IN (xid=0x0): total_len=70 in_port=1 (via action) data_len=70 (unbuffered)
priority0:tunnel0:in_port0001:tci(0) mac00:00:00:00:00:02->00:00:00:00:00:30 type0800 proto1 tos0xc0 ttl64 ip10.0.0.2->10.0.0.30 port3->3
00:00:00:00:00:02 > 00:00:00:00:00:30, ethertype IPv4 (0x0800), length 70: 10.0.0.2 > 10.0.0.30: ICMP 10.0.0.2 udp port 43931 unreachable, length 36
OFPT_PACKET_IN (xid=0x0): total_len=70 in_port=1 (via action) data_len=70 (unbuffered)
priority0:tunnel0:in_port0001:tci(0) mac00:00:00:00:00:02->00:00:00:00:00:30 type0800 proto1 tos0xc0 ttl64 ip10.0.0.2->10.0.0.30 port3->3
00:00:00:00:00:02 > 00:00:00:00:00:30, ethertype IPv4 (0x0800), length 70: 10.0.0.2 > 10.0.0.30: ICMP 10.0.0.2 udp port 43931 unreachable, length 36
OFPT_PACKET_IN (xid=0x0): total_len=70 in_port=1 (via action) data_len=70 (unbuffered)
priority0:tunnel0:in_port0001:tci(0) mac00:00:00:00:00:02->00:00:00:00:00:30 type0800 proto1 tos0xc0 ttl64 ip10.0.0.2->10.0.0.30 port3->3
00:00:00:00:00:02 > 00:00:00:00:00:30, ethertype IPv4 (0x0800), length 70: 10.0.0.2 > 10.0.0.30: ICMP 10.0.0.2 udp port 43931 unreachable, length 36
OFPT_PACKET_IN (xid=0x0): total_len=42 in_port=3 (via action) data_len=42 (unbuffered)
priority0:tunnel0:in_port0003:tci(0) mac00:00:00:00:00:29->00:00:00:00:00:04 type0806 proto1 tos0 ttl0 ip10.0.0.29->10.0.0.4 arp_ha00:00:00:00:00:29->00:00:00:00:00:00
00:00:00:00:00:29 > 00:00:00:00:00:04, ethertype ARP (0x0806), length 42: Request who-has 10.0.0.4 tell 10.0.0.29, length 28
OFPT_PACKET_IN (xid=0x0): total_len=66 in_port=1 (via action) data_len=66 (unbuffered)
priority0:tunnel0:in_port0001:tci(0) mac00:00:00:00:00:20->00:00:00:00:00:13 type0800 proto6 tos0 ttl64 ip10.0.0.20->10.0.0.13 port44789->55914
00:00:00:00:00:20 > 00:00:00:00:00:13, ethertype IPv4 (0x0800), length 66: 10.0.0.20.44789 > 10.0.0.13.55914: Flags [.], ack 3176713051, win 1019, options [nop,nop,TS val 4643111 ecr 4643085], length 0
OFPT_PACKET_IN (xid=0x0): total_len=74 in_port=2 (via action) data_len=74 (unbuffered)
priority0:tunnel0:in_port0002:tci(0) mac00:00:00:00:00:33->00:00:00:00:00:02 type0800 proto6 tos0 ttl64 ip10.0.0.33->10.0.0.2 port41917->12865
00:00:00:00:00:33 > 00:00:00:00:00:02, ethertype IPv4 (0x0800), length 74: 10.0.0.33.41917 > 10.0.0.2.12865: Flags [S], seq 236519274, win 29200, options [mss 1460,sackOK,TS val 4643257 ecr 0,nop,wscale 7], length 0
OFPT_PACKET_IN (xid=0x0): total_len=66 in_port=2 (via action) data_len=66 (unbuffered)
priority0:tunnel0:in_port0002:tci(0) mac00:00:00:00:00:34->00:00:00:00:00:14 type0800 proto6 tos0 ttl64 ip10.0.0.34->10.0.0.14 port45692->52352
00:00:00:00:00:34 > 00:00:00:00:00:14, ethertype IPv4 (0x0800), length 66: 10.0.0.34.45692 > 10.0.0.14.52352: Flags [.], ack 2934476576, win 973, options [nop,nop,TS val 4643246 ecr 4643042], length 0
OFPT_PACKET_IN (xid=0x0): total_len=66 in_port=2 (via action) data_len=66 (unbuffered)
priority0:tunnel0:in_port0002:tci(0) mac00:00:00:00:00:38->00:00:00:00:00:27 type0800 proto6 tos0 ttl64 ip10.0.0.38->10.0.0.27 port60741->52328
00:00:00:00:00:38 > 00:00:00:00:00:27, ethertype IPv4 (0x0800), length 66: 10.0.0.38.60741 > 10.0.0.27.52328: Flags [.], ack 1304838929, win 1810, options [nop,nop,TS val 4643246 ecr 4643141], length 0
OFPT_PACKET_IN (xid=0x0): total_len=66 in_port=2 (via action) data_len=66 (unbuffered)
priority0:tunnel0:in_port0002:tci(0) mac00:00:00:00:00:34->00:00:00:00:00:14 type0800 proto6 tos0 ttl64 ip10.0.0.34->10.0.0.14 port45692->52352
00:00:00:00:00:34 > 00:00:00:00:00:14, ethertype IPv4 (0x0800), length 66: 10.0.0.34.45692 > 10.0.0.14.52352: Flags [.], ack 2934479472, win 973, options [nop,nop,TS val 4643246 ecr 4643058], length 0
OFPT_PACKET_IN (xid=0x0): total_len=66 in_port=2 (via action) data_len=66 (unbuffered)
priority0:tunnel0:in_port0002:tci(0) mac00:00:00:00:00:38->00:00:00:00:00:27 type0800 proto6 tos0 ttl64 ip10.0.0.38->10.0.0.27 port60741->52328
00:00:00:00:00:38 > 00:00:00:00:00:27, ethertype IPv4 (0x0800), length 66: 10.0.0.38.60741 > 10.0.0.27.52328: Flags [.], ack 1304841825, win 1810, options [nop,nop,TS val 4643246 ecr 4643141], length 0
OFPT_PACKET_IN (xid=0x0): total_len=66 in_port=2 (via action) data_len=66 (unbuffered)
priority0:tunnel0:in_port0002:tci(0) mac00:00:00:00:00:38->00:00:00:00:00:27 type0800 proto6 tos0 ttl64 ip10.0.0.38->10.0.0.27 port60741->52328
00:00:00:00:00:38 > 00:00:00:00:00:27, ethertype IPv4 (0x0800), length 66: 10.0.0.38.60741 > 10.0.0.27.52328: Flags [.], ack 1304844721, win 1810, options [nop,nop,TS val 4643246 ecr 4643141], length 0
OFPT_PACKET_IN (xid=0x0): total_len=66 in_port=2 (via action) data_len=66 (unbuffered)
priority0:tunnel0:in_port0002:tci(0) mac00:00:00:00:00:38->00:00:00:00:00:27 type0800 proto6 tos0 ttl64 ip10.0.0.38->10.0.0.27 port60741->52328
00:00:00:00:00:38 > 00:00:00:00:00:27, ethertype IPv4 (0x0800), length 66: 10.0.0.38.60741 > 10.0.0.27.52328: Flags [.], ack 1304847617, win 1810, options [nop,nop,TS val 4643246 ecr 4643141], length 0
OFPT_PACKET_IN (xid=0x0): total_len=66 in_port=2 (via action) data_len=66 (unbuffered)
priority0:tunnel0:in_port0002:tci(0) mac00:00:00:00:00:38->00:00:00:00:00:27 type0800 proto6 tos0 ttl64 ip10.0.0.38->10.0.0.27 port60741->52328
00:00:00:00:00:38 > 00:00:00:00:00:27, ethertype IPv4 (0x0800), length 66: 10.0.0.38.60741 > 10.0.0.27.52328: Flags [.], ack 1304850513, win 1810, options [nop,nop,TS val 4643246 ecr 4643151], length 0
OFPT_PACKET_IN (xid=0x0): total_len=98 in_port=2 (via action) data_len=98 (unbuffered)
priority0:tunnel0:in_port0002:tci(0) mac00:00:00:00:00:35->00:00:00:00:00:20 type0800 proto1 tos0 ttl64 ip10.0.0.35->10.0.0.20 port8->0
00:00:00:00:00:35 > 00:00:00:00:00:20, ethertype IPv4 (0x0800), length 98: 10.0.0.35 > 10.0.0.20: ICMP echo request, id 13606, seq 1, length 64
OFPT_PACKET_OUT (xid=0x0): in_port=3 actions_len=8 actions=FLOOD data_len=1514
00:00:00:00:00:27 > 00:00:00:00:00:38, ethertype IPv4 (0x0800), length 1514: 10.0.0.27.52328 > 10.0.0.38.60741: Flags [.], seq 1304869337:1304870785, ack 2176693538, win 229, options [nop,nop,TS val 4643164 ecr 4643082], length 1448

OFPT_PACKET_OUT (xid=0x0): in_port=1 actions_len=8 actions=FLOOD data_len=66
00:00:00:00:00:01 > 00:00:00:00:00:25, ethertype IPv4 (0x0800), length 66: 10.0.0.1.57670 > 10.0.0.25.38875: Flags [.], ack 2491720682, win 3394, options [nop,nop,TS val 4643084 ecr 4642903], length 0

OFPT_PACKET_OUT (xid=0x0): in_port=3 actions_len=8 actions=FLOOD data_len=1514
00:00:00:00:00:27 > 00:00:00:00:00:38, ethertype IPv4 (0x0800), length 1514: 10.0.0.27.52328 > 10.0.0.38.60741: Flags [.], seq 1304870785:1304872233, ack 2176693538, win 229, options [nop,nop,TS val 4643164 ecr 4643082], length 1448

OFPT_PACKET_OUT (xid=0x0): in_port=1 actions_len=8 actions=FLOOD data_len=66
00:00:00:00:00:20 > 00:00:00:00:00:13, ethertype IPv4 (0x0800), length 66: 10.0.0.20.44789 > 10.0.0.13.55914: Flags [.], ack 3176679747, win 973, options [nop,nop,TS val 4643071 ecr 4643041], length 0

OFPT_PACKET_OUT (xid=0x0): in_port=3 actions_len=8 actions=FLOOD data_len=1514
00:00:00:00:00:27 > 00:00:00:00:00:38, ethertype IPv4 (0x0800), length 1514: 10.0.0.27.52328 > 10.0.0.38.60741: Flags [.], seq 1304872233:1304873681, ack 2176693538, win 229, options [nop,nop,TS val 4643164 ecr 4643082], length 1448

OFPT_PACKET_OUT (xid=0x0): in_port=1 actions_len=8 actions=FLOOD data_len=74
00:00:00:00:00:02 > 00:00:00:00:00:38, ethertype IPv4 (0x0800), length 74: 10.0.0.2.12865 > 10.0.0.38.53085: Flags [S.], seq 1203238987, ack 2628756877, win 28960, options [mss 1460,sackOK,TS val 4643084 ecr 4642665,nop,wscale 7], length 0

OFPT_PACKET_OUT (xid=0x0): in_port=3 actions_len=8 actions=FLOOD data_len=1514
00:00:00:00:00:27 > 00:00:00:00:00:38, ethertype IPv4 (0x0800), length 1514: 10.0.0.27.52328 > 10.0.0.38.60741: Flags [.], seq 1304873681:1304875129, ack 2176693538, win 229, options [nop,nop,TS val 4643164 ecr 4643082], length 1448

OFPT_PACKET_OUT (xid=0x0): in_port=1 actions_len=8 actions=FLOOD data_len=66
00:00:00:00:00:20 > 00:00:00:00:00:13, ethertype IPv4 (0x0800), length 66: 10.0.0.20.44789 > 10.0.0.13.55914: Flags [.], ack 3176681195, win 973, options [nop,nop,TS val 4643081 ecr 4643041], length 0

OFPT_PACKET_OUT (xid=0x0): in_port=3 actions_len=8 actions=FLOOD data_len=1514
00:00:00:00:00:27 > 00:00:00:00:00:38, ethertype IPv4 (0x0800), length 1514: 10.0.0.27.52328 > 10.0.0.38.60741: Flags [.], seq 1304875129:1304876577, ack 2176693538, win 229, options [nop,nop,TS val 4643164 ecr 4643082], length 1448

OFPT_PACKET_OUT (xid=0x0): in_port=1 actions_len=8 actions=FLOOD data_len=66
00:00:00:00:00:07 > 00:00:00:00:00:02, ethertype IPv4 (0x0800), length 66: 10.0.0.7.49636 > 10.0.0.2.12865: Flags [.], ack 2230717626, win 237, options [nop,nop,TS val 4643083 ecr 4643056], length 0

OFPT_PACKET_OUT (xid=0x0): in_port=3 actions_len=8 actions=FLOOD data_len=1514
00:00:00:00:00:27 > 00:00:00:00:00:38, ethertype IPv4 (0x0800), length 1514: 10.0.0.27.52328 > 10.0.0.38.60741: Flags [.], seq 1304876577:1304878025, ack 2176693538, win 229, options [nop,nop,TS val 4643164 ecr 4643098], length 1448

OFPT_PACKET_OUT (xid=0x0): in_port=1 actions_len=8 actions=FLOOD data_len=1514
00:00:00:00:00:13 > 00:00:00:00:00:20, ethertype IPv4 (0x0800), length 1514: 10.0.0.13.55914 > 10.0.0.20.44789: Flags [.], seq 3176710155:3176711603, ack 90392257, win 229, options [nop,nop,TS val 4643085 ecr 4643042], length 1448

OFPT_PACKET_OUT (xid=0x0): in_port=3 actions_len=8 actions=FLOOD data_len=1514
00:00:00:00:00:27 > 00:00:00:00:00:38, ethertype IPv4 (0x0800), length 1514: 10.0.0.27.52328 > 10.0.0.38.60741: Flags [.], seq 1304878025:1304879473, ack 2176693538, win 229, options [nop,nop,TS val 4643164 ecr 4643098], length 1448

OFPT_PACKET_OUT (xid=0x0): in_port=1 actions_len=8 actions=FLOOD data_len=66
00:00:00:00:00:08 > 00:00:00:00:00:02, ethertype IPv4 (0x0800), length 66: 10.0.0.8.38551 > 10.0.0.2.12865: Flags [.], ack 2284740307, win 254, options [nop,nop,TS val 4643083 ecr 4643056], length 0

OFPT_PACKET_OUT (xid=0x0): in_port=3 actions_len=8 actions=FLOOD data_len=1514
00:00:00:00:00:27 > 00:00:00:00:00:38, ethertype IPv4 (0x0800), length 1514: 10.0.0.27.52328 > 10.0.0.38.60741: Flags [.], seq 1304879473:1304880921, ack 2176693538, win 229, options [nop,nop,TS val 4643164 ecr 4643098], length 1448

OFPT_PACKET_OUT (xid=0x0): in_port=1 actions_len=8 actions=FLOOD data_len=66
00:00:00:00:00:20 > 00:00:00:00:00:13, ethertype IPv4 (0x0800), length 66: 10.0.0.20.44789 > 10.0.0.13.55914: Flags [.], ack 3176684091, win 973, options [nop,nop,TS val 4643085 ecr 4643041], length 0

OFPT_PACKET_OUT (xid=0x0): in_port=3 actions_len=8 actions=FLOOD data_len=1514
00:00:00:00:00:27 > 00:00:00:00:00:38, ethertype IPv4 (0x0800), length 1514: 10.0.0.27.52328 > 10.0.0.38.60741: Flags [.], seq 1304880921:1304882369, ack 2176693538, win 229, options [nop,nop,TS val 4643164 ecr 4643098], length 1448

OFPT_PACKET_OUT (xid=0x0): in_port=3 actions_len=8 actions=FLOOD data_len=1514
00:00:00:00:00:27 > 00:00:00:00:00:38, ethertype IPv4 (0x0800), length 1514: 10.0.0.27.52328 > 10.0.0.38.60741: Flags [.], seq 1304882369:1304883817, ack 2176693538, win 229, options [nop,nop,TS val 4643164 ecr 4643098], length 1448

OFPT_PACKET_OUT (xid=0x0): in_port=3 actions_len=8 actions=FLOOD data_len=1514
00:00:00:00:00:27 > 00:00:00:00:00:38, ethertype IPv4 (0x0800), length 1514: 10.0.0.27.52328 > 10.0.0.38.60741: Flags [.], seq 1304883817:1304885265, ack 2176693538, win 229, options [nop,nop,TS val 4643164 ecr 4643098], length 1448

OFPT_PACKET_OUT (xid=0x0): in_port=3 actions_len=8 actions=FLOOD data_len=66
00:00:00:00:00:21 > 00:00:00:00:00:05, ethertype IPv4 (0x0800), length 66: 10.0.0.21.45887 > 10.0.0.5.12865: Flags [.], ack 1986569020, win 254, options [nop,nop,TS val 4643164 ecr 4642970], length 0

OFPT_PACKET_OUT (xid=0x0): in_port=3 actions_len=8 actions=FLOOD data_len=66
00:00:00:00:00:21 > 00:00:00:00:00:05, ethertype IPv4 (0x0800), length 66: 10.0.0.21.45887 > 10.0.0.5.12865: Flags [F.], seq 2640043423, ack 1986569020, win 254, options [nop,nop,TS val 4643164 ecr 4642970], length 0

OFPT_PACKET_OUT (xid=0x0): in_port=3 actions_len=8 actions=FLOOD data_len=42
00:00:00:00:00:25 > 00:00:00:00:00:23, ethertype ARP (0x0806), length 42: Request who-has 10.0.0.23 tell 10.0.0.25, length 28

OFPT_PACKET_OUT (xid=0x0): in_port=2 actions_len=8 actions=FLOOD data_len=66
00:00:00:00:00:38 > 00:00:00:00:00:27, ethertype IPv4 (0x0800), length 66: 10.0.0.38.60741 > 10.0.0.27.52328: Flags [.], ack 1304799833, win 1810, options [nop,nop,TS val 4643186 ecr 4643100], length 0

OFPT_PACKET_OUT (xid=0x0): in_port=2 actions_len=8 actions=FLOOD data_len=66
00:00:00:00:00:38 > 00:00:00:00:00:27, ethertype IPv4 (0x0800), length 66: 10.0.0.38.60741 > 10.0.0.27.52328: Flags [.], ack 1304802729, win 1810, options [nop,nop,TS val 4643190 ecr 4643100], length 0

OFPT_PACKET_OUT (xid=0x0): in_port=2 actions_len=8 actions=FLOOD data_len=66
00:00:00:00:00:38 > 00:00:00:00:00:27, ethertype IPv4 (0x0800), length 66: 10.0.0.38.60741 > 10.0.0.27.52328: Flags [.], ack 1304805625, win 1810, options [nop,nop,TS val 4643190 ecr 4643100], length 0

OFPT_PACKET_OUT (xid=0x0): in_port=2 actions_len=8 actions=FLOOD data_len=66
00:00:00:00:00:38 > 00:00:00:00:00:27, ethertype IPv4 (0x0800), length 66: 10.0.0.38.60741 > 10.0.0.27.52328: Flags [.], ack 1304808521, win 1810, options [nop,nop,TS val 4643190 ecr 4643110], length 0

OFPT_PACKET_OUT (xid=0x0): in_port=1 actions_len=8 actions=FLOOD data_len=66
00:00:00:00:00:09 > 00:00:00:00:00:02, ethertype IPv4 (0x0800), length 66: 10.0.0.9.58506 > 10.0.0.2.12865: Flags [.], ack 3835931700, win 237, options [nop,nop,TS val 4643084 ecr 4643056], length 0

OFPT_PACKET_OUT (xid=0x0): in_port=3 actions_len=8 actions=FLOOD data_len=1514
00:00:00:00:00:25 > 00:00:00:00:00:01, ethertype IPv4 (0x0800), length 1514: 10.0.0.25.38875 > 10.0.0.1.57670: Flags [.], seq 2491965394:2491966842, ack 2892286238, win 229, options [nop,nop,TS val 4643179 ecr 4643010], length 1448

OFPT_PACKET_OUT (xid=0x0): in_port=1 actions_len=8 actions=FLOOD data_len=1514
00:00:00:00:00:13 > 00:00:00:00:00:20, ethertype IPv4 (0x0800), length 1514: 10.0.0.13.55914 > 10.0.0.20.44789: Flags [.], seq 3176711603:3176713051, ack 90392257, win 229, options [nop,nop,TS val 4643085 ecr 4643042], length 1448

OFPT_PACKET_OUT (xid=0x0): in_port=3 actions_len=8 actions=FLOOD data_len=1514
00:00:00:00:00:27 > 00:00:00:00:00:38, ethertype IPv4 (0x0800), length 1514: 10.0.0.27.52328 > 10.0.0.38.60741: Flags [.], seq 1304885265:1304886713, ack 2176693538, win 229, options [nop,nop,TS val 4643179 ecr 4643098], length 1448

OFPT_PACKET_OUT (xid=0x0): in_port=1 actions_len=8 actions=FLOOD data_len=66
00:00:00:00:00:01 > 00:00:00:00:00:25, ethertype IPv4 (0x0800), length 66: 10.0.0.1.57670 > 10.0.0.25.38875: Flags [.], ack 2491723578, win 3394, options [nop,nop,TS val 4643084 ecr 4642903], length 0

OFPT_PACKET_OUT (xid=0x0): in_port=3 actions_len=8 actions=FLOOD data_len=1514
00:00:00:00:00:25 > 00:00:00:00:00:01, ethertype IPv4 (0x0800), length 1514: 10.0.0.25.38875 > 10.0.0.1.57670: Flags [.], seq 2491966842:2491968290, ack 2892286238, win 229, options [nop,nop,TS val 4643179 ecr 4643010], length 1448

OFPT_PACKET_OUT (xid=0x0): in_port=1 actions_len=8 actions=FLOOD data_len=66
00:00:00:00:00:20 > 00:00:00:00:00:13, ethertype IPv4 (0x0800), length 66: 10.0.0.20.44789 > 10.0.0.13.55914: Flags [.], ack 3176686987, win 973, options [nop,nop,TS val 4643085 ecr 4643041], length 0

OFPT_PACKET_OUT (xid=0x0): in_port=3 actions_len=8 actions=FLOOD data_len=1514
00:00:00:00:00:27 > 00:00:00:00:00:38, ethertype IPv4 (0x0800), length 1514: 10.0.0.27.52328 > 10.0.0.38.60741: Flags [.], seq 1304886713:1304888161, ack 2176693538, win 229, options [nop,nop,TS val 4643179 ecr 4643098], length 1448

OFPT_PACKET_OUT (xid=0x0): in_port=1 actions_len=8 actions=FLOOD data_len=66
00:00:00:00:00:02 > 00:00:00:00:00:19, ethertype IPv4 (0x0800), length 66: 10.0.0.2.55079 > 10.0.0.19.38904: Flags [.], ack 1357085275, win 229, options [nop,nop,TS val 4643084 ecr 4642958], length 0

OFPT_PACKET_OUT (xid=0x0): in_port=3 actions_len=8 actions=FLOOD data_len=1514
00:00:00:00:00:25 > 00:00:00:00:00:01, ethertype IPv4 (0x0800), length 1514: 10.0.0.25.38875 > 10.0.0.1.57670: Flags [.], seq 2491968290:2491969738, ack 2892286238, win 229, options [nop,nop,TS val 4643179 ecr 4643027], length 1448

OFPT_PACKET_OUT (xid=0x0): in_port=1 actions_len=8 actions=FLOOD data_len=1514
00:00:00:00:00:13 > 00:00:00:00:00:20, ethertype IPv4 (0x0800), length 1514: 10.0.0.13.55914 > 10.0.0.20.44789: Flags [.], seq 3176713051:3176714499, ack 90392257, win 229, options [nop,nop,TS val 4643086 ecr 4643058], length 1448

OFPT_PACKET_OUT (xid=0x0): in_port=3 actions_len=8 actions=FLOOD data_len=1514
00:00:00:00:00:27 > 00:00:00:00:00:38, ethertype IPv4 (0x0800), length 1514: 10.0.0.27.52328 > 10.0.0.38.60741: Flags [.], seq 1304888161:1304889609, ack 2176693538, win 229, options [nop,nop,TS val 4643179 ecr 4643108], length 1448

OFPT_PACKET_OUT (xid=0x0): in_port=1 actions_len=8 actions=FLOOD data_len=322
00:00:00:00:00:07 > 00:00:00:00:00:02, ethertype IPv4 (0x0800), length 322: 10.0.0.7.49636 > 10.0.0.2.12865: Flags [P.], seq 930790354:930790610, ack 2230717626, win 237, options [nop,nop,TS val 4643084 ecr 4643056], length 256

OFPT_PACKET_OUT (xid=0x0): in_port=3 actions_len=8 actions=FLOOD data_len=1514
00:00:00:00:00:25 > 00:00:00:00:00:01, ethertype IPv4 (0x0800), length 1514: 10.0.0.25.38875 > 10.0.0.1.57670: Flags [.], seq 2491969738:2491971186, ack 2892286238, win 229, options [nop,nop,TS val 4643179 ecr 4643027], length 1448

OFPT_PACKET_OUT (xid=0x0): in_port=1 actions_len=8 actions=FLOOD data_len=66
00:00:00:00:00:20 > 00:00:00:00:00:13, ethertype IPv4 (0x0800), length 66: 10.0.0.20.44789 > 10.0.0.13.55914: Flags [.], ack 3176689883, win 973, options [nop,nop,TS val 4643085 ecr 4643041], length 0

OFPT_PACKET_OUT (xid=0x0): in_port=3 actions_len=8 actions=FLOOD data_len=1514
00:00:00:00:00:27 > 00:00:00:00:00:38, ethertype IPv4 (0x0800), length 1514: 10.0.0.27.52328 > 10.0.0.38.60741: Flags [.], seq 1304889609:1304891057, ack 2176693538, win 229, options [nop,nop,TS val 4643179 ecr 4643108], length 1448

OFPT_PACKET_OUT (xid=0x0): in_port=1 actions_len=8 actions=FLOOD data_len=322
00:00:00:00:00:09 > 00:00:00:00:00:02, ethertype IPv4 (0x0800), length 322: 10.0.0.9.58506 > 10.0.0.2.12865: Flags [P.], seq 3787851381:3787851637, ack 3835931700, win 237, options [nop,nop,TS val 4643084 ecr 4643056], length 256

