OFPT_PACKET_IN (xid=0x0): total_len=1514 in_port=1 (via action) data_len=1514 (unbuffered)
priority0:tunnel0:in_port0001:tci(0) mac00:00:00:00:00:28->00:00:00:00:00:30 type0800 proto6 tos0 ttl64 ip10.0.0.28->10.0.0.30 port55548->43694
00:00:00:00:00:28 > 00:00:00:00:00:30, ethertype IPv4 (0x0800), length 1514: 10.0.0.28.55548 > 10.0.0.30.43694: Flags [.], seq 422829022:422830470, ack 2966268722, win 229, options [nop,nop,TS val 6159152 ecr 6159066], length 1448
OFPT_PACKET_IN (xid=0x0): total_len=1514 in_port=1 (via action) data_len=1514 (unbuffered)
priority0:tunnel0:in_port0001:tci(0) mac00:00:00:00:00:28->00:00:00:00:00:30 type0800 proto6 tos0 ttl64 ip10.0.0.28->10.0.0.30 port55548->43694
00:00:00:00:00:28 > 00:00:00:00:00:30, ethertype IPv4 (0x0800), length 1514: 10.0.0.28.55548 > 10.0.0.30.43694: Flags [.], seq 422830470:422831918, ack 2966268722, win 229, options [nop,nop,TS val 6159152 ecr 6159066], length 1448
OFPT_PACKET_IN (xid=0x0): total_len=1514 in_port=1 (via action) data_len=1514 (unbuffered)
priority0:tunnel0:in_port0001:tci(0) mac00:00:00:00:00:28->00:00:00:00:00:30 type0800 proto6 tos0 ttl64 ip10.0.0.28->10.0.0.30 port55548->43694
00:00:00:00:00:28 > 00:00:00:00:00:30, ethertype IPv4 (0x0800), length 1514: 10.0.0.28.55548 > 10.0.0.30.43694: Flags [.], seq 422831918:422833366, ack 2966268722, win 229, options [nop,nop,TS val 6159152 ecr 6159066], length 1448
OFPT_PACKET_IN (xid=0x0): total_len=1514 in_port=1 (via action) data_len=1514 (unbuffered)
priority0:tunnel0:in_port0001:tci(0) mac00:00:00:00:00:28->00:00:00:00:00:30 type0800 proto6 tos0 ttl64 ip10.0.0.28->10.0.0.30 port55548->43694
00:00:00:00:00:28 > 00:00:00:00:00:30, ethertype IPv4 (0x0800), length 1514: 10.0.0.28.55548 > 10.0.0.30.43694: Flags [.], seq 422833366:422834814, ack 2966268722, win 229, options [nop,nop,TS val 6159152 ecr 6159066], length 1448
OFPT_PACKET_IN (xid=0x0): total_len=1514 in_port=1 (via action) data_len=1514 (unbuffered)
priority0:tunnel0:in_port0001:tci(0) mac00:00:00:00:00:28->00:00:00:00:00:30 type0800 proto6 tos0 ttl64 ip10.0.0.28->10.0.0.30 port55548->43694
00:00:00:00:00:28 > 00:00:00:00:00:30, ethertype IPv4 (0x0800), length 1514: 10.0.0.28.55548 > 10.0.0.30.43694: Flags [.], seq 422834814:422836262, ack 2966268722, win 229, options [nop,nop,TS val 6159152 ecr 6159066], length 1448
OFPT_PACKET_IN (xid=0x0): total_len=1514 in_port=1 (via action) data_len=1514 (unbuffered)
priority0:tunnel0:in_port0001:tci(0) mac00:00:00:00:00:28->00:00:00:00:00:30 type0800 proto6 tos0 ttl64 ip10.0.0.28->10.0.0.30 port55548->43694
00:00:00:00:00:28 > 00:00:00:00:00:30, ethertype IPv4 (0x0800), length 1514: 10.0.0.28.55548 > 10.0.0.30.43694: Flags [.], seq 422836262:422837710, ack 2966268722, win 229, options [nop,nop,TS val 6159152 ecr 6159066], length 1448
OFPT_PACKET_IN (xid=0x0): total_len=1514 in_port=1 (via action) data_len=1514 (unbuffered)
priority0:tunnel0:in_port0001:tci(0) mac00:00:00:00:00:28->00:00:00:00:00:30 type0800 proto6 tos0 ttl64 ip10.0.0.28->10.0.0.30 port55548->43694
00:00:00:00:00:28 > 00:00:00:00:00:30, ethertype IPv4 (0x0800), length 1514: 10.0.0.28.55548 > 10.0.0.30.43694: Flags [.], seq 422837710:422839158, ack 2966268722, win 229, options [nop,nop,TS val 6159152 ecr 6159066], length 1448
OFPT_PACKET_IN (xid=0x0): total_len=1514 in_port=1 (via action) data_len=1514 (unbuffered)
priority0:tunnel0:in_port0001:tci(0) mac00:00:00:00:00:28->00:00:00:00:00:30 type0800 proto6 tos0 ttl64 ip10.0.0.28->10.0.0.30 port55548->43694
00:00:00:00:00:28 > 00:00:00:00:00:30, ethertype IPv4 (0x0800), length 1514: 10.0.0.28.55548 > 10.0.0.30.43694: Flags [.], seq 422839158:422840606, ack 2966268722, win 229, options [nop,nop,TS val 6159152 ecr 6159066], length 1448
OFPT_PACKET_IN (xid=0x0): total_len=1514 in_port=1 (via action) data_len=1514 (unbuffered)
priority0:tunnel0:in_port0001:tci(0) mac00:00:00:00:00:28->00:00:00:00:00:30 type0800 proto6 tos0 ttl64 ip10.0.0.28->10.0.0.30 port55548->43694
00:00:00:00:00:28 > 00:00:00:00:00:30, ethertype IPv4 (0x0800), length 1514: 10.0.0.28.55548 > 10.0.0.30.43694: Flags [.], seq 422840606:422842054, ack 2966268722, win 229, options [nop,nop,TS val 6159152 ecr 6159066], length 1448
OFPT_PACKET_IN (xid=0x0): total_len=1514 in_port=1 (via action) data_len=1514 (unbuffered)
priority0:tunnel0:in_port0001:tci(0) mac00:00:00:00:00:28->00:00:00:00:00:30 type0800 proto6 tos0 ttl64 ip10.0.0.28->10.0.0.30 port55548->43694
00:00:00:00:00:28 > 00:00:00:00:00:30, ethertype IPv4 (0x0800), length 1514: 10.0.0.28.55548 > 10.0.0.30.43694: Flags [.], seq 422842054:422843502, ack 2966268722, win 229, options [nop,nop,TS val 6159152 ecr 6159066], length 1448
OFPT_PACKET_IN (xid=0x0): total_len=1514 in_port=1 (via action) data_len=1514 (unbuffered)
priority0:tunnel0:in_port0001:tci(0) mac00:00:00:00:00:28->00:00:00:00:00:30 type0800 proto6 tos0 ttl64 ip10.0.0.28->10.0.0.30 port55548->43694
00:00:00:00:00:28 > 00:00:00:00:00:30, ethertype IPv4 (0x0800), length 1514: 10.0.0.28.55548 > 10.0.0.30.43694: Flags [.], seq 422843502:422844950, ack 2966268722, win 229, options [nop,nop,TS val 6159152 ecr 6159066], length 1448
OFPT_PACKET_IN (xid=0x0): total_len=1514 in_port=1 (via action) data_len=1514 (unbuffered)
priority0:tunnel0:in_port0001:tci(0) mac00:00:00:00:00:28->00:00:00:00:00:30 type0800 proto6 tos0 ttl64 ip10.0.0.28->10.0.0.30 port55548->43694
00:00:00:00:00:28 > 00:00:00:00:00:30, ethertype IPv4 (0x0800), length 1514: 10.0.0.28.55548 > 10.0.0.30.43694: Flags [.], seq 422844950:422846398, ack 2966268722, win 229, options [nop,nop,TS val 6159152 ecr 6159066], length 1448
OFPT_PACKET_IN (xid=0x0): total_len=1514 in_port=1 (via action) data_len=1514 (unbuffered)
priority0:tunnel0:in_port0001:tci(0) mac00:00:00:00:00:28->00:00:00:00:00:30 type0800 proto6 tos0 ttl64 ip10.0.0.28->10.0.0.30 port55548->43694
00:00:00:00:00:28 > 00:00:00:00:00:30, ethertype IPv4 (0x0800), length 1514: 10.0.0.28.55548 > 10.0.0.30.43694: Flags [.], seq 422846398:422847846, ack 2966268722, win 229, options [nop,nop,TS val 6159152 ecr 6159066], length 1448
OFPT_PACKET_IN (xid=0x0): total_len=1514 in_port=1 (via action) data_len=1514 (unbuffered)
priority0:tunnel0:in_port0001:tci(0) mac00:00:00:00:00:28->00:00:00:00:00:30 type0800 proto6 tos0 ttl64 ip10.0.0.28->10.0.0.30 port55548->43694
00:00:00:00:00:28 > 00:00:00:00:00:30, ethertype IPv4 (0x0800), length 1514: 10.0.0.28.55548 > 10.0.0.30.43694: Flags [.], seq 422847846:422849294, ack 2966268722, win 229, options [nop,nop,TS val 6159152 ecr 6159066], length 1448
OFPT_PACKET_IN (xid=0x0): total_len=66 in_port=1 (via action) data_len=66 (unbuffered)
priority0:tunnel0:in_port0001:tci(0) mac00:00:00:00:00:25->00:00:00:00:00:04 type0800 proto6 tos0 ttl64 ip10.0.0.25->10.0.0.4 port44884->57141
00:00:00:00:00:25 > 00:00:00:00:00:04, ethertype IPv4 (0x0800), length 66: 10.0.0.25.44884 > 10.0.0.4.57141: Flags [.], ack 289070766, win 1494, options [nop,nop,TS val 6159163 ecr 6158889], length 0
OFPT_PACKET_IN (xid=0x0): total_len=66 in_port=1 (via action) data_len=66 (unbuffered)
priority0:tunnel0:in_port0001:tci(0) mac00:00:00:00:00:31->00:00:00:00:00:32 type0800 proto6 tos0 ttl64 ip10.0.0.31->10.0.0.32 port46349->53889
00:00:00:00:00:31 > 00:00:00:00:00:32, ethertype IPv4 (0x0800), length 66: 10.0.0.31.46349 > 10.0.0.32.53889: Flags [.], ack 3924121582, win 951, options [nop,nop,TS val 6159165 ecr 6159091], length 0
OFPT_PACKET_IN (xid=0x0): total_len=1514 in_port=1 (via action) data_len=1514 (unbuffered)
priority0:tunnel0:in_port0001:tci(0) mac00:00:00:00:00:39->00:00:00:00:00:14 type0800 proto6 tos0 ttl64 ip10.0.0.39->10.0.0.14 port54965->40026
00:00:00:00:00:39 > 00:00:00:00:00:14, ethertype IPv4 (0x0800), length 1514: 10.0.0.39.54965 > 10.0.0.14.40026: Flags [.], seq 3555289192:3555290640, ack 2979759350, win 229, options [nop,nop,TS val 6159165 ecr 6158907], length 1448
OFPT_PACKET_IN (xid=0x0): total_len=1514 in_port=1 (via action) data_len=1514 (unbuffered)
priority0:tunnel0:in_port0001:tci(0) mac00:00:00:00:00:39->00:00:00:00:00:14 type0800 proto6 tos0 ttl64 ip10.0.0.39->10.0.0.14 port54965->40026
00:00:00:00:00:39 > 00:00:00:00:00:14, ethertype IPv4 (0x0800), length 1514: 10.0.0.39.54965 > 10.0.0.14.40026: Flags [.], seq 3555290640:3555292088, ack 2979759350, win 229, options [nop,nop,TS val 6159165 ecr 6158907], length 1448
OFPT_PACKET_IN (xid=0x0): total_len=1514 in_port=1 (via action) data_len=1514 (unbuffered)
priority0:tunnel0:in_port0001:tci(0) mac00:00:00:00:00:39->00:00:00:00:00:14 type0800 proto6 tos0 ttl64 ip10.0.0.39->10.0.0.14 port54965->40026
00:00:00:00:00:39 > 00:00:00:00:00:14, ethertype IPv4 (0x0800), length 1514: 10.0.0.39.54965 > 10.0.0.14.40026: Flags [.], seq 3555292088:3555293536, ack 2979759350, win 229, options [nop,nop,TS val 6159176 ecr 6158917], length 1448
OFPT_PACKET_IN (xid=0x0): total_len=1514 in_port=1 (via action) data_len=1514 (unbuffered)
priority0:tunnel0:in_port0001:tci(0) mac00:00:00:00:00:39->00:00:00:00:00:14 type0800 proto6 tos0 ttl64 ip10.0.0.39->10.0.0.14 port54965->40026
00:00:00:00:00:39 > 00:00:00:00:00:14, ethertype IPv4 (0x0800), length 1514: 10.0.0.39.54965 > 10.0.0.14.40026: Flags [.], seq 3555293536:3555294984, ack 2979759350, win 229, options [nop,nop,TS val 6159176 ecr 6158917], length 1448
OFPT_PACKET_IN (xid=0x0): total_len=1514 in_port=1 (via action) data_len=1514 (unbuffered)
priority0:tunnel0:in_port0001:tci(0) mac00:00:00:00:00:39->00:00:00:00:00:14 type0800 proto6 tos0 ttl64 ip10.0.0.39->10.0.0.14 port54965->40026
00:00:00:00:00:39 > 00:00:00:00:00:14, ethertype IPv4 (0x0800), length 1514: 10.0.0.39.54965 > 10.0.0.14.40026: Flags [.], seq 3555294984:3555296432, ack 2979759350, win 229, options [nop,nop,TS val 6159176 ecr 6158921], length 1448
OFPT_PACKET_IN (xid=0x0): total_len=1514 in_port=1 (via action) data_len=1514 (unbuffered)
priority0:tunnel0:in_port0001:tci(0) mac00:00:00:00:00:39->00:00:00:00:00:14 type0800 proto6 tos0 ttl64 ip10.0.0.39->10.0.0.14 port54965->40026
00:00:00:00:00:39 > 00:00:00:00:00:14, ethertype IPv4 (0x0800), length 1514: 10.0.0.39.54965 > 10.0.0.14.40026: Flags [.], seq 3555296432:3555297880, ack 2979759350, win 229, options [nop,nop,TS val 6159176 ecr 6158921], length 1448
OFPT_PACKET_IN (xid=0x0): total_len=1514 in_port=1 (via action) data_len=1514 (unbuffered)
priority0:tunnel0:in_port0001:tci(0) mac00:00:00:00:00:39->00:00:00:00:00:14 type0800 proto6 tos0 ttl64 ip10.0.0.39->10.0.0.14 port54965->40026
00:00:00:00:00:39 > 00:00:00:00:00:14, ethertype IPv4 (0x0800), length 1514: 10.0.0.39.54965 > 10.0.0.14.40026: Flags [.], seq 3555297880:3555299328, ack 2979759350, win 229, options [nop,nop,TS val 6159176 ecr 6158921], length 1448
OFPT_PACKET_IN (xid=0x0): total_len=1514 in_port=1 (via action) data_len=1514 (unbuffered)
priority0:tunnel0:in_port0001:tci(0) mac00:00:00:00:00:39->00:00:00:00:00:14 type0800 proto6 tos0 ttl64 ip10.0.0.39->10.0.0.14 port54965->40026
00:00:00:00:00:39 > 00:00:00:00:00:14, ethertype IPv4 (0x0800), length 1514: 10.0.0.39.54965 > 10.0.0.14.40026: Flags [.], seq 3555299328:3555300776, ack 2979759350, win 229, options [nop,nop,TS val 6159176 ecr 6158921], length 1448
OFPT_PACKET_IN (xid=0x0): total_len=1514 in_port=1 (via action) data_len=1514 (unbuffered)
priority0:tunnel0:in_port0001:tci(0) mac00:00:00:00:00:39->00:00:00:00:00:14 type0800 proto6 tos0 ttl64 ip10.0.0.39->10.0.0.14 port54965->40026
00:00:00:00:00:39 > 00:00:00:00:00:14, ethertype IPv4 (0x0800), length 1514: 10.0.0.39.54965 > 10.0.0.14.40026: Flags [.], seq 3555300776:3555302224, ack 2979759350, win 229, options [nop,nop,TS val 6159176 ecr 6158921], length 1448
OFPT_PACKET_IN (xid=0x0): total_len=1514 in_port=1 (via action) data_len=1514 (unbuffered)
priority0:tunnel0:in_port0001:tci(0) mac00:00:00:00:00:39->00:00:00:00:00:14 type0800 proto6 tos0 ttl64 ip10.0.0.39->10.0.0.14 port54965->40026
00:00:00:00:00:39 > 00:00:00:00:00:14, ethertype IPv4 (0x0800), length 1514: 10.0.0.39.54965 > 10.0.0.14.40026: Flags [.], seq 3555302224:3555303672, ack 2979759350, win 229, options [nop,nop,TS val 6159176 ecr 6158921], length 1448
OFPT_PACKET_IN (xid=0x0): total_len=1514 in_port=1 (via action) data_len=1514 (unbuffered)
priority0:tunnel0:in_port0001:tci(0) mac00:00:00:00:00:39->00:00:00:00:00:14 type0800 proto6 tos0 ttl64 ip10.0.0.39->10.0.0.14 port54965->40026
00:00:00:00:00:39 > 00:00:00:00:00:14, ethertype IPv4 (0x0800), length 1514: 10.0.0.39.54965 > 10.0.0.14.40026: Flags [.], seq 3555303672:3555305120, ack 2979759350, win 229, options [nop,nop,TS val 6159176 ecr 6158921], length 1448
OFPT_PACKET_IN (xid=0x0): total_len=1514 in_port=1 (via action) data_len=1514 (unbuffered)
priority0:tunnel0:in_port0001:tci(0) mac00:00:00:00:00:39->00:00:00:00:00:14 type0800 proto6 tos0 ttl64 ip10.0.0.39->10.0.0.14 port54965->40026
00:00:00:00:00:39 > 00:00:00:00:00:14, ethertype IPv4 (0x0800), length 1514: 10.0.0.39.54965 > 10.0.0.14.40026: Flags [.], seq 3555305120:3555306568, ack 2979759350, win 229, options [nop,nop,TS val 6159176 ecr 6158921], length 1448
OFPT_PACKET_IN (xid=0x0): total_len=66 in_port=1 (via action) data_len=66 (unbuffered)
priority0:tunnel0:in_port0001:tci(0) mac00:00:00:00:00:24->00:00:00:00:00:03 type0800 proto6 tos0 ttl64 ip10.0.0.24->10.0.0.3 port52886->43283
00:00:00:00:00:24 > 00:00:00:00:00:03, ethertype IPv4 (0x0800), length 66: 10.0.0.24.52886 > 10.0.0.3.43283: Flags [.], ack 75794283, win 4887, options [nop,nop,TS val 6159168 ecr 6158905], length 0
OFPT_PACKET_IN (xid=0x0): total_len=66 in_port=1 (via action) data_len=66 (unbuffered)
priority0:tunnel0:in_port0001:tci(0) mac00:00:00:00:00:25->00:00:00:00:00:04 type0800 proto6 tos0 ttl64 ip10.0.0.25->10.0.0.4 port44884->57141
00:00:00:00:00:25 > 00:00:00:00:00:04, ethertype IPv4 (0x0800), length 66: 10.0.0.25.44884 > 10.0.0.4.57141: Flags [.], ack 289073662, win 1494, options [nop,nop,TS val 6159167 ecr 6158889], length 0
OFPT_PACKET_IN (xid=0x0): total_len=66 in_port=2 (via action) data_len=66 (unbuffered)
priority0:tunnel0:in_port0002:tci(0) mac00:00:00:00:00:14->00:00:00:00:00:39 type0800 proto6 tos0 ttl64 ip10.0.0.14->10.0.0.39 port40026->54965
00:00:00:00:00:14 > 00:00:00:00:00:39, ethertype IPv4 (0x0800), length 66: 10.0.0.14.40026 > 10.0.0.39.54965: Flags [.], ack 3555222584, win 5453, options [nop,nop,TS val 6159440 ecr 6159091], length 0
OFPT_PACKET_IN (xid=0x0): total_len=66 in_port=2 (via action) data_len=66 (unbuffered)
priority0:tunnel0:in_port0002:tci(0) mac00:00:00:00:00:14->00:00:00:00:00:39 type0800 proto6 tos0 ttl64 ip10.0.0.14->10.0.0.39 port40026->54965
00:00:00:00:00:14 > 00:00:00:00:00:39, ethertype IPv4 (0x0800), length 66: 10.0.0.14.40026 > 10.0.0.39.54965: Flags [.], ack 3555225480, win 5453, options [nop,nop,TS val 6159440 ecr 6159091], length 0
OFPT_PACKET_IN (xid=0x0): total_len=66 in_port=2 (via action) data_len=66 (unbuffered)
priority0:tunnel0:in_port0002:tci(0) mac00:00:00:00:00:14->00:00:00:00:00:39 type0800 proto6 tos0 ttl64 ip10.0.0.14->10.0.0.39 port40026->54965
00:00:00:00:00:14 > 00:00:00:00:00:39, ethertype IPv4 (0x0800), length 66: 10.0.0.14.40026 > 10.0.0.39.54965: Flags [.], ack 3555228376, win 5453, options [nop,nop,TS val 6159440 ecr 6159091], length 0
OFPT_PACKET_IN (xid=0x0): total_len=66 in_port=2 (via action) data_len=66 (unbuffered)
priority0:tunnel0:in_port0002:tci(0) mac00:00:00:00:00:14->00:00:00:00:00:39 type0800 proto6 tos0 ttl64 ip10.0.0.14->10.0.0.39 port40026->54965
00:00:00:00:00:14 > 00:00:00:00:00:39, ethertype IPv4 (0x0800), length 66: 10.0.0.14.40026 > 10.0.0.39.54965: Flags [.], ack 3555231272, win 5453, options [nop,nop,TS val 6159440 ecr 6159091], length 0
OFPT_PACKET_IN (xid=0x0): total_len=74 in_port=3 (via action) data_len=74 (unbuffered)
priority0:tunnel0:in_port0003:tci(0) mac00:00:00:00:00:02->00:00:00:00:00:29 type0800 proto6 tos0 ttl64 ip10.0.0.2->10.0.0.29 port56202->51549
00:00:00:00:00:02 > 00:00:00:00:00:29, ethertype IPv4 (0x0800), length 74: 10.0.0.2.56202 > 10.0.0.29.51549: Flags [S], seq 2355082161, win 29200, options [mss 1460,sackOK,TS val 6159427 ecr 0,nop,wscale 7], length 0
OFPT_PACKET_IN (xid=0x0): total_len=66 in_port=2 (via action) data_len=66 (unbuffered)
priority0:tunnel0:in_port0002:tci(0) mac00:00:00:00:00:14->00:00:00:00:00:39 type0800 proto6 tos0 ttl64 ip10.0.0.14->10.0.0.39 port40026->54965
00:00:00:00:00:14 > 00:00:00:00:00:39, ethertype IPv4 (0x0800), length 66: 10.0.0.14.40026 > 10.0.0.39.54965: Flags [.], ack 3555234168, win 5453, options [nop,nop,TS val 6159440 ecr 6159091], length 0
OFPT_PACKET_IN (xid=0x0): total_len=70 in_port=3 (via action) data_len=70 (unbuffered)
priority0:tunnel0:in_port0003:tci(0) mac00:00:00:00:00:02->00:00:00:00:00:16 type0800 proto1 tos0xc0 ttl64 ip10.0.0.2->10.0.0.16 port3->3
00:00:00:00:00:02 > 00:00:00:00:00:16, ethertype IPv4 (0x0800), length 70: 10.0.0.2 > 10.0.0.16: ICMP 10.0.0.2 udp port 40199 unreachable, length 36
OFPT_PACKET_IN (xid=0x0): total_len=66 in_port=2 (via action) data_len=66 (unbuffered)
priority0:tunnel0:in_port0002:tci(0) mac00:00:00:00:00:14->00:00:00:00:00:39 type0800 proto6 tos0 ttl64 ip10.0.0.14->10.0.0.39 port40026->54965
00:00:00:00:00:14 > 00:00:00:00:00:39, ethertype IPv4 (0x0800), length 66: 10.0.0.14.40026 > 10.0.0.39.54965: Flags [.], ack 3555237064, win 5453, options [nop,nop,TS val 6159440 ecr 6159091], length 0
OFPT_PACKET_IN (xid=0x0): total_len=1514 in_port=3 (via action) data_len=1514 (unbuffered)
priority0:tunnel0:in_port0003:tci(0) mac00:00:00:00:00:04->00:00:00:00:00:25 type0800 proto6 tos0 ttl64 ip10.0.0.4->10.0.0.25 port57141->44884
00:00:00:00:00:04 > 00:00:00:00:00:25, ethertype IPv4 (0x0800), length 1514: 10.0.0.4.57141 > 10.0.0.25.44884: Flags [.], seq 289121446:289122894, ack 3923937635, win 229, options [nop,nop,TS val 6159436 ecr 6159078], length 1448
OFPT_PACKET_IN (xid=0x0): total_len=66 in_port=2 (via action) data_len=66 (unbuffered)
priority0:tunnel0:in_port0002:tci(0) mac00:00:00:00:00:14->00:00:00:00:00:39 type0800 proto6 tos0 ttl64 ip10.0.0.14->10.0.0.39 port40026->54965
00:00:00:00:00:14 > 00:00:00:00:00:39, ethertype IPv4 (0x0800), length 66: 10.0.0.14.40026 > 10.0.0.39.54965: Flags [.], ack 3555239960, win 5453, options [nop,nop,TS val 6159440 ecr 6159091], length 0
OFPT_PACKET_IN (xid=0x0): total_len=70 in_port=3 (via action) data_len=70 (unbuffered)
priority0:tunnel0:in_port0003:tci(0) mac00:00:00:00:00:02->00:00:00:00:00:16 type0800 proto1 tos0xc0 ttl64 ip10.0.0.2->10.0.0.16 port3->3
00:00:00:00:00:02 > 00:00:00:00:00:16, ethertype IPv4 (0x0800), length 70: 10.0.0.2 > 10.0.0.16: ICMP 10.0.0.2 udp port 40199 unreachable, length 36
OFPT_PACKET_IN (xid=0x0): total_len=1514 in_port=3 (via action) data_len=1514 (unbuffered)
priority0:tunnel0:in_port0003:tci(0) mac00:00:00:00:00:04->00:00:00:00:00:25 type0800 proto6 tos0 ttl64 ip10.0.0.4->10.0.0.25 port57141->44884
00:00:00:00:00:04 > 00:00:00:00:00:25, ethertype IPv4 (0x0800), length 1514: 10.0.0.4.57141 > 10.0.0.25.44884: Flags [.], seq 289122894:289124342, ack 3923937635, win 229, options [nop,nop,TS val 6159436 ecr 6159078], length 1448
OFPT_PACKET_IN (xid=0x0): total_len=70 in_port=3 (via action) data_len=70 (unbuffered)
priority0:tunnel0:in_port0003:tci(0) mac00:00:00:00:00:02->00:00:00:00:00:16 type0800 proto1 tos0xc0 ttl64 ip10.0.0.2->10.0.0.16 port3->3
00:00:00:00:00:02 > 00:00:00:00:00:16, ethertype IPv4 (0x0800), length 70: 10.0.0.2 > 10.0.0.16: ICMP 10.0.0.2 udp port 40199 unreachable, length 36
OFPT_PACKET_IN (xid=0x0): total_len=1514 in_port=3 (via action) data_len=1514 (unbuffered)
priority0:tunnel0:in_port0003:tci(0) mac00:00:00:00:00:04->00:00:00:00:00:25 type0800 proto6 tos0 ttl64 ip10.0.0.4->10.0.0.25 port57141->44884
00:00:00:00:00:04 > 00:00:00:00:00:25, ethertype IPv4 (0x0800), length 1514: 10.0.0.4.57141 > 10.0.0.25.44884: Flags [.], seq 289124342:289125790, ack 3923937635, win 229, options [nop,nop,TS val 6159436 ecr 6159078], length 1448
OFPT_PACKET_IN (xid=0x0): total_len=66 in_port=3 (via action) data_len=66 (unbuffered)
priority0:tunnel0:in_port0003:tci(0) mac00:00:00:00:00:02->00:00:00:00:00:16 type0800 proto6 tos0 ttl64 ip10.0.0.2->10.0.0.16 port12865->47569
00:00:00:00:00:02 > 00:00:00:00:00:16, ethertype IPv4 (0x0800), length 66: 10.0.0.2.12865 > 10.0.0.16.47569: Flags [F.], seq 3728085622, ack 3663049695, win 243, options [nop,nop,TS val 6159437 ecr 6159322], length 0
OFPT_PACKET_IN (xid=0x0): total_len=1514 in_port=3 (via action) data_len=1514 (unbuffered)
priority0:tunnel0:in_port0003:tci(0) mac00:00:00:00:00:04->00:00:00:00:00:25 type0800 proto6 tos0 ttl64 ip10.0.0.4->10.0.0.25 port57141->44884
00:00:00:00:00:04 > 00:00:00:00:00:25, ethertype IPv4 (0x0800), length 1514: 10.0.0.4.57141 > 10.0.0.25.44884: Flags [.], seq 289125790:289127238, ack 3923937635, win 229, options [nop,nop,TS val 6159436 ecr 6159078], length 1448
OFPT_PACKET_IN (xid=0x0): total_len=1514 in_port=3 (via action) data_len=1514 (unbuffered)
priority0:tunnel0:in_port0003:tci(0) mac00:00:00:00:00:04->00:00:00:00:00:25 type0800 proto6 tos0 ttl64 ip10.0.0.4->10.0.0.25 port57141->44884
00:00:00:00:00:04 > 00:00:00:00:00:25, ethertype IPv4 (0x0800), length 1514: 10.0.0.4.57141 > 10.0.0.25.44884: Flags [.], seq 289127238:289128686, ack 3923937635, win 229, options [nop,nop,TS val 6159436 ecr 6159078], length 1448
OFPT_PACKET_IN (xid=0x0): total_len=1514 in_port=3 (via action) data_len=1514 (unbuffered)
priority0:tunnel0:in_port0003:tci(0) mac00:00:00:00:00:04->00:00:00:00:00:25 type0800 proto6 tos0 ttl64 ip10.0.0.4->10.0.0.25 port57141->44884
00:00:00:00:00:04 > 00:00:00:00:00:25, ethertype IPv4 (0x0800), length 1514: 10.0.0.4.57141 > 10.0.0.25.44884: Flags [.], seq 289128686:289130134, ack 3923937635, win 229, options [nop,nop,TS val 6159436 ecr 6159078], length 1448
OFPT_PACKET_IN (xid=0x0): total_len=1514 in_port=3 (via action) data_len=1514 (unbuffered)
priority0:tunnel0:in_port0003:tci(0) mac00:00:00:00:00:04->00:00:00:00:00:25 type0800 proto6 tos0 ttl64 ip10.0.0.4->10.0.0.25 port57141->44884
00:00:00:00:00:04 > 00:00:00:00:00:25, ethertype IPv4 (0x0800), length 1514: 10.0.0.4.57141 > 10.0.0.25.44884: Flags [.], seq 289130134:289131582, ack 3923937635, win 229, options [nop,nop,TS val 6159436 ecr 6159078], length 1448
OFPT_PACKET_IN (xid=0x0): total_len=1514 in_port=3 (via action) data_len=1514 (unbuffered)
priority0:tunnel0:in_port0003:tci(0) mac00:00:00:00:00:04->00:00:00:00:00:25 type0800 proto6 tos0 ttl64 ip10.0.0.4->10.0.0.25 port57141->44884
00:00:00:00:00:04 > 00:00:00:00:00:25, ethertype IPv4 (0x0800), length 1514: 10.0.0.4.57141 > 10.0.0.25.44884: Flags [.], seq 289131582:289133030, ack 3923937635, win 229, options [nop,nop,TS val 6159436 ecr 6159078], length 1448
OFPT_PACKET_IN (xid=0x0): total_len=1514 in_port=3 (via action) data_len=1514 (unbuffered)
priority0:tunnel0:in_port0003:tci(0) mac00:00:00:00:00:04->00:00:00:00:00:25 type0800 proto6 tos0 ttl64 ip10.0.0.4->10.0.0.25 port57141->44884
00:00:00:00:00:04 > 00:00:00:00:00:25, ethertype IPv4 (0x0800), length 1514: 10.0.0.4.57141 > 10.0.0.25.44884: Flags [.], seq 289133030:289134478, ack 3923937635, win 229, options [nop,nop,TS val 6159436 ecr 6159079], length 1448
OFPT_PACKET_IN (xid=0x0): total_len=1514 in_port=3 (via action) data_len=1514 (unbuffered)
priority0:tunnel0:in_port0003:tci(0) mac00:00:00:00:00:04->00:00:00:00:00:25 type0800 proto6 tos0 ttl64 ip10.0.0.4->10.0.0.25 port57141->44884
00:00:00:00:00:04 > 00:00:00:00:00:25, ethertype IPv4 (0x0800), length 1514: 10.0.0.4.57141 > 10.0.0.25.44884: Flags [.], seq 289134478:289135926, ack 3923937635, win 229, options [nop,nop,TS val 6159436 ecr 6159079], length 1448
OFPT_PACKET_IN (xid=0x0): total_len=1514 in_port=3 (via action) data_len=1514 (unbuffered)
priority0:tunnel0:in_port0003:tci(0) mac00:00:00:00:00:04->00:00:00:00:00:25 type0800 proto6 tos0 ttl64 ip10.0.0.4->10.0.0.25 port57141->44884
00:00:00:00:00:04 > 00:00:00:00:00:25, ethertype IPv4 (0x0800), length 1514: 10.0.0.4.57141 > 10.0.0.25.44884: Flags [.], seq 289135926:289137374, ack 3923937635, win 229, options [nop,nop,TS val 6159436 ecr 6159089], length 1448
OFPT_PACKET_IN (xid=0x0): total_len=74 in_port=3 (via action) data_len=74 (unbuffered)
priority0:tunnel0:in_port0003:tci(0) mac00:00:00:00:00:07->00:00:00:00:00:25 type0800 proto6 tos0 ttl64 ip10.0.0.7->10.0.0.25 port55227->12865
00:00:00:00:00:07 > 00:00:00:00:00:25, ethertype IPv4 (0x0800), length 74: 10.0.0.7.55227 > 10.0.0.25.12865: Flags [S], seq 1302641878, win 29200, options [mss 1460,sackOK,TS val 6158770 ecr 0,nop,wscale 7], length 0
OFPT_PACKET_IN (xid=0x0): total_len=74 in_port=3 (via action) data_len=74 (unbuffered)
priority0:tunnel0:in_port0003:tci(0) mac00:00:00:00:00:07->00:00:00:00:00:25 type0800 proto6 tos0 ttl64 ip10.0.0.7->10.0.0.25 port55227->12865
00:00:00:00:00:07 > 00:00:00:00:00:25, ethertype IPv4 (0x0800), length 74: 10.0.0.7.55227 > 10.0.0.25.12865: Flags [S], seq 1302641878, win 29200, options [mss 1460,sackOK,TS val 6159020 ecr 0,nop,wscale 7], length 0
OFPT_PACKET_IN (xid=0x0): total_len=170 in_port=3 (via action) data_len=170 (unbuffered)
priority0:tunnel0:in_port0003:tci(0) mac00:00:00:00:00:02->00:00:00:00:00:24 type0800 proto17 tos0 ttl64 ip10.0.0.2->10.0.0.24 port38027->45602
00:00:00:00:00:02 > 00:00:00:00:00:24, ethertype IPv4 (0x0800), length 170: 10.0.0.2.38027 > 10.0.0.24.45602: UDP, length 128
OFPT_PACKET_OUT (xid=0x0): in_port=1 actions_len=8 actions=FLOOD data_len=1514
00:00:00:00:00:39 > 00:00:00:00:00:14, ethertype IPv4 (0x0800), length 1514: 10.0.0.39.54965 > 10.0.0.14.40026: Flags [.], seq 3555258784:3555260232, ack 2979759350, win 229, options [nop,nop,TS val 6159135 ecr 6158879], length 1448

OFPT_PACKET_OUT (xid=0x0): in_port=1 actions_len=8 actions=FLOOD data_len=1514
00:00:00:00:00:39 > 00:00:00:00:00:14, ethertype IPv4 (0x0800), length 1514: 10.0.0.39.54965 > 10.0.0.14.40026: Flags [.], seq 3555260232:3555261680, ack 2979759350, win 229, options [nop,nop,TS val 6159135 ecr 6158879], length 1448

OFPT_PACKET_OUT (xid=0x0): in_port=1 actions_len=8 actions=FLOOD data_len=1514
00:00:00:00:00:39 > 00:00:00:00:00:14, ethertype IPv4 (0x0800), length 1514: 10.0.0.39.54965 > 10.0.0.14.40026: Flags [.], seq 3555261680:3555263128, ack 2979759350, win 229, options [nop,nop,TS val 6159135 ecr 6158879], length 1448

OFPT_PACKET_OUT (xid=0x0): in_port=1 actions_len=8 actions=FLOOD data_len=1514
00:00:00:00:00:39 > 00:00:00:00:00:14, ethertype IPv4 (0x0800), length 1514: 10.0.0.39.54965 > 10.0.0.14.40026: Flags [.], seq 3555263128:3555264576, ack 2979759350, win 229, options [nop,nop,TS val 6159135 ecr 6158879], length 1448

OFPT_PACKET_OUT (xid=0x0): in_port=1 actions_len=8 actions=FLOOD data_len=1514
00:00:00:00:00:39 > 00:00:00:00:00:14, ethertype IPv4 (0x0800), length 1514: 10.0.0.39.54965 > 10.0.0.14.40026: Flags [.], seq 3555264576:3555266024, ack 2979759350, win 229, options [nop,nop,TS val 6159135 ecr 6158879], length 1448

OFPT_PACKET_OUT (xid=0x0): in_port=1 actions_len=8 actions=FLOOD data_len=1514
00:00:00:00:00:39 > 00:00:00:00:00:14, ethertype IPv4 (0x0800), length 1514: 10.0.0.39.54965 > 10.0.0.14.40026: Flags [.], seq 3555266024:3555267472, ack 2979759350, win 229, options [nop,nop,TS val 6159135 ecr 6158879], length 1448

OFPT_PACKET_OUT (xid=0x0): in_port=1 actions_len=8 actions=FLOOD data_len=1514
00:00:00:00:00:39 > 00:00:00:00:00:14, ethertype IPv4 (0x0800), length 1514: 10.0.0.39.54965 > 10.0.0.14.40026: Flags [.], seq 3555267472:3555268920, ack 2979759350, win 229, options [nop,nop,TS val 6159135 ecr 6158879], length 1448

OFPT_PACKET_OUT (xid=0x0): in_port=1 actions_len=8 actions=FLOOD data_len=1514
00:00:00:00:00:39 > 00:00:00:00:00:14, ethertype IPv4 (0x0800), length 1514: 10.0.0.39.54965 > 10.0.0.14.40026: Flags [.], seq 3555268920:3555270368, ack 2979759350, win 229, options [nop,nop,TS val 6159135 ecr 6158879], length 1448

OFPT_PACKET_OUT (xid=0x0): in_port=1 actions_len=8 actions=FLOOD data_len=1514
00:00:00:00:00:39 > 00:00:00:00:00:14, ethertype IPv4 (0x0800), length 1514: 10.0.0.39.54965 > 10.0.0.14.40026: Flags [.], seq 3555270368:3555271816, ack 2979759350, win 229, options [nop,nop,TS val 6159135 ecr 6158879], length 1448

OFPT_PACKET_OUT (xid=0x0): in_port=1 actions_len=8 actions=FLOOD data_len=66
00:00:00:00:00:31 > 00:00:00:00:00:32, ethertype IPv4 (0x0800), length 66: 10.0.0.31.46349 > 10.0.0.32.53889: Flags [.], ack 3924104206, win 951, options [nop,nop,TS val 6159149 ecr 6159076], length 0

OFPT_PACKET_OUT (xid=0x0): in_port=1 actions_len=8 actions=FLOOD data_len=1514
00:00:00:00:00:32 > 00:00:00:00:00:31, ethertype IPv4 (0x0800), length 1514: 10.0.0.32.53889 > 10.0.0.31.46349: Flags [.], seq 3924138958:3924140406, ack 2904704569, win 229, options [nop,nop,TS val 6159149 ecr 6159076], length 1448

OFPT_PACKET_OUT (xid=0x0): in_port=1 actions_len=8 actions=FLOOD data_len=1514
00:00:00:00:00:39 > 00:00:00:00:00:14, ethertype IPv4 (0x0800), length 1514: 10.0.0.39.54965 > 10.0.0.14.40026: Flags [.], seq 3555271816:3555273264, ack 2979759350, win 229, options [nop,nop,TS val 6159149 ecr 6158892], length 1448

OFPT_PACKET_OUT (xid=0x0): in_port=1 actions_len=8 actions=FLOOD data_len=66
00:00:00:00:00:31 > 00:00:00:00:00:32, ethertype IPv4 (0x0800), length 66: 10.0.0.31.46349 > 10.0.0.32.53889: Flags [.], ack 3924107102, win 951, options [nop,nop,TS val 6159149 ecr 6159076], length 0

OFPT_PACKET_OUT (xid=0x0): in_port=1 actions_len=8 actions=FLOOD data_len=1514
00:00:00:00:00:32 > 00:00:00:00:00:31, ethertype IPv4 (0x0800), length 1514: 10.0.0.32.53889 > 10.0.0.31.46349: Flags [.], seq 3924140406:3924141854, ack 2904704569, win 229, options [nop,nop,TS val 6159149 ecr 6159076], length 1448

OFPT_PACKET_OUT (xid=0x0): in_port=1 actions_len=8 actions=FLOOD data_len=1514
00:00:00:00:00:39 > 00:00:00:00:00:14, ethertype IPv4 (0x0800), length 1514: 10.0.0.39.54965 > 10.0.0.14.40026: Flags [.], seq 3555273264:3555274712, ack 2979759350, win 229, options [nop,nop,TS val 6159149 ecr 6158892], length 1448

OFPT_PACKET_OUT (xid=0x0): in_port=3 actions_len=8 actions=FLOOD data_len=1514
00:00:00:00:00:03 > 00:00:00:00:00:24, ethertype IPv4 (0x0800), length 1514: 10.0.0.3.43283 > 10.0.0.24.52886: Flags [.], seq 76250403:76251851, ack 2199864709, win 229, options [nop,nop,TS val 6159349 ecr 6159039], length 1448

OFPT_PACKET_OUT (xid=0x0): in_port=3 actions_len=8 actions=FLOOD data_len=1514
00:00:00:00:00:03 > 00:00:00:00:00:24, ethertype IPv4 (0x0800), length 1514: 10.0.0.3.43283 > 10.0.0.24.52886: Flags [.], seq 76251851:76253299, ack 2199864709, win 229, options [nop,nop,TS val 6159349 ecr 6159039], length 1448

OFPT_PACKET_OUT (xid=0x0): in_port=2 actions_len=8 actions=FLOOD data_len=66
00:00:00:00:00:11 > 00:00:00:00:00:02, ethertype IPv4 (0x0800), length 66: 10.0.0.11.57053 > 10.0.0.2.12865: Flags [.], ack 1222113770, win 245, options [nop,nop,TS val 6159360 ecr 6159276], length 0

OFPT_PACKET_OUT (xid=0x0): in_port=3 actions_len=8 actions=FLOOD data_len=1514
00:00:00:00:00:03 > 00:00:00:00:00:24, ethertype IPv4 (0x0800), length 1514: 10.0.0.3.43283 > 10.0.0.24.52886: Flags [.], seq 76253299:76254747, ack 2199864709, win 229, options [nop,nop,TS val 6159349 ecr 6159039], length 1448

OFPT_PACKET_OUT (xid=0x0): in_port=2 actions_len=8 actions=FLOOD data_len=66
00:00:00:00:00:13 > 00:00:00:00:00:02, ethertype IPv4 (0x0800), length 66: 10.0.0.13.60819 > 10.0.0.2.12865: Flags [.], ack 728378614, win 245, options [nop,nop,TS val 6159360 ecr 6159277], length 0

OFPT_PACKET_OUT (xid=0x0): in_port=3 actions_len=8 actions=FLOOD data_len=1514
00:00:00:00:00:03 > 00:00:00:00:00:24, ethertype IPv4 (0x0800), length 1514: 10.0.0.3.43283 > 10.0.0.24.52886: Flags [.], seq 76254747:76256195, ack 2199864709, win 229, options [nop,nop,TS val 6159349 ecr 6159039], length 1448

OFPT_PACKET_OUT (xid=0x0): in_port=2 actions_len=8 actions=FLOOD data_len=322
00:00:00:00:00:13 > 00:00:00:00:00:10, ethertype IPv4 (0x0800), length 322: 10.0.0.13.12865 > 10.0.0.10.53838: Flags [P.], seq 3335371404:3335371660, ack 3442802615, win 243, options [nop,nop,TS val 6159364 ecr 6159290], length 256

OFPT_PACKET_OUT (xid=0x0): in_port=3 actions_len=8 actions=FLOOD data_len=1514
00:00:00:00:00:03 > 00:00:00:00:00:24, ethertype IPv4 (0x0800), length 1514: 10.0.0.3.43283 > 10.0.0.24.52886: Flags [.], seq 76256195:76257643, ack 2199864709, win 229, options [nop,nop,TS val 6159349 ecr 6159039], length 1448

OFPT_PACKET_OUT (xid=0x0): in_port=2 actions_len=8 actions=FLOOD data_len=66
00:00:00:00:00:14 > 00:00:00:00:00:39, ethertype IPv4 (0x0800), length 66: 10.0.0.14.40026 > 10.0.0.39.54965: Flags [.], ack 3555202312, win 5453, options [nop,nop,TS val 6159364 ecr 6159076], length 0

OFPT_PACKET_OUT (xid=0x0): in_port=3 actions_len=8 actions=FLOOD data_len=1514
00:00:00:00:00:03 > 00:00:00:00:00:24, ethertype IPv4 (0x0800), length 1514: 10.0.0.3.43283 > 10.0.0.24.52886: Flags [.], seq 76257643:76259091, ack 2199864709, win 229, options [nop,nop,TS val 6159349 ecr 6159039], length 1448

OFPT_PACKET_OUT (xid=0x0): in_port=2 actions_len=8 actions=FLOOD data_len=67
00:00:00:00:00:17 > 00:00:00:00:00:09, ethertype IPv4 (0x0800), length 67: 10.0.0.17.39812 > 10.0.0.9.52382: Flags [P.], seq 4154218021:4154218022, ack 3690316689, win 229, options [nop,nop,TS val 6159364 ecr 6159290], length 1

OFPT_PACKET_OUT (xid=0x0): in_port=3 actions_len=8 actions=FLOOD data_len=1514
00:00:00:00:00:03 > 00:00:00:00:00:24, ethertype IPv4 (0x0800), length 1514: 10.0.0.3.43283 > 10.0.0.24.52886: Flags [.], seq 76259091:76260539, ack 2199864709, win 229, options [nop,nop,TS val 6159349 ecr 6159039], length 1448

OFPT_PACKET_OUT (xid=0x0): in_port=2 actions_len=8 actions=FLOOD data_len=67
00:00:00:00:00:19 > 00:00:00:00:00:02, ethertype IPv4 (0x0800), length 67: 10.0.0.19.53826 > 10.0.0.2.56864: Flags [P.], seq 2695096342:2695096343, ack 2207092501, win 229, options [nop,nop,TS val 6159364 ecr 6159290], length 1

OFPT_PACKET_OUT (xid=0x0): in_port=3 actions_len=8 actions=FLOOD data_len=1514
00:00:00:00:00:03 > 00:00:00:00:00:24, ethertype IPv4 (0x0800), length 1514: 10.0.0.3.43283 > 10.0.0.24.52886: Flags [.], seq 76260539:76261987, ack 2199864709, win 229, options [nop,nop,TS val 6159349 ecr 6159039], length 1448

OFPT_PACKET_OUT (xid=0x0): in_port=2 actions_len=8 actions=FLOOD data_len=66
00:00:00:00:00:13 > 00:00:00:00:00:29, ethertype IPv4 (0x0800), length 66: 10.0.0.13.40294 > 10.0.0.29.38201: Flags [.], ack 144559014, win 272, options [nop,nop,TS val 6159364 ecr 6159066], length 0

OFPT_PACKET_OUT (xid=0x0): in_port=3 actions_len=8 actions=FLOOD data_len=1514
00:00:00:00:00:03 > 00:00:00:00:00:24, ethertype IPv4 (0x0800), length 1514: 10.0.0.3.43283 > 10.0.0.24.52886: Flags [.], seq 76261987:76263435, ack 2199864709, win 229, options [nop,nop,TS val 6159349 ecr 6159039], length 1448

OFPT_PACKET_OUT (xid=0x0): in_port=2 actions_len=8 actions=FLOOD data_len=66
00:00:00:00:00:14 > 00:00:00:00:00:39, ethertype IPv4 (0x0800), length 66: 10.0.0.14.40026 > 10.0.0.39.54965: Flags [.], ack 3555205208, win 5453, options [nop,nop,TS val 6159364 ecr 6159076], length 0

OFPT_PACKET_OUT (xid=0x0): in_port=3 actions_len=8 actions=FLOOD data_len=322
00:00:00:00:00:02 > 00:00:00:00:00:31, ethertype IPv4 (0x0800), length 322: 10.0.0.2.12865 > 10.0.0.31.36129: Flags [P.], seq 3986610277:3986610533, ack 3313452088, win 243, options [nop,nop,TS val 6159362 ecr 6159064], length 256

OFPT_PACKET_OUT (xid=0x0): in_port=2 actions_len=8 actions=FLOOD data_len=66
00:00:00:00:00:13 > 00:00:00:00:00:29, ethertype IPv4 (0x0800), length 66: 10.0.0.13.40294 > 10.0.0.29.38201: Flags [.], ack 144560462, win 295, options [nop,nop,TS val 6159364 ecr 6159066], length 0

OFPT_PACKET_OUT (xid=0x0): in_port=3 actions_len=8 actions=FLOOD data_len=1514
00:00:00:00:00:03 > 00:00:00:00:00:24, ethertype IPv4 (0x0800), length 1514: 10.0.0.3.43283 > 10.0.0.24.52886: Flags [.], seq 76263435:76264883, ack 2199864709, win 229, options [nop,nop,TS val 6159362 ecr 6159053], length 1448

OFPT_PACKET_OUT (xid=0x0): in_port=2 actions_len=8 actions=FLOOD data_len=66
00:00:00:00:00:14 > 00:00:00:00:00:39, ethertype IPv4 (0x0800), length 66: 10.0.0.14.40026 > 10.0.0.39.54965: Flags [.], ack 3555208104, win 5453, options [nop,nop,TS val 6159364 ecr 6159076], length 0

OFPT_PACKET_OUT (xid=0x0): in_port=3 actions_len=8 actions=FLOOD data_len=1514
00:00:00:00:00:03 > 00:00:00:00:00:24, ethertype IPv4 (0x0800), length 1514: 10.0.0.3.43283 > 10.0.0.24.52886: Flags [.], seq 76264883:76266331, ack 2199864709, win 229, options [nop,nop,TS val 6159362 ecr 6159053], length 1448

OFPT_PACKET_OUT (xid=0x0): in_port=2 actions_len=8 actions=FLOOD data_len=66
00:00:00:00:00:14 > 00:00:00:00:00:39, ethertype IPv4 (0x0800), length 66: 10.0.0.14.40026 > 10.0.0.39.54965: Flags [.], ack 3555211000, win 5453, options [nop,nop,TS val 6159364 ecr 6159076], length 0

OFPT_PACKET_OUT (xid=0x0): in_port=3 actions_len=8 actions=FLOOD data_len=1514
00:00:00:00:00:03 > 00:00:00:00:00:24, ethertype IPv4 (0x0800), length 1514: 10.0.0.3.43283 > 10.0.0.24.52886: Flags [.], seq 76266331:76267779, ack 2199864709, win 229, options [nop,nop,TS val 6159362 ecr 6159053], length 1448

OFPT_PACKET_OUT (xid=0x0): in_port=3 actions_len=8 actions=FLOOD data_len=1514
00:00:00:00:00:03 > 00:00:00:00:00:24, ethertype IPv4 (0x0800), length 1514: 10.0.0.3.43283 > 10.0.0.24.52886: Flags [.], seq 76267779:76269227, ack 2199864709, win 229, options [nop,nop,TS val 6159362 ecr 6159053], length 1448

OFPT_PACKET_OUT (xid=0x0): in_port=3 actions_len=8 actions=FLOOD data_len=1514
00:00:00:00:00:03 > 00:00:00:00:00:24, ethertype IPv4 (0x0800), length 1514: 10.0.0.3.43283 > 10.0.0.24.52886: Flags [.], seq 76269227:76270675, ack 2199864709, win 229, options [nop,nop,TS val 6159362 ecr 6159053], length 1448

OFPT_PACKET_OUT (xid=0x0): in_port=3 actions_len=8 actions=FLOOD data_len=1514
00:00:00:00:00:03 > 00:00:00:00:00:24, ethertype IPv4 (0x0800), length 1514: 10.0.0.3.43283 > 10.0.0.24.52886: Flags [.], seq 76270675:76272123, ack 2199864709, win 229, options [nop,nop,TS val 6159362 ecr 6159053], length 1448

OFPT_PACKET_OUT (xid=0x0): in_port=3 actions_len=8 actions=FLOOD data_len=1130
00:00:00:00:00:03 > 00:00:00:00:00:24, ethertype IPv4 (0x0800), length 1130: 10.0.0.3.43283 > 10.0.0.24.52886: Flags [FP.], seq 76272123:76273187, ack 2199864709, win 229, options [nop,nop,TS val 6159362 ecr 6159053], length 1064

OFPT_PACKET_OUT (xid=0x0): in_port=2 actions_len=8 actions=FLOOD data_len=170
00:00:00:00:00:13 > 00:00:00:00:00:02, ethertype IPv4 (0x0800), length 170: 10.0.0.13.33417 > 10.0.0.2.55596: UDP, length 128

OFPT_PACKET_OUT (xid=0x0): in_port=2 actions_len=8 actions=FLOOD data_len=170
00:00:00:00:00:11 > 00:00:00:00:00:02, ethertype IPv4 (0x0800), length 170: 10.0.0.11.33297 > 10.0.0.2.53183: UDP, length 128

OFPT_PACKET_OUT (xid=0x0): in_port=1 actions_len=8 actions=FLOOD data_len=66
00:00:00:00:00:25 > 00:00:00:00:00:04, ethertype IPv4 (0x0800), length 66: 10.0.0.25.44884 > 10.0.0.4.57141: Flags [.], ack 289054838, win 1494, options [nop,nop,TS val 6159138 ecr 6158833], length 0

