OFPT_PACKET_IN (xid=0x0): total_len=67 in_port=6 (via action) data_len=67 (unbuffered)
priority0:tunnel0:in_port0006:tci(0) mac00:00:00:00:00:25->00:00:00:00:00:15 type0800 proto6 tos0 ttl64 ip10.0.0.25->10.0.0.15 port43425->33079
00:00:00:00:00:25 > 00:00:00:00:00:15, ethertype IPv4 (0x0800), length 67: 10.0.0.25.43425 > 10.0.0.15.33079: Flags [P.], seq 3388111526:3388111527, ack 2741281384, win 227, options [nop,nop,TS val 6159440 ecr 6159097], length 1
OFPT_PACKET_IN (xid=0x0): total_len=66 in_port=11 (via action) data_len=66 (unbuffered)
priority0:tunnel0:in_port000b:tci(0) mac00:00:00:00:00:30->00:00:00:00:00:28 type0800 proto6 tos0 ttl64 ip10.0.0.30->10.0.0.28 port43694->55548
00:00:00:00:00:30 > 00:00:00:00:00:28, ethertype IPv4 (0x0800), length 66: 10.0.0.30.43694 > 10.0.0.28.55548: Flags [.], ack 422936174, win 1403, options [nop,nop,TS val 6159440 ecr 6159308], length 0
OFPT_PACKET_IN (xid=0x0): total_len=66 in_port=11 (via action) data_len=66 (unbuffered)
priority0:tunnel0:in_port000b:tci(0) mac00:00:00:00:00:30->00:00:00:00:00:28 type0800 proto6 tos0 ttl64 ip10.0.0.30->10.0.0.28 port43694->55548
00:00:00:00:00:30 > 00:00:00:00:00:28, ethertype IPv4 (0x0800), length 66: 10.0.0.30.43694 > 10.0.0.28.55548: Flags [.], ack 422939070, win 1403, options [nop,nop,TS val 6159440 ecr 6159308], length 0
OFPT_PACKET_IN (xid=0x0): total_len=66 in_port=11 (via action) data_len=66 (unbuffered)
priority0:tunnel0:in_port000b:tci(0) mac00:00:00:00:00:30->00:00:00:00:00:28 type0800 proto6 tos0 ttl64 ip10.0.0.30->10.0.0.28 port43694->55548
00:00:00:00:00:30 > 00:00:00:00:00:28, ethertype IPv4 (0x0800), length 66: 10.0.0.30.43694 > 10.0.0.28.55548: Flags [.], ack 422941966, win 1403, options [nop,nop,TS val 6159440 ecr 6159308], length 0
OFPT_PACKET_IN (xid=0x0): total_len=66 in_port=11 (via action) data_len=66 (unbuffered)
priority0:tunnel0:in_port000b:tci(0) mac00:00:00:00:00:30->00:00:00:00:00:28 type0800 proto6 tos0 ttl64 ip10.0.0.30->10.0.0.28 port43694->55548
00:00:00:00:00:30 > 00:00:00:00:00:28, ethertype IPv4 (0x0800), length 66: 10.0.0.30.43694 > 10.0.0.28.55548: Flags [.], ack 422944862, win 1403, options [nop,nop,TS val 6159440 ecr 6159308], length 0
OFPT_PACKET_IN (xid=0x0): total_len=66 in_port=11 (via action) data_len=66 (unbuffered)
priority0:tunnel0:in_port000b:tci(0) mac00:00:00:00:00:30->00:00:00:00:00:28 type0800 proto6 tos0 ttl64 ip10.0.0.30->10.0.0.28 port43694->55548
00:00:00:00:00:30 > 00:00:00:00:00:28, ethertype IPv4 (0x0800), length 66: 10.0.0.30.43694 > 10.0.0.28.55548: Flags [F.], seq 2966268722, ack 422944862, win 1403, options [nop,nop,TS val 6159440 ecr 6159308], length 0
OFPT_PACKET_IN (xid=0x0): total_len=322 in_port=11 (via action) data_len=322 (unbuffered)
priority0:tunnel0:in_port000b:tci(0) mac00:00:00:00:00:30->00:00:00:00:00:28 type0800 proto6 tos0 ttl64 ip10.0.0.30->10.0.0.28 port12865->55352
00:00:00:00:00:30 > 00:00:00:00:00:28, ethertype IPv4 (0x0800), length 322: 10.0.0.30.12865 > 10.0.0.28.55352: Flags [P.], seq 4061931593:4061931849, ack 1542816994, win 243, options [nop,nop,TS val 6159440 ecr 6158260], length 256
OFPT_PACKET_IN (xid=0x0): total_len=1514 in_port=1 (via action) data_len=1514 (unbuffered)
priority0:tunnel0:in_port0001:tci(0) mac00:00:00:00:00:32->00:00:00:00:00:31 type0800 proto6 tos0 ttl64 ip10.0.0.32->10.0.0.31 port53889->46349
00:00:00:00:00:32 > 00:00:00:00:00:31, ethertype IPv4 (0x0800), length 1514: 10.0.0.32.53889 > 10.0.0.31.46349: Flags [.], seq 3924167918:3924169366, ack 2904704569, win 229, options [nop,nop,TS val 6159219 ecr 6159165], length 1448
OFPT_PACKET_IN (xid=0x0): total_len=1514 in_port=1 (via action) data_len=1514 (unbuffered)
priority0:tunnel0:in_port0001:tci(0) mac00:00:00:00:00:32->00:00:00:00:00:31 type0800 proto6 tos0 ttl64 ip10.0.0.32->10.0.0.31 port53889->46349
00:00:00:00:00:32 > 00:00:00:00:00:31, ethertype IPv4 (0x0800), length 1514: 10.0.0.32.53889 > 10.0.0.31.46349: Flags [.], seq 3924169366:3924170814, ack 2904704569, win 229, options [nop,nop,TS val 6159219 ecr 6159165], length 1448
OFPT_PACKET_IN (xid=0x0): total_len=1514 in_port=1 (via action) data_len=1514 (unbuffered)
priority0:tunnel0:in_port0001:tci(0) mac00:00:00:00:00:32->00:00:00:00:00:31 type0800 proto6 tos0 ttl64 ip10.0.0.32->10.0.0.31 port53889->46349
00:00:00:00:00:32 > 00:00:00:00:00:31, ethertype IPv4 (0x0800), length 1514: 10.0.0.32.53889 > 10.0.0.31.46349: Flags [.], seq 3924170814:3924172262, ack 2904704569, win 229, options [nop,nop,TS val 6159219 ecr 6159165], length 1448
OFPT_PACKET_IN (xid=0x0): total_len=1514 in_port=1 (via action) data_len=1514 (unbuffered)
priority0:tunnel0:in_port0001:tci(0) mac00:00:00:00:00:32->00:00:00:00:00:31 type0800 proto6 tos0 ttl64 ip10.0.0.32->10.0.0.31 port53889->46349
00:00:00:00:00:32 > 00:00:00:00:00:31, ethertype IPv4 (0x0800), length 1514: 10.0.0.32.53889 > 10.0.0.31.46349: Flags [.], seq 3924172262:3924173710, ack 2904704569, win 229, options [nop,nop,TS val 6159219 ecr 6159165], length 1448
OFPT_PACKET_IN (xid=0x0): total_len=1514 in_port=1 (via action) data_len=1514 (unbuffered)
priority0:tunnel0:in_port0001:tci(0) mac00:00:00:00:00:32->00:00:00:00:00:31 type0800 proto6 tos0 ttl64 ip10.0.0.32->10.0.0.31 port53889->46349
00:00:00:00:00:32 > 00:00:00:00:00:31, ethertype IPv4 (0x0800), length 1514: 10.0.0.32.53889 > 10.0.0.31.46349: Flags [.], seq 3924173710:3924175158, ack 2904704569, win 229, options [nop,nop,TS val 6159228 ecr 6159165], length 1448
OFPT_PACKET_IN (xid=0x0): total_len=1514 in_port=1 (via action) data_len=1514 (unbuffered)
priority0:tunnel0:in_port0001:tci(0) mac00:00:00:00:00:39->00:00:00:00:00:14 type0800 proto6 tos0 ttl64 ip10.0.0.39->10.0.0.14 port54965->40026
00:00:00:00:00:39 > 00:00:00:00:00:14, ethertype IPv4 (0x0800), length 1514: 10.0.0.39.54965 > 10.0.0.14.40026: Flags [.], seq 3555347112:3555348560, ack 2979759350, win 229, options [nop,nop,TS val 6159228 ecr 6158970], length 1448
OFPT_PACKET_IN (xid=0x0): total_len=1514 in_port=1 (via action) data_len=1514 (unbuffered)
priority0:tunnel0:in_port0001:tci(0) mac00:00:00:00:00:32->00:00:00:00:00:31 type0800 proto6 tos0 ttl64 ip10.0.0.32->10.0.0.31 port53889->46349
00:00:00:00:00:32 > 00:00:00:00:00:31, ethertype IPv4 (0x0800), length 1514: 10.0.0.32.53889 > 10.0.0.31.46349: Flags [.], seq 3924175158:3924176606, ack 2904704569, win 229, options [nop,nop,TS val 6159228 ecr 6159165], length 1448
OFPT_PACKET_IN (xid=0x0): total_len=1514 in_port=1 (via action) data_len=1514 (unbuffered)
priority0:tunnel0:in_port0001:tci(0) mac00:00:00:00:00:39->00:00:00:00:00:14 type0800 proto6 tos0 ttl64 ip10.0.0.39->10.0.0.14 port54965->40026
00:00:00:00:00:39 > 00:00:00:00:00:14, ethertype IPv4 (0x0800), length 1514: 10.0.0.39.54965 > 10.0.0.14.40026: Flags [.], seq 3555348560:3555350008, ack 2979759350, win 229, options [nop,nop,TS val 6159228 ecr 6158970], length 1448
OFPT_PACKET_IN (xid=0x0): total_len=66 in_port=1 (via action) data_len=66 (unbuffered)
priority0:tunnel0:in_port0001:tci(0) mac00:00:00:00:00:14->00:00:00:00:00:39 type0800 proto6 tos0 ttl64 ip10.0.0.14->10.0.0.39 port40026->54965
00:00:00:00:00:14 > 00:00:00:00:00:39, ethertype IPv4 (0x0800), length 66: 10.0.0.14.40026 > 10.0.0.39.54965: Flags [.], ack 3555053168, win 5453, options [nop,nop,TS val 6159192 ecr 6158904], length 0
OFPT_PACKET_IN (xid=0x0): total_len=1514 in_port=1 (via action) data_len=1514 (unbuffered)
priority0:tunnel0:in_port0001:tci(0) mac00:00:00:00:00:03->00:00:00:00:00:24 type0800 proto6 tos0 ttl64 ip10.0.0.3->10.0.0.24 port43283->52886
00:00:00:00:00:03 > 00:00:00:00:00:24, ethertype IPv4 (0x0800), length 1514: 10.0.0.3.43283 > 10.0.0.24.52886: Flags [.], seq 76054923:76056371, ack 2199864709, win 229, options [nop,nop,TS val 6159177 ecr 6158891], length 1448
OFPT_PACKET_IN (xid=0x0): total_len=66 in_port=1 (via action) data_len=66 (unbuffered)
priority0:tunnel0:in_port0001:tci(0) mac00:00:00:00:00:14->00:00:00:00:00:39 type0800 proto6 tos0 ttl64 ip10.0.0.14->10.0.0.39 port40026->54965
00:00:00:00:00:14 > 00:00:00:00:00:39, ethertype IPv4 (0x0800), length 66: 10.0.0.14.40026 > 10.0.0.39.54965: Flags [.], ack 3555054616, win 5453, options [nop,nop,TS val 6159202 ecr 6158917], length 0
OFPT_PACKET_IN (xid=0x0): total_len=1514 in_port=1 (via action) data_len=1514 (unbuffered)
priority0:tunnel0:in_port0001:tci(0) mac00:00:00:00:00:03->00:00:00:00:00:24 type0800 proto6 tos0 ttl64 ip10.0.0.3->10.0.0.24 port43283->52886
00:00:00:00:00:03 > 00:00:00:00:00:24, ethertype IPv4 (0x0800), length 1514: 10.0.0.3.43283 > 10.0.0.24.52886: Flags [.], seq 76056371:76057819, ack 2199864709, win 229, options [nop,nop,TS val 6159177 ecr 6158891], length 1448
OFPT_PACKET_IN (xid=0x0): total_len=1514 in_port=1 (via action) data_len=1514 (unbuffered)
priority0:tunnel0:in_port0001:tci(0) mac00:00:00:00:00:03->00:00:00:00:00:24 type0800 proto6 tos0 ttl64 ip10.0.0.3->10.0.0.24 port43283->52886
00:00:00:00:00:03 > 00:00:00:00:00:24, ethertype IPv4 (0x0800), length 1514: 10.0.0.3.43283 > 10.0.0.24.52886: Flags [.], seq 76057819:76059267, ack 2199864709, win 229, options [nop,nop,TS val 6159177 ecr 6158891], length 1448
OFPT_PACKET_IN (xid=0x0): total_len=1514 in_port=1 (via action) data_len=1514 (unbuffered)
priority0:tunnel0:in_port0001:tci(0) mac00:00:00:00:00:03->00:00:00:00:00:24 type0800 proto6 tos0 ttl64 ip10.0.0.3->10.0.0.24 port43283->52886
00:00:00:00:00:03 > 00:00:00:00:00:24, ethertype IPv4 (0x0800), length 1514: 10.0.0.3.43283 > 10.0.0.24.52886: Flags [.], seq 76059267:76060715, ack 2199864709, win 229, options [nop,nop,TS val 6159177 ecr 6158891], length 1448
OFPT_PACKET_IN (xid=0x0): total_len=1514 in_port=1 (via action) data_len=1514 (unbuffered)
priority0:tunnel0:in_port0001:tci(0) mac00:00:00:00:00:03->00:00:00:00:00:24 type0800 proto6 tos0 ttl64 ip10.0.0.3->10.0.0.24 port43283->52886
00:00:00:00:00:03 > 00:00:00:00:00:24, ethertype IPv4 (0x0800), length 1514: 10.0.0.3.43283 > 10.0.0.24.52886: Flags [.], seq 76060715:76062163, ack 2199864709, win 229, options [nop,nop,TS val 6159177 ecr 6158891], length 1448
OFPT_PACKET_IN (xid=0x0): total_len=1514 in_port=1 (via action) data_len=1514 (unbuffered)
priority0:tunnel0:in_port0001:tci(0) mac00:00:00:00:00:03->00:00:00:00:00:24 type0800 proto6 tos0 ttl64 ip10.0.0.3->10.0.0.24 port43283->52886
00:00:00:00:00:03 > 00:00:00:00:00:24, ethertype IPv4 (0x0800), length 1514: 10.0.0.3.43283 > 10.0.0.24.52886: Flags [P.], seq 76062163:76063611, ack 2199864709, win 229, options [nop,nop,TS val 6159177 ecr 6158891], length 1448
OFPT_PACKET_IN (xid=0x0): total_len=1514 in_port=1 (via action) data_len=1514 (unbuffered)
priority0:tunnel0:in_port0001:tci(0) mac00:00:00:00:00:03->00:00:00:00:00:24 type0800 proto6 tos0 ttl64 ip10.0.0.3->10.0.0.24 port43283->52886
00:00:00:00:00:03 > 00:00:00:00:00:24, ethertype IPv4 (0x0800), length 1514: 10.0.0.3.43283 > 10.0.0.24.52886: Flags [.], seq 76063611:76065059, ack 2199864709, win 229, options [nop,nop,TS val 6159177 ecr 6158891], length 1448
OFPT_PACKET_IN (xid=0x0): total_len=1514 in_port=1 (via action) data_len=1514 (unbuffered)
priority0:tunnel0:in_port0001:tci(0) mac00:00:00:00:00:03->00:00:00:00:00:24 type0800 proto6 tos0 ttl64 ip10.0.0.3->10.0.0.24 port43283->52886
00:00:00:00:00:03 > 00:00:00:00:00:24, ethertype IPv4 (0x0800), length 1514: 10.0.0.3.43283 > 10.0.0.24.52886: Flags [.], seq 76065059:76066507, ack 2199864709, win 229, options [nop,nop,TS val 6159177 ecr 6158891], length 1448
OFPT_PACKET_IN (xid=0x0): total_len=66 in_port=1 (via action) data_len=66 (unbuffered)
priority0:tunnel0:in_port0001:tci(0) mac00:00:00:00:00:02->00:00:00:00:00:29 type0800 proto6 tos0 ttl64 ip10.0.0.2->10.0.0.29 port55238->12865
00:00:00:00:00:02 > 00:00:00:00:00:29, ethertype IPv4 (0x0800), length 66: 10.0.0.2.55238 > 10.0.0.29.12865: Flags [.], ack 197202211, win 245, options [nop,nop,TS val 6159187 ecr 6158879], length 0
OFPT_PACKET_IN (xid=0x0): total_len=1514 in_port=1 (via action) data_len=1514 (unbuffered)
priority0:tunnel0:in_port0001:tci(0) mac00:00:00:00:00:03->00:00:00:00:00:24 type0800 proto6 tos0 ttl64 ip10.0.0.3->10.0.0.24 port43283->52886
00:00:00:00:00:03 > 00:00:00:00:00:24, ethertype IPv4 (0x0800), length 1514: 10.0.0.3.43283 > 10.0.0.24.52886: Flags [.], seq 76066507:76067955, ack 2199864709, win 229, options [nop,nop,TS val 6159191 ecr 6158901], length 1448
OFPT_PACKET_IN (xid=0x0): total_len=66 in_port=1 (via action) data_len=66 (unbuffered)
priority0:tunnel0:in_port0001:tci(0) mac00:00:00:00:00:09->00:00:00:00:00:02 type0800 proto6 tos0 ttl64 ip10.0.0.9->10.0.0.2 port38644->12865
00:00:00:00:00:09 > 00:00:00:00:00:02, ethertype IPv4 (0x0800), length 66: 10.0.0.9.38644 > 10.0.0.2.12865: Flags [.], ack 2350600472, win 237, options [nop,nop,TS val 6159191 ecr 6159177], length 0
OFPT_PACKET_IN (xid=0x0): total_len=1514 in_port=1 (via action) data_len=1514 (unbuffered)
priority0:tunnel0:in_port0001:tci(0) mac00:00:00:00:00:03->00:00:00:00:00:24 type0800 proto6 tos0 ttl64 ip10.0.0.3->10.0.0.24 port43283->52886
00:00:00:00:00:03 > 00:00:00:00:00:24, ethertype IPv4 (0x0800), length 1514: 10.0.0.3.43283 > 10.0.0.24.52886: Flags [.], seq 76067955:76069403, ack 2199864709, win 229, options [nop,nop,TS val 6159191 ecr 6158901], length 1448
OFPT_PACKET_IN (xid=0x0): total_len=322 in_port=1 (via action) data_len=322 (unbuffered)
priority0:tunnel0:in_port0001:tci(0) mac00:00:00:00:00:09->00:00:00:00:00:02 type0800 proto6 tos0 ttl64 ip10.0.0.9->10.0.0.2 port38644->12865
00:00:00:00:00:09 > 00:00:00:00:00:02, ethertype IPv4 (0x0800), length 322: 10.0.0.9.38644 > 10.0.0.2.12865: Flags [P.], seq 111773019:111773275, ack 2350600472, win 237, options [nop,nop,TS val 6159191 ecr 6159177], length 256
OFPT_PACKET_IN (xid=0x0): total_len=1514 in_port=1 (via action) data_len=1514 (unbuffered)
priority0:tunnel0:in_port0001:tci(0) mac00:00:00:00:00:03->00:00:00:00:00:24 type0800 proto6 tos0 ttl64 ip10.0.0.3->10.0.0.24 port43283->52886
00:00:00:00:00:03 > 00:00:00:00:00:24, ethertype IPv4 (0x0800), length 1514: 10.0.0.3.43283 > 10.0.0.24.52886: Flags [.], seq 76069403:76070851, ack 2199864709, win 229, options [nop,nop,TS val 6159191 ecr 6158906], length 1448
OFPT_PACKET_IN (xid=0x0): total_len=1514 in_port=1 (via action) data_len=1514 (unbuffered)
priority0:tunnel0:in_port0001:tci(0) mac00:00:00:00:00:03->00:00:00:00:00:24 type0800 proto6 tos0 ttl64 ip10.0.0.3->10.0.0.24 port43283->52886
00:00:00:00:00:03 > 00:00:00:00:00:24, ethertype IPv4 (0x0800), length 1514: 10.0.0.3.43283 > 10.0.0.24.52886: Flags [.], seq 76070851:76072299, ack 2199864709, win 229, options [nop,nop,TS val 6159191 ecr 6158906], length 1448
OFPT_PACKET_IN (xid=0x0): total_len=66 in_port=1 (via action) data_len=66 (unbuffered)
priority0:tunnel0:in_port0001:tci(0) mac00:00:00:00:00:11->00:00:00:00:00:02 type0800 proto6 tos0 ttl64 ip10.0.0.11->10.0.0.2 port57053->12865
00:00:00:00:00:11 > 00:00:00:00:00:02, ethertype IPv4 (0x0800), length 66: 10.0.0.11.57053 > 10.0.0.2.12865: Flags [.], ack 1222113514, win 237, options [nop,nop,TS val 6159208 ecr 6159137], length 0
OFPT_PACKET_IN (xid=0x0): total_len=1514 in_port=1 (via action) data_len=1514 (unbuffered)
priority0:tunnel0:in_port0001:tci(0) mac00:00:00:00:00:03->00:00:00:00:00:24 type0800 proto6 tos0 ttl64 ip10.0.0.3->10.0.0.24 port43283->52886
00:00:00:00:00:03 > 00:00:00:00:00:24, ethertype IPv4 (0x0800), length 1514: 10.0.0.3.43283 > 10.0.0.24.52886: Flags [.], seq 76072299:76073747, ack 2199864709, win 229, options [nop,nop,TS val 6159191 ecr 6158906], length 1448
OFPT_PACKET_IN (xid=0x0): total_len=66 in_port=1 (via action) data_len=66 (unbuffered)
priority0:tunnel0:in_port0001:tci(0) mac00:00:00:00:00:13->00:00:00:00:00:02 type0800 proto6 tos0 ttl64 ip10.0.0.13->10.0.0.2 port60819->12865
00:00:00:00:00:13 > 00:00:00:00:00:02, ethertype IPv4 (0x0800), length 66: 10.0.0.13.60819 > 10.0.0.2.12865: Flags [.], ack 728378358, win 237, options [nop,nop,TS val 6159209 ecr 6159137], length 0
OFPT_PACKET_IN (xid=0x0): total_len=1514 in_port=1 (via action) data_len=1514 (unbuffered)
priority0:tunnel0:in_port0001:tci(0) mac00:00:00:00:00:03->00:00:00:00:00:24 type0800 proto6 tos0 ttl64 ip10.0.0.3->10.0.0.24 port43283->52886
00:00:00:00:00:03 > 00:00:00:00:00:24, ethertype IPv4 (0x0800), length 1514: 10.0.0.3.43283 > 10.0.0.24.52886: Flags [.], seq 76073747:76075195, ack 2199864709, win 229, options [nop,nop,TS val 6159191 ecr 6158906], length 1448
OFPT_PACKET_IN (xid=0x0): total_len=66 in_port=1 (via action) data_len=66 (unbuffered)
priority0:tunnel0:in_port0001:tci(0) mac00:00:00:00:00:14->00:00:00:00:00:39 type0800 proto6 tos0 ttl64 ip10.0.0.14->10.0.0.39 port40026->54965
00:00:00:00:00:14 > 00:00:00:00:00:39, ethertype IPv4 (0x0800), length 66: 10.0.0.14.40026 > 10.0.0.39.54965: Flags [.], ack 3555057512, win 5453, options [nop,nop,TS val 6159209 ecr 6158918], length 0
OFPT_PACKET_IN (xid=0x0): total_len=66 in_port=1 (via action) data_len=66 (unbuffered)
priority0:tunnel0:in_port0001:tci(0) mac00:00:00:00:00:31->00:00:00:00:00:32 type0800 proto6 tos0 ttl64 ip10.0.0.31->10.0.0.32 port46349->53889
00:00:00:00:00:31 > 00:00:00:00:00:32, ethertype IPv4 (0x0800), length 66: 10.0.0.31.46349 > 10.0.0.32.53889: Flags [.], ack 3924153438, win 951, options [nop,nop,TS val 6159244 ecr 6159189], length 0
OFPT_PACKET_IN (xid=0x0): total_len=74 in_port=1 (via action) data_len=74 (unbuffered)
priority0:tunnel0:in_port0001:tci(0) mac00:00:00:00:00:02->00:00:00:00:00:29 type0800 proto6 tos0 ttl64 ip10.0.0.2->10.0.0.29 port56202->51549
00:00:00:00:00:02 > 00:00:00:00:00:29, ethertype IPv4 (0x0800), length 74: 10.0.0.2.56202 > 10.0.0.29.51549: Flags [S], seq 2355082161, win 29200, options [mss 1460,sackOK,TS val 6159177 ecr 0,nop,wscale 7], length 0
OFPT_PACKET_OUT (xid=0x0): in_port=1 actions_len=8 actions=FLOOD data_len=1514
00:00:00:00:00:39 > 00:00:00:00:00:14, ethertype IPv4 (0x0800), length 1514: 10.0.0.39.54965 > 10.0.0.14.40026: Flags [.], seq 3555276160:3555277608, ack 2979759350, win 229, options [nop,nop,TS val 6159149 ecr 6158892], length 1448

OFPT_PACKET_OUT (xid=0x0): in_port=1 actions_len=8 actions=FLOOD data_len=1514
00:00:00:00:00:32 > 00:00:00:00:00:31, ethertype IPv4 (0x0800), length 1514: 10.0.0.32.53889 > 10.0.0.31.46349: Flags [.], seq 3924144750:3924146198, ack 2904704569, win 229, options [nop,nop,TS val 6159149 ecr 6159076], length 1448

OFPT_PACKET_OUT (xid=0x0): in_port=1 actions_len=8 actions=FLOOD data_len=1514
00:00:00:00:00:39 > 00:00:00:00:00:14, ethertype IPv4 (0x0800), length 1514: 10.0.0.39.54965 > 10.0.0.14.40026: Flags [.], seq 3555277608:3555279056, ack 2979759350, win 229, options [nop,nop,TS val 6159149 ecr 6158892], length 1448

OFPT_PACKET_OUT (xid=0x0): in_port=1 actions_len=8 actions=FLOOD data_len=1514
00:00:00:00:00:32 > 00:00:00:00:00:31, ethertype IPv4 (0x0800), length 1514: 10.0.0.32.53889 > 10.0.0.31.46349: Flags [.], seq 3924146198:3924147646, ack 2904704569, win 229, options [nop,nop,TS val 6159149 ecr 6159076], length 1448

OFPT_PACKET_OUT (xid=0x0): in_port=1 actions_len=8 actions=FLOOD data_len=1514
00:00:00:00:00:39 > 00:00:00:00:00:14, ethertype IPv4 (0x0800), length 1514: 10.0.0.39.54965 > 10.0.0.14.40026: Flags [.], seq 3555279056:3555280504, ack 2979759350, win 229, options [nop,nop,TS val 6159149 ecr 6158892], length 1448

OFPT_PACKET_OUT (xid=0x0): in_port=1 actions_len=8 actions=FLOOD data_len=1514
00:00:00:00:00:32 > 00:00:00:00:00:31, ethertype IPv4 (0x0800), length 1514: 10.0.0.32.53889 > 10.0.0.31.46349: Flags [.], seq 3924147646:3924149094, ack 2904704569, win 229, options [nop,nop,TS val 6159149 ecr 6159076], length 1448

OFPT_PACKET_OUT (xid=0x0): in_port=1 actions_len=8 actions=FLOOD data_len=1514
00:00:00:00:00:39 > 00:00:00:00:00:14, ethertype IPv4 (0x0800), length 1514: 10.0.0.39.54965 > 10.0.0.14.40026: Flags [.], seq 3555280504:3555281952, ack 2979759350, win 229, options [nop,nop,TS val 6159149 ecr 6158892], length 1448

OFPT_PACKET_OUT (xid=0x0): in_port=1 actions_len=8 actions=FLOOD data_len=1514
00:00:00:00:00:32 > 00:00:00:00:00:31, ethertype IPv4 (0x0800), length 1514: 10.0.0.32.53889 > 10.0.0.31.46349: Flags [.], seq 3924149094:3924150542, ack 2904704569, win 229, options [nop,nop,TS val 6159149 ecr 6159076], length 1448

OFPT_PACKET_OUT (xid=0x0): in_port=1 actions_len=8 actions=FLOOD data_len=1514
00:00:00:00:00:39 > 00:00:00:00:00:14, ethertype IPv4 (0x0800), length 1514: 10.0.0.39.54965 > 10.0.0.14.40026: Flags [.], seq 3555281952:3555283400, ack 2979759350, win 229, options [nop,nop,TS val 6159149 ecr 6158892], length 1448

OFPT_PACKET_OUT (xid=0x0): in_port=1 actions_len=8 actions=FLOOD data_len=1514
00:00:00:00:00:39 > 00:00:00:00:00:14, ethertype IPv4 (0x0800), length 1514: 10.0.0.39.54965 > 10.0.0.14.40026: Flags [.], seq 3555283400:3555284848, ack 2979759350, win 229, options [nop,nop,TS val 6159149 ecr 6158892], length 1448

OFPT_PACKET_OUT (xid=0x0): in_port=1 actions_len=8 actions=FLOOD data_len=1514
00:00:00:00:00:39 > 00:00:00:00:00:14, ethertype IPv4 (0x0800), length 1514: 10.0.0.39.54965 > 10.0.0.14.40026: Flags [.], seq 3555284848:3555286296, ack 2979759350, win 229, options [nop,nop,TS val 6159149 ecr 6158892], length 1448

OFPT_PACKET_OUT (xid=0x0): in_port=1 actions_len=8 actions=FLOOD data_len=66
00:00:00:00:00:31 > 00:00:00:00:00:32, ethertype IPv4 (0x0800), length 66: 10.0.0.31.46349 > 10.0.0.32.53889: Flags [.], ack 3924115790, win 951, options [nop,nop,TS val 6159165 ecr 6159090], length 0

OFPT_PACKET_OUT (xid=0x0): in_port=1 actions_len=8 actions=FLOOD data_len=1514
00:00:00:00:00:39 > 00:00:00:00:00:14, ethertype IPv4 (0x0800), length 1514: 10.0.0.39.54965 > 10.0.0.14.40026: Flags [.], seq 3555286296:3555287744, ack 2979759350, win 229, options [nop,nop,TS val 6159165 ecr 6158892], length 1448

OFPT_PACKET_OUT (xid=0x0): in_port=1 actions_len=8 actions=FLOOD data_len=66
00:00:00:00:00:31 > 00:00:00:00:00:32, ethertype IPv4 (0x0800), length 66: 10.0.0.31.46349 > 10.0.0.32.53889: Flags [.], ack 3924118686, win 951, options [nop,nop,TS val 6159165 ecr 6159090], length 0

OFPT_PACKET_OUT (xid=0x0): in_port=1 actions_len=8 actions=FLOOD data_len=1514
00:00:00:00:00:39 > 00:00:00:00:00:14, ethertype IPv4 (0x0800), length 1514: 10.0.0.39.54965 > 10.0.0.14.40026: Flags [.], seq 3555287744:3555289192, ack 2979759350, win 229, options [nop,nop,TS val 6159165 ecr 6158892], length 1448

OFPT_PACKET_OUT (xid=0x0): in_port=1 actions_len=8 actions=FLOOD data_len=66
00:00:00:00:00:14 > 00:00:00:00:00:39, ethertype IPv4 (0x0800), length 66: 10.0.0.14.40026 > 10.0.0.39.54965: Flags [.], ack 3554983664, win 5385, options [nop,nop,TS val 6159124 ecr 6158829], length 0

OFPT_PACKET_OUT (xid=0x0): in_port=1 actions_len=8 actions=FLOOD data_len=1514
00:00:00:00:00:03 > 00:00:00:00:00:24, ethertype IPv4 (0x0800), length 1514: 10.0.0.3.43283 > 10.0.0.24.52886: Flags [.], seq 75994107:75995555, ack 2199864709, win 229, options [nop,nop,TS val 6159092 ecr 6158787], length 1448

OFPT_PACKET_OUT (xid=0x0): in_port=5 actions_len=8 actions=FLOOD data_len=66
00:00:00:00:00:24 > 00:00:00:00:00:03, ethertype IPv4 (0x0800), length 66: 10.0.0.24.52886 > 10.0.0.3.43283: Flags [.], ack 75947771, win 6200, options [nop,nop,TS val 6159322 ecr 6159037], length 0

OFPT_PACKET_OUT (xid=0x0): in_port=9 actions_len=8 actions=FLOOD data_len=1514
00:00:00:00:00:28 > 00:00:00:00:00:30, ethertype IPv4 (0x0800), length 1514: 10.0.0.28.55548 > 10.0.0.30.43694: Flags [.], seq 422944862:422946310, ack 2966268722, win 229, options [nop,nop,TS val 6159322 ecr 6159248], length 1448

OFPT_PACKET_OUT (xid=0x0): in_port=5 actions_len=8 actions=FLOOD data_len=66
00:00:00:00:00:24 > 00:00:00:00:00:03, ethertype IPv4 (0x0800), length 66: 10.0.0.24.52886 > 10.0.0.3.43283: Flags [.], ack 75950667, win 6200, options [nop,nop,TS val 6159322 ecr 6159037], length 0

OFPT_PACKET_OUT (xid=0x0): in_port=9 actions_len=8 actions=FLOOD data_len=1514
00:00:00:00:00:28 > 00:00:00:00:00:30, ethertype IPv4 (0x0800), length 1514: 10.0.0.28.55548 > 10.0.0.30.43694: Flags [.], seq 422946310:422947758, ack 2966268722, win 229, options [nop,nop,TS val 6159322 ecr 6159248], length 1448

OFPT_PACKET_OUT (xid=0x0): in_port=9 actions_len=8 actions=FLOOD data_len=1514
00:00:00:00:00:28 > 00:00:00:00:00:30, ethertype IPv4 (0x0800), length 1514: 10.0.0.28.55548 > 10.0.0.30.43694: Flags [.], seq 422947758:422949206, ack 2966268722, win 229, options [nop,nop,TS val 6159322 ecr 6159248], length 1448

OFPT_PACKET_OUT (xid=0x0): in_port=9 actions_len=8 actions=FLOOD data_len=1514
00:00:00:00:00:28 > 00:00:00:00:00:30, ethertype IPv4 (0x0800), length 1514: 10.0.0.28.55548 > 10.0.0.30.43694: Flags [.], seq 422949206:422950654, ack 2966268722, win 229, options [nop,nop,TS val 6159322 ecr 6159248], length 1448

OFPT_PACKET_OUT (xid=0x0): in_port=9 actions_len=8 actions=FLOOD data_len=1170
00:00:00:00:00:28 > 00:00:00:00:00:30, ethertype IPv4 (0x0800), length 1170: 10.0.0.28.55548 > 10.0.0.30.43694: Flags [FP.], seq 422950654:422951758, ack 2966268722, win 229, options [nop,nop,TS val 6159322 ecr 6159248], length 1104

OFPT_PACKET_OUT (xid=0x0): in_port=5 actions_len=8 actions=FLOOD data_len=66
00:00:00:00:00:24 > 00:00:00:00:00:03, ethertype IPv4 (0x0800), length 66: 10.0.0.24.52886 > 10.0.0.3.43283: Flags [.], ack 75952115, win 6200, options [nop,nop,TS val 6159332 ecr 6159037], length 0

OFPT_PACKET_OUT (xid=0x0): in_port=1 actions_len=8 actions=FLOOD data_len=66
00:00:00:00:00:14 > 00:00:00:00:00:39, ethertype IPv4 (0x0800), length 66: 10.0.0.14.40026 > 10.0.0.39.54965: Flags [.], ack 3554985112, win 5408, options [nop,nop,TS val 6159124 ecr 6158829], length 0

OFPT_PACKET_OUT (xid=0x0): in_port=1 actions_len=8 actions=FLOOD data_len=1514
00:00:00:00:00:03 > 00:00:00:00:00:24, ethertype IPv4 (0x0800), length 1514: 10.0.0.3.43283 > 10.0.0.24.52886: Flags [.], seq 75995555:75997003, ack 2199864709, win 229, options [nop,nop,TS val 6159092 ecr 6158787], length 1448

OFPT_PACKET_OUT (xid=0x0): in_port=1 actions_len=8 actions=FLOOD data_len=66
00:00:00:00:00:14 > 00:00:00:00:00:39, ethertype IPv4 (0x0800), length 66: 10.0.0.14.40026 > 10.0.0.39.54965: Flags [.], ack 3554986560, win 5430, options [nop,nop,TS val 6159124 ecr 6158829], length 0

OFPT_PACKET_OUT (xid=0x0): in_port=1 actions_len=8 actions=FLOOD data_len=1514
00:00:00:00:00:03 > 00:00:00:00:00:24, ethertype IPv4 (0x0800), length 1514: 10.0.0.3.43283 > 10.0.0.24.52886: Flags [.], seq 75997003:75998451, ack 2199864709, win 229, options [nop,nop,TS val 6159092 ecr 6158788], length 1448

OFPT_PACKET_OUT (xid=0x0): in_port=1 actions_len=8 actions=FLOOD data_len=66
00:00:00:00:00:14 > 00:00:00:00:00:39, ethertype IPv4 (0x0800), length 66: 10.0.0.14.40026 > 10.0.0.39.54965: Flags [.], ack 3554988008, win 5453, options [nop,nop,TS val 6159125 ecr 6158829], length 0

OFPT_PACKET_OUT (xid=0x0): in_port=1 actions_len=8 actions=FLOOD data_len=1514
00:00:00:00:00:03 > 00:00:00:00:00:24, ethertype IPv4 (0x0800), length 1514: 10.0.0.3.43283 > 10.0.0.24.52886: Flags [.], seq 75998451:75999899, ack 2199864709, win 229, options [nop,nop,TS val 6159092 ecr 6158788], length 1448

OFPT_PACKET_OUT (xid=0x0): in_port=1 actions_len=8 actions=FLOOD data_len=66
00:00:00:00:00:14 > 00:00:00:00:00:39, ethertype IPv4 (0x0800), length 66: 10.0.0.14.40026 > 10.0.0.39.54965: Flags [.], ack 3554990904, win 5453, options [nop,nop,TS val 6159125 ecr 6158856], length 0

OFPT_PACKET_OUT (xid=0x0): in_port=1 actions_len=8 actions=FLOOD data_len=1514
00:00:00:00:00:03 > 00:00:00:00:00:24, ethertype IPv4 (0x0800), length 1514: 10.0.0.3.43283 > 10.0.0.24.52886: Flags [.], seq 75999899:76001347, ack 2199864709, win 229, options [nop,nop,TS val 6159092 ecr 6158788], length 1448

OFPT_PACKET_OUT (xid=0x0): in_port=1 actions_len=8 actions=FLOOD data_len=66
00:00:00:00:00:14 > 00:00:00:00:00:39, ethertype IPv4 (0x0800), length 66: 10.0.0.14.40026 > 10.0.0.39.54965: Flags [.], ack 3554993800, win 5453, options [nop,nop,TS val 6159125 ecr 6158856], length 0

OFPT_PACKET_OUT (xid=0x0): in_port=1 actions_len=8 actions=FLOOD data_len=1514
00:00:00:00:00:03 > 00:00:00:00:00:24, ethertype IPv4 (0x0800), length 1514: 10.0.0.3.43283 > 10.0.0.24.52886: Flags [.], seq 76001347:76002795, ack 2199864709, win 229, options [nop,nop,TS val 6159092 ecr 6158788], length 1448

OFPT_PACKET_OUT (xid=0x0): in_port=1 actions_len=8 actions=FLOOD data_len=66
00:00:00:00:00:14 > 00:00:00:00:00:39, ethertype IPv4 (0x0800), length 66: 10.0.0.14.40026 > 10.0.0.39.54965: Flags [.], ack 3554996696, win 5453, options [nop,nop,TS val 6159125 ecr 6158856], length 0

OFPT_PACKET_OUT (xid=0x0): in_port=1 actions_len=8 actions=FLOOD data_len=1514
00:00:00:00:00:03 > 00:00:00:00:00:24, ethertype IPv4 (0x0800), length 1514: 10.0.0.3.43283 > 10.0.0.24.52886: Flags [.], seq 76002795:76004243, ack 2199864709, win 229, options [nop,nop,TS val 6159094 ecr 6158803], length 1448

OFPT_PACKET_OUT (xid=0x0): in_port=1 actions_len=8 actions=FLOOD data_len=1514
00:00:00:00:00:03 > 00:00:00:00:00:24, ethertype IPv4 (0x0800), length 1514: 10.0.0.3.43283 > 10.0.0.24.52886: Flags [.], seq 76004243:76005691, ack 2199864709, win 229, options [nop,nop,TS val 6159094 ecr 6158803], length 1448

OFPT_PACKET_OUT (xid=0x0): in_port=1 actions_len=8 actions=FLOOD data_len=1514
00:00:00:00:00:03 > 00:00:00:00:00:24, ethertype IPv4 (0x0800), length 1514: 10.0.0.3.43283 > 10.0.0.24.52886: Flags [.], seq 76005691:76007139, ack 2199864709, win 229, options [nop,nop,TS val 6159094 ecr 6158803], length 1448

OFPT_PACKET_OUT (xid=0x0): in_port=1 actions_len=8 actions=FLOOD data_len=1514
00:00:00:00:00:03 > 00:00:00:00:00:24, ethertype IPv4 (0x0800), length 1514: 10.0.0.3.43283 > 10.0.0.24.52886: Flags [.], seq 76007139:76008587, ack 2199864709, win 229, options [nop,nop,TS val 6159094 ecr 6158803], length 1448

OFPT_PACKET_OUT (xid=0x0): in_port=1 actions_len=8 actions=FLOOD data_len=66
00:00:00:00:00:31 > 00:00:00:00:00:32, ethertype IPv4 (0x0800), length 66: 10.0.0.31.46349 > 10.0.0.32.53889: Flags [.], ack 3924121582, win 951, options [nop,nop,TS val 6159165 ecr 6159091], length 0

OFPT_PACKET_OUT (xid=0x0): in_port=1 actions_len=8 actions=FLOOD data_len=1514
00:00:00:00:00:39 > 00:00:00:00:00:14, ethertype IPv4 (0x0800), length 1514: 10.0.0.39.54965 > 10.0.0.14.40026: Flags [.], seq 3555289192:3555290640, ack 2979759350, win 229, options [nop,nop,TS val 6159165 ecr 6158907], length 1448

OFPT_PACKET_OUT (xid=0x0): in_port=1 actions_len=8 actions=FLOOD data_len=1514
00:00:00:00:00:39 > 00:00:00:00:00:14, ethertype IPv4 (0x0800), length 1514: 10.0.0.39.54965 > 10.0.0.14.40026: Flags [.], seq 3555290640:3555292088, ack 2979759350, win 229, options [nop,nop,TS val 6159165 ecr 6158907], length 1448

OFPT_PACKET_OUT (xid=0x0): in_port=1 actions_len=8 actions=FLOOD data_len=1514
00:00:00:00:00:39 > 00:00:00:00:00:14, ethertype IPv4 (0x0800), length 1514: 10.0.0.39.54965 > 10.0.0.14.40026: Flags [.], seq 3555292088:3555293536, ack 2979759350, win 229, options [nop,nop,TS val 6159176 ecr 6158917], length 1448

OFPT_PACKET_OUT (xid=0x0): in_port=1 actions_len=8 actions=FLOOD data_len=1514
00:00:00:00:00:39 > 00:00:00:00:00:14, ethertype IPv4 (0x0800), length 1514: 10.0.0.39.54965 > 10.0.0.14.40026: Flags [.], seq 3555293536:3555294984, ack 2979759350, win 229, options [nop,nop,TS val 6159176 ecr 6158917], length 1448

OFPT_PACKET_OUT (xid=0x0): in_port=1 actions_len=8 actions=FLOOD data_len=1514
00:00:00:00:00:39 > 00:00:00:00:00:14, ethertype IPv4 (0x0800), length 1514: 10.0.0.39.54965 > 10.0.0.14.40026: Flags [.], seq 3555294984:3555296432, ack 2979759350, win 229, options [nop,nop,TS val 6159176 ecr 6158921], length 1448

OFPT_PACKET_OUT (xid=0x0): in_port=1 actions_len=8 actions=FLOOD data_len=1514
00:00:00:00:00:39 > 00:00:00:00:00:14, ethertype IPv4 (0x0800), length 1514: 10.0.0.39.54965 > 10.0.0.14.40026: Flags [.], seq 3555296432:3555297880, ack 2979759350, win 229, options [nop,nop,TS val 6159176 ecr 6158921], length 1448

OFPT_PACKET_OUT (xid=0x0): in_port=1 actions_len=8 actions=FLOOD data_len=1514
00:00:00:00:00:39 > 00:00:00:00:00:14, ethertype IPv4 (0x0800), length 1514: 10.0.0.39.54965 > 10.0.0.14.40026: Flags [.], seq 3555297880:3555299328, ack 2979759350, win 229, options [nop,nop,TS val 6159176 ecr 6158921], length 1448

OFPT_PACKET_OUT (xid=0x0): in_port=1 actions_len=8 actions=FLOOD data_len=1514
00:00:00:00:00:39 > 00:00:00:00:00:14, ethertype IPv4 (0x0800), length 1514: 10.0.0.39.54965 > 10.0.0.14.40026: Flags [.], seq 3555299328:3555300776, ack 2979759350, win 229, options [nop,nop,TS val 6159176 ecr 6158921], length 1448

OFPT_PACKET_OUT (xid=0x0): in_port=1 actions_len=8 actions=FLOOD data_len=1514
00:00:00:00:00:39 > 00:00:00:00:00:14, ethertype IPv4 (0x0800), length 1514: 10.0.0.39.54965 > 10.0.0.14.40026: Flags [.], seq 3555300776:3555302224, ack 2979759350, win 229, options [nop,nop,TS val 6159176 ecr 6158921], length 1448

OFPT_PACKET_IN (xid=0x0): total_len=66 in_port=5 (via action) data_len=66 (unbuffered)
priority0:tunnel0:in_port0005:tci(0) mac00:00:00:00:00:24->00:00:00:00:00:03 type0800 proto6 tos0 ttl64 ip10.0.0.24->10.0.0.3 port52886->43283
00:00:00:00:00:24 > 00:00:00:00:00:03, ethertype IPv4 (0x0800), length 66: 10.0.0.24.52886 > 10.0.0.3.43283: Flags [.], ack 75997003, win 6200, options [nop,nop,TS val 6159462 ecr 6159092], length 0
OFPT_PACKET_IN (xid=0x0): total_len=54 in_port=11 (via action) data_len=54 (unbuffered)
priority0:tunnel0:in_port000b:tci(0) mac00:00:00:00:00:30->00:00:00:00:00:28 type0800 proto6 tos0 ttl64 ip10.0.0.30->10.0.0.28 port43694->55548
00:00:00:00:00:30 > 00:00:00:00:00:28, ethertype IPv4 (0x0800), length 54: 10.0.0.30.43694 > 10.0.0.28.55548: Flags [R], seq 2966268722, win 0, length 0
OFPT_PACKET_IN (xid=0x0): total_len=66 in_port=5 (via action) data_len=66 (unbuffered)
priority0:tunnel0:in_port0005:tci(0) mac00:00:00:00:00:24->00:00:00:00:00:03 type0800 proto6 tos0 ttl64 ip10.0.0.24->10.0.0.3 port52886->43283
00:00:00:00:00:24 > 00:00:00:00:00:03, ethertype IPv4 (0x0800), length 66: 10.0.0.24.52886 > 10.0.0.3.43283: Flags [.], ack 75999899, win 6200, options [nop,nop,TS val 6159462 ecr 6159092], length 0
OFPT_PACKET_IN (xid=0x0): total_len=54 in_port=11 (via action) data_len=54 (unbuffered)
priority0:tunnel0:in_port000b:tci(0) mac00:00:00:00:00:30->00:00:00:00:00:28 type0800 proto6 tos0 ttl64 ip10.0.0.30->10.0.0.28 port43694->55548
00:00:00:00:00:30 > 00:00:00:00:00:28, ethertype IPv4 (0x0800), length 54: 10.0.0.30.43694 > 10.0.0.28.55548: Flags [R], seq 2966268722, win 0, length 0
OFPT_PACKET_IN (xid=0x0): total_len=66 in_port=5 (via action) data_len=66 (unbuffered)
priority0:tunnel0:in_port0005:tci(0) mac00:00:00:00:00:24->00:00:00:00:00:03 type0800 proto6 tos0 ttl64 ip10.0.0.24->10.0.0.3 port52886->43283
00:00:00:00:00:24 > 00:00:00:00:00:03, ethertype IPv4 (0x0800), length 66: 10.0.0.24.52886 > 10.0.0.3.43283: Flags [.], ack 76002795, win 6200, options [nop,nop,TS val 6159462 ecr 6159092], length 0
OFPT_PACKET_IN (xid=0x0): total_len=54 in_port=11 (via action) data_len=54 (unbuffered)
priority0:tunnel0:in_port000b:tci(0) mac00:00:00:00:00:30->00:00:00:00:00:28 type0800 proto6 tos0 ttl64 ip10.0.0.30->10.0.0.28 port43694->55548
00:00:00:00:00:30 > 00:00:00:00:00:28, ethertype IPv4 (0x0800), length 54: 10.0.0.30.43694 > 10.0.0.28.55548: Flags [R], seq 2966268722, win 0, length 0
OFPT_PACKET_IN (xid=0x0): total_len=66 in_port=5 (via action) data_len=66 (unbuffered)
priority0:tunnel0:in_port0005:tci(0) mac00:00:00:00:00:24->00:00:00:00:00:03 type0800 proto6 tos0 ttl64 ip10.0.0.24->10.0.0.3 port52886->43283
00:00:00:00:00:24 > 00:00:00:00:00:03, ethertype IPv4 (0x0800), length 66: 10.0.0.24.52886 > 10.0.0.3.43283: Flags [.], ack 76005691, win 6200, options [nop,nop,TS val 6159462 ecr 6159094], length 0
OFPT_PACKET_IN (xid=0x0): total_len=54 in_port=11 (via action) data_len=54 (unbuffered)
priority0:tunnel0:in_port000b:tci(0) mac00:00:00:00:00:30->00:00:00:00:00:28 type0800 proto6 tos0 ttl64 ip10.0.0.30->10.0.0.28 port43694->55548
00:00:00:00:00:30 > 00:00:00:00:00:28, ethertype IPv4 (0x0800), length 54: 10.0.0.30.43694 > 10.0.0.28.55548: Flags [R], seq 2966268722, win 0, length 0
OFPT_PACKET_IN (xid=0x0): total_len=66 in_port=5 (via action) data_len=66 (unbuffered)
priority0:tunnel0:in_port0005:tci(0) mac00:00:00:00:00:24->00:00:00:00:00:03 type0800 proto6 tos0 ttl64 ip10.0.0.24->10.0.0.3 port52886->43283
00:00:00:00:00:24 > 00:00:00:00:00:03, ethertype IPv4 (0x0800), length 66: 10.0.0.24.52886 > 10.0.0.3.43283: Flags [.], ack 76008587, win 6200, options [nop,nop,TS val 6159462 ecr 6159094], length 0
OFPT_PACKET_IN (xid=0x0): total_len=54 in_port=11 (via action) data_len=54 (unbuffered)
priority0:tunnel0:in_port000b:tci(0) mac00:00:00:00:00:30->00:00:00:00:00:28 type0800 proto6 tos0 ttl64 ip10.0.0.30->10.0.0.28 port43694->55548
00:00:00:00:00:30 > 00:00:00:00:00:28, ethertype IPv4 (0x0800), length 54: 10.0.0.30.43694 > 10.0.0.28.55548: Flags [R], seq 2966268722, win 0, length 0
OFPT_PACKET_IN (xid=0x0): total_len=1514 in_port=1 (via action) data_len=1514 (unbuffered)
priority0:tunnel0:in_port0001:tci(0) mac00:00:00:00:00:32->00:00:00:00:00:31 type0800 proto6 tos0 ttl64 ip10.0.0.32->10.0.0.31 port53889->46349
00:00:00:00:00:32 > 00:00:00:00:00:31, ethertype IPv4 (0x0800), length 1514: 10.0.0.32.53889 > 10.0.0.31.46349: Flags [.], seq 3924176606:3924178054, ack 2904704569, win 229, options [nop,nop,TS val 6159244 ecr 6159189], length 1448
OFPT_PACKET_IN (xid=0x0): total_len=74 in_port=8 (via action) data_len=74 (unbuffered)
priority0:tunnel0:in_port0008:tci(0) mac00:00:00:00:00:27->00:00:00:00:00:02 type0800 proto6 tos0 ttl64 ip10.0.0.27->10.0.0.2 port33400->12865
00:00:00:00:00:27 > 00:00:00:00:00:02, ethertype IPv4 (0x0800), length 74: 10.0.0.27.33400 > 10.0.0.2.12865: Flags [S], seq 665622175, win 29200, options [mss 1460,sackOK,TS val 6159487 ecr 0,nop,wscale 7], length 0
OFPT_PACKET_IN (xid=0x0): total_len=1514 in_port=1 (via action) data_len=1514 (unbuffered)
priority0:tunnel0:in_port0001:tci(0) mac00:00:00:00:00:39->00:00:00:00:00:14 type0800 proto6 tos0 ttl64 ip10.0.0.39->10.0.0.14 port54965->40026
00:00:00:00:00:39 > 00:00:00:00:00:14, ethertype IPv4 (0x0800), length 1514: 10.0.0.39.54965 > 10.0.0.14.40026: Flags [.], seq 3555350008:3555351456, ack 2979759350, win 229, options [nop,nop,TS val 6159244 ecr 6158970], length 1448
